,Unnamed: 0,name,area,min_salary,max_salary,employer,published_at,experience,schedule,employment,description,requirements,duties,conditions,key_skills,days
712,712,ios,Новосибирск,100772.72727272726,139642.85714285713,MERA,2019-10-11T17:00:18+0300,От 1 года до 3 лет,Гибкий график,Полная занятость,"Разработка POS-решений на платформе iPad Долгосрочный, стабильный проект по развитию и поддержке передовой POS-системы от одного из мировых лидеров в этой области. Заказчик находится в Северной Америке, с несколькими R&amp;D центрами по всему миру. Команда MERA полностью отвечает за все области решения, включая мобильный/веб-интерфейс, серверную часть в облаке, тестирование продукта и DevOps услуги. С помощью нашего POS-решения ежедневно тысячи магазинов обслуживают своих покупателей по всему миру. Приложение успешно используется в крупных розничных и ресторанных сетях, а также адаптируется под нужды других видов бизнеса. POS-решение работает на устройствах iOS/Android и доступно в качестве веб-клиента. В процессе разработки привлекаются новейшие технологии, позволяющие принимать бесконтактные платежи, работать в режиме оффлайн и интегрироваться с многочисленными сторонними программными и аппаратными системами. В связи с расширением проекта мы ищем опытного iOS специалиста для работы с мобильным front-end POS системы. Вы станете частью команды MERA, ведущей разработку и поддержку iOS приложений в сотрудничестве с лидером по предоставлению POS (Point-Of-Sale) решений на рынках Северной Америки, Европы и Азии. Мы предлагаем работу в долгосрочном и стабильном проекте, интересные задачи, возможность профессионального и карьерного роста. Рассмотрим кандидатов для переезда в г.Нижний Новгород. Готовы частично помочь с переездом. Ваши задачи : Разработка, развитие и поддержка мобильных приложений на платформе iOS Активное участие в проектировании архитектуры приложения Оптимизация производительности системы, анализ узких мест и возможных ограничений, рефакторинг приложения Применение инженерных best practices и современных подходов к разработке ПО Работа в интернациональной Agile команде, регулярное общение на английском языке с представителями заказчика и разработчиками из США и Европы Необходимые навыки : Опыт разработки под iOS от 3х лет; Знание Objective-C (архитектура, принципы разработки), iOS SDK, Apple HIG, UIKit, XML, JSON, SQLite Навык эффективной работы с системой контроля версий (Git) Опыт использования практик: unit testing, code review, continuous integration Разговорный и письменный английский, достаточный для общения с заказчиком и участия в митингах Будет плюсом : Опыт работы в Point of Sale или Payment processing Опыт интеграции стороннего оборудования и сторонних API (REST, SOAP) с iOS приложением Портфолио работ или ссылки в AppStore на реализованные приложения Мы предлагаем: Работу в крупнейшей частной российской компании, специализирующейся на разработке заказного ПО в различных сферах: Telecommunications, Internet of Things &amp; Industrial Automation, Automotive &amp; Transport, Fintech Cоциальный пакет с ДМС для сотрудников компании Гибкий график, демократичный стиль управления и дружную команду Офисы в верхней или нижней части города, корпоративный автобус, столовую, медицинский кабинет, зоны отдыха Поддержку здорового образа жизни: корпоративный тренажерный зал, льготное членство в фитнес-клубах Физкульт и World Class, участие в различных спортивных мероприятиях (городских и корпоративных) Возможность профессионального обучения и развития: корпоративные программы обучения, технические митапы и многое другое",Без требований,Без обязанностей,Без условий,iOS|Git|Objective-C,7
422,422,ios,Новосибирск,100772.72727272726,139642.85714285713,РобоФинанс,2019-10-15T14:19:09+0300,От 3 до 6 лет,Полный день,Полная занятость,"Robofinance - разработчик fintech-продуктов, решений и технологий международного сервиса онлайн-кредитования. Компании нашей группы запущены и успешно работают в 8 странах мира (Россия, Казахстан, Испания, Латвия, Филиппины, Индонезия, Вьетнам, Индия). Мы постоянно расширяем географию нашего присутствия, выходим на новые рынки, ставим перед собой новые амбициозные задачи. Почему к нам? Высоконагруженный сервис - более 7 000 000 посещений сайтов ежемесячно. Используем современный стек технологий. На данный момент готовы рассмотреть в нашу команду IOS - разработчика на один из наших высоконагруженых проектов. Чем будем заниматься? Поддержка существующего приложения; Разработка новой функциональности; Проектирование архитектурных модулей системы. От вас мы ожидаем: Опыт разработки мобильных приложений под iOS от 1.5 лет; Опыт распределенной разработки (Git); Умение работать с JSON, REST. Опыт разработки клиент-серверных приложений; Знание iOS SDK 10; Знание iOS UI design guidelines; Понимание и применение ООП, знание шаблонов проектирования (MVP, MVVM, VIPER); Обязательно знание английского языка на уровне чтения технической документации. Будет плюсом: iOS SDK 10; Применение методик автоматизированного тестирования кода и интерфейса; Опыт работы в Agile-проектах, в том числе с инженерными практиками Agile. Пара слов о том, как мы работаем: Используем современный стек технологий; Даем возможность разрабатывать и внедрять собственные фичи; Помогаем совершенствовать разговорный английский. Что мы предлагаем: Опыт работы в международной IT-компании; Официальное трудоустройство в соответствии с ТК РФ, “белая” заработная плата; Рост дохода по результатам работы; Комфортный график (начало рабочего дня с 09:00 до 11:00); ДМС после испытательного срока; Корпоративные занятия английским языком и возможность использовать язык в работе (наши коллеги в других странах говорят на английском); Возможность посещать профильные внешние конференции, а также внутренние мероприятия по обмену опытом; Благоустроенный офис в центральном районе с парковкой, в офисе кухонная зона, дартс, турник; Бесплатный чай, кофе, шоколадки, йогурты, фрукты; Рабочее место в г. Новосибирск или г. Кемерово. Для кандидатов с переездом предлагаем релокационный пакет.",Без требований,Без обязанностей,Без условий,Без ключевых навыков,3
380,380,ios,Новосибирск,100772.72727272726,139642.85714285713,Drom,2019-09-27T02:16:55+0300,От 1 года до 3 лет,Полный день,Полная занятость,"Drom.ru — это автомобильный интернет-портал федерального уровня. Ежедневно сайт посещает более 3 миллионов пользователей. Нам 20 лет, и мы продолжаем активно расти. В связи с расширением штата ищем разработчика приложений под iOS. Некоторые наши iOS-проекты: Дром Авто Приложение позволяет легко и быстро купить или продать автомобиль со смартфона или планшета. В базе объявлений Drom.ru уже более 600 000 предложений со всей России. Приложение написано на Objective-C, но новый код пишем только на Swift. Дром ПДД Приложение для тех, кто ещё учится в автошколе или готовится к экзамену в ГИБДД. Приложение написано на Objective-C. Дром Штрафы Приложение для проверки и оплаты штрафов ГИБДД. Написано полностью на Swift. Чем будем заниматься: - разрабатывать и поддерживать iOS-приложения; - дорабатывать и писать фреймворки, используемые в приложениях; - участвовать в кодревью команды; - обсуждать новые фичи и требования; - взаимодействовать с нашими командами продуктовой разработки (Владивосток, Томск, Новосибирск); - осваивать новые технологи, решать интересные и сложные задачи в ведущей IT-компании Дальнего Востока по разработке highload web-проектов. Мы ищем iOS-разработчика, который: - имеет опыт создания приложений под iOS; - знает Swift для написания нового кода и Objective-C для поддержки старого; - понимает базовые алгоритмы, ООП, шаблоны проектирования, парадигмы MVC; - умеет работать в команде и с чужим кодом, а также с системами контроля версий (мы используем Git). Плюсом будут: - опубликованные приложения в AppStore или активная страница на GitHub; - понимание AppStore Review Guidelines и Human Interface Guidelines; - знание архитектур VIPER, MVVM и других подходов к разработке приложений; -любовь к Unit-тестам и не только; А ещё круче будет, если в добавок тебе интересно пользовательское взаимодействие и интерфейсы, и ты готов расти в этом направлении Кто мы? Мы работаем над интересными и уникальными проектами. Используем Scrum и Kanban. Постоянно учимся новому, обмениваемся опытом, помогаем друг другу в реализации задач. Мы работаем в БЦ Новая высота (10 минут до метро). У нас есть уютная офисная кухня, на которой всегда есть кофе и полный холодильник; турники, спортивная стенка, кресло-мешки и многое другое. Мы носим кроксы, шорты и прочий нерегламентированный &quot;дресс-код&quot;. Мы ездим на конференции, смотрим в офисе вебинары на большом мониторе, покупаем всю нужную литературу. Тебя ждет: - полностью официальная зарплата, оформление по ТК РФ с первого дня работы, гибкий график и плавающее начало дня (с 8 до 10 утра); - уровень дохода, достойный твоей квалификации, определится по результатам собеседования и будет периодически расти. Напиши нам о себе. Присылай резюме, даже если ты не уверен в своих силах, мы готовы рассмотреть вариант обучения разработчиков без опыта, но с сильной теоретической базой и желанием работать в данном направлении. Нет резюме? Не страшно! Можно просто откликнуться на нашу вакансию, направить ссылки на профили в GitHub, StackOverflow, Хабр, а также на твои работы в AppStore. Будем рады пообщаться!",Без требований,Без обязанностей,Без условий,Objective-C|Git|ООП|MVC|iOS|Scrum,21
41,41,ios,Новосибирск,100772.72727272726,139642.85714285713,МобайлДевелопмент (IceRock Development),2019-10-08T07:22:26+0300,От 3 до 6 лет,Удаленная работа,Частичная занятость,"IceRock Development разрабатывает мобильные и Web приложения. Компания обладает обширной географией проектов (Россия, USA, Европа и т.д.), а наш подход к работе дает большой простор для осуществления сложных архитектурных решений. На текущий момент мы в поиске iOS developer-a к нам в компанию для работы удаленно. Чем ты будешь заниматься в нашей команде: В команде и самостоятельно вести разработку проектов на платформе iOS; Выбирать технологические решения для разработки проектов на платформе. Осуществлять декомпозицию и оценку скоупа задач; Соблюдать регламенты работы; Что мы хотим видеть у тебя : Практический опыт в разработке на платформе iOS от 3-х лет (знание swift); Опыт коммерческой разработки; Знание архитектур MVP. MVM, MVVM, уверенное знание iOS SDK, Xcode; Технический английский; Внимательность, ответственность; Будет плюсом: Наличие портфолио завершенных и опубликованных проектов; Возможности вместе с нами: Работа на интересных проектах с профессиональной командой; Работа по гибкому графику и с официальным трудоустройством; Если вы ищете удаленную работу и готовы пройти техническое интервью - ждем ваш отклик.",Без требований,Без обязанностей,Без условий,Objective-C|iOS|Git|Atlassian Jira|ООП|swift,10
941,941,ios,Новосибирск,100772.72727272726,139642.85714285713,Improve group,2019-10-15T13:38:20+0300,От 1 года до 3 лет,Полный день,Полная занятость,"Привет, я Диана, технический директор в Improve Digital, и я ищу iOS-разработчика уровня middle (ну или почти middle :)) Ищу хорошего специалиста, который будет готов писать новые и поддерживать боевые проекты на swift и obj-c в нашей крутой команде . Это не значит, что мы бросим тебя на амбразуру, напротив, у нас хорошо налажена адаптация, менторство и процесс ввода новичка в команду. Но мы доверяем тебе как профессионалу, поэтому наряду с довольно высокими требованиями даём свободу и ответственность. Хотелось бы, чтобы у тебя был опыт коммерческой разработки под iOS 1+ года, чтобы ты умел работать с системами контроля версий (git, svn), ведения проектов (jira, redmine), а также знал нативные библиотеки (UIKit, CoreData,GCD/NSOperation, ReactiveCocoa, Xib / Storyboards и тд) . Умение слушать, читать и писать по-английски хотя бы на среднем уровне (часть проектов международные) будет большим плюсом. Чем предстоит заниматься: Разрабатывать мобильные приложения под iOS. Планировать и оценивать задачи. Проектировать архитектуру приложений и работать над UI/UX вместе c project менеджером и дизайнером. Взаимодействовать с отделом тестирования. Мобильные решения от Improve есть у: СМСФинанс, 4finance (Швеция, Польша, Грузия, Финляндия, Испания), НТС (Добрянка-Бахетле), Совкомбанка; сейчас работаем с Первым каналом и брендом Sokolov, помогали с проектом Литресу, работаем с МТС-Банком. Как мы работаем Система грейдов: пересмотр уровня и зарплаты каждые полгода Опытные тимлиды и CTO, у которых есть чему поучиться Если хочешь, можешь стать ментором и развиваться в управление С первого дня работы оформляем тебя официально. Зарплата напрямую зависит от твоих навыков и умений, тут всё индивидуально Конечно, у нас гибкий график Есть ДМС со стоматологией Наш офис — в Технопарке на 3 и 7 этажах, в нём есть всё нужно для отличной рабочей жизни Будем рады тебе! Осталось только откликнуться. В письме отправь нам ссылку на своё портфолио на GP или git, чтобы мы могли посмотреть код. До связи!",Без требований,Без обязанностей,Без условий,Objective-C|Atlassian Jira|iOS|Git|Redmine,3
539,539,ios,Новосибирск,100772.72727272726,139642.85714285713,Noveo,2019-09-19T09:37:07+0300,От 1 года до 3 лет,Гибкий график,Полная занятость,"Проекты, на которые мы ищем разработчика: мультимедийное приложение. Проигрывание и запись видео, плавность воспроизведения, анимация, прелоадинг и кеширование, работа с CoreAudio, видеофильтрами и т.п. Стек: Swift; приложение для работы с датчиком, устанавливаемым внутри автомобиля. Стек: Swift + RxSwift + CoreBluetooth; группа продуктов для взаимодействия с внешними устройствами. Создание &quot;богатого&quot; интерфейса, взаимодействие с внешними устройствами на низком уровне, создание приложений, проходящих MFI-сертификацию. Стек: Swift + RxSwift + Objective С (немного) + даже иногда С++. Навыки и опыт: хорошее знание Swift; опыт коммерческой разработки iPhone/iPad-приложений от года; английский язык на уровне чтения технической документации. В iOS-отделе мы используем: coding language: Swift; architecture pattern: MVVM + RxSwift or VIPER; networking: Swift codable, Moya; data storage: CoreData, Realm; misc technologies: BLE, IoT; CI: GitLab, Fastlane, Jenkins; более 40 тестовых девайсов. В Noveo вас ждет: достойный уровень зарплаты и регулярный ее пересмотр на performance review; официальное трудоустройство, оплачиваемый отпуск и больничные; программа льготного кредитования для сотрудников; гибкий график работы; место работы на выбор в одном из офисов компании в Новосибирске (Академгородок или ст.м. &quot;Марашала Покрышкина&quot;); работа в профессиональной команде над интересными проектами; четко выстроенные процессы и методология разработки; возможность реализовывать свои знания в разнообразных проектах; внутреннее обучение; бесплатное изучение английского и французского языков в офисе компании в рабочее время; молодой дружелюбный коллектив; активное и позитивное отношение к жизни.",Без требований,Без обязанностей,Без условий,iOS|SQL|ООП,29
