,Unnamed: 0,name,area,min_salary,max_salary,employer,published_at,experience,schedule,employment,description,requirements,duties,conditions,key_skills,days
201,201,ios,Новосибирск,100000.0,139642.85714285713,Dialog,2019-10-14T06:52:23+0300,От 1 года до 3 лет,Полный день,Полная занятость,"Привет! Мы разрабатываем современное решение для эффективных коммуникаций в крупных компаниях, небольших командах и сообществах. Платформа dialog сочетает в себе привычные функции мессенджеров, высокий уровень безопасности и инструменты для автоматизации рутинных задач. В нашей компании dialog стал основным средством коммуникации. Мы пользуемся продуктом, который разрабатываем, и ежедневно улучшаем его. В нашу быстро растущую команду требуется IOS Developer для разработки клиентской части месседжинг платформы. Обязанности: разработка нового ядра мессенджера на Swift - RxSwift; разработка UI компонентов для iOS (UIKit, Texture); написание Unit-тестов; поддержка Legacy Ядра мессенджера при необходимости. Требования: Обязательно: знание основ Swift, Memory Management, Concurrency, UIKit; знание Архитектурных Паттернов программирования; понимание и применение SOLID принципов; знание основ реактивного программирования, использовать RxSwift. Желательно: опыт в разработке с применением RxSwift, Texture, gRPC, MVVM-C; опыт работать с Objective-C, Protobuff. Условия: белая зарплата и гибкий график; персональные снэки, а не просто печеньки (А что вы любите больше Нутеллу или протеиновые батончики?) ДМС со стоматологией (после прохождения испытательного срока); техника Apple для работы; релокационный пакет для иногородних; офис в Технопарке Академгородка или в центре города, на выбор; корпоративные уроки английского языка для всех сотрудников; супер-адекватная и профессиональная команда. Несколько слов о себе всегда, как огромный плюс!"," Обязательно: знание основ Swift, Memory Management, Concurrency, UIKit; знание Архитектурных Паттернов программирования; понимание и применение SOLID принципов; знание основ реактивного программирования, использовать RxSwift. Желательно: опыт в разработке с применением RxSwift, Texture, gRPC, MVVM-C; опыт работать с Objective-C, Protobuff. "," разработка нового ядра мессенджера на Swift - RxSwift; разработка UI компонентов для iOS (UIKit, Texture); написание Unit-тестов; поддержка Legacy Ядра мессенджера при необходимости. "," белая зарплата и гибкий график; персональные снэки, а не просто печеньки (А что вы любите больше Нутеллу или протеиновые батончики?) ДМС со стоматологией (после прохождения испытательного срока); техника Apple для работы; релокационный пакет для иногородних; офис в Технопарке Академгородка или в центре города, на выбор; корпоративные уроки английского языка для всех сотрудников; супер-адекватная и профессиональная команда. Несколько слов о себе всегда, как огромный плюс!",Без ключевых навыков,4
619,619,ios,Новосибирск,100000.0,139642.85714285713,Movavi,2019-10-13T21:57:16+0300,От 1 года до 3 лет,Гибкий график,Полная занятость,"Новосибирская IT-компания Movavi создает и продает программы для любительской обработки мультимедиа. Movavi Video Editor, Photo Editor, Video Converter, Screen Capture - одни из самых популярных продуктов в мире, ими пользуются в 200 странах. Наши программы помогают миллионам людей легко обрабатывать фото и видео, не требуя специальных знаний и навыков. Мы счастливы представлять Новосибирск на мировой IT-карте! Наши проекты развиваются, наши команды растут и мы ищем сильных разработчиков для запуска новых продуктов, чтобы вместе создавать самый популярный софт для мультимедиа! Чем предстоит заниматься: разрабатывать мобильные приложения (видеоредактор, фоторедактор, PDF-сканер и другие приложения); изучать и внедрять новые, современные технологии; делиться знаниями с коллегами и повышать свой профессионализм; проводить code review; взаимодействовать с отделами тестирования и дизайна. Для успешного выполнения задач тебе потребуется: опыт разработки под iOS от 3-х лет; опыт работы с Git; Objective-C/ Swift; знание и опыт работы с iOS SDK, Xcode; многопоточное программирование; умение работать с CocoaPods; стремление постоянно улучшать свои знания и навыки. Будет круто, если у тебя есть: опыт работы с AVFoundation; знание шаблонов и принципов проектирования; опыт применения Unit-тестирования, SOLID, CI; опыт работы в командах, желательно Scrum/Agile/Lean. Работа в Movavi - это: команда профессионалов, готовых делиться знаниями и опытом; индивидуальный подход к профессиональному росту и развитию внутри компании; официальное трудоустройство с первого рабочего дня; белая заработная плата + компенсация питания и спорта; удобный график работы как для &quot;жаворонков&quot;, так и для &quot;сов&quot;; занятия йогой и английским языком, не выходя из офиса; здоровье с ДМС; обучение детей в IT-школе Movavi; приятная рабочая атмосфера, общение на &quot;ты&quot;; бодрящие корпоративы: горы и ели, море и пальмы, и никакого алкоголя. Хочешь 70K? Это не розыгрыш. Мы готовы тебе их дать! Порекомендуй нашу вакансию своему другу или знакомому, пришли его резюме на почту (см.контактную информацию) с пометкой &quot;Внешняя рекомендация на позицию Senior iOS Developer&quot; и получи бонус : 70 000р. за Senior-разработчика, после прохождения им испытательного срока. * Друг должен знать, что его рекомендуют. Если ты не получил ответ на отклик в течение 3-х рабочих дней: 1. Проверь папку &quot;Спам&quot; в электронной почте. Возможно, письмо с ответом оказалось там. 2. Позвони или напиши нам.",Без требований,Без обязанностей,Без условий,iOS|Git|Objective-C|Разработка ПО|Swift,4
904,904,ios,Новосибирск,100772.72727272726,139642.85714285713,Azoft,2019-10-11T09:37:49+0300,Нет опыта,Гибкий график,Полная занятость,"17 лет компания Azoft работает на рынке международного IT-аутсорсинга, предоставляя услуги разработки компьютерного и мобильного ПО для компаний по всему миру. Наши клиенты - компании из США , Великобритании, Австралии, России и др. Команда Azoft - увлеченные люди, разбирающиеся в современных технологиях, готовые осваивать новое и помогать другим. Хочешь стать профессиональным iOS разработчиком? Знаешь основы программирования и знаком с Swift? Мечтаешь испытать себя в проектах для мировых и российских брендов? Мы готовы взять толкового junior&#39;а и научить всему, что знаем сами! Чем предстоит заниматься: Разрабатывать под iOS на Swift и Objective-C коммерческие и внутренние проекты Компании Разрабатывать реальные мобильные приложения для заказчиков со всего мира, дорабатывать существующие приложения для клиентов компании Работать в тесном взаимодействии с командой серверной разработки, аналитиков и тестировщиков Мы предлагаем: Интересные проекты: web, mobile, RnD исследования Внимательного наставника, опытного руководителя, отзывчивых HR&#39;ов По-настоящему гибкий график работы Развитие сотрудников: митапы, конференции, English Забота о здоровье: 2 крутые команды - ИТ-футбол и ИТ-баскетбол, частичная компенсация абонементов в бассейн и фитнес-клубы Хороший отдых: совместные праздники и еженедельные Печенька-Party и сканворды Пожелания к будущему сотруднику: Желание разрабатывать приложения под iOS, готовность учиться, разбираться, развиваться Высшее или неполное высшее образование по направлениям математика, физика, информатика Знание основ Objective-C и/или Swift Опыт с iOS SDK Английский на уровне чтения документации",Без требований,Без обязанностей,Без условий,Английский язык|iOS|Objective-C|Swift,7
427,427,ios,Новосибирск,100772.72727272726,170000.0,Кадровое агентство Алексея Сухорукова,2019-10-14T09:09:11+0300,От 1 года до 3 лет,Полный день,Полная занятость,"Компания, занимающаяся разработкой мобильных продуктов для бизнеса, в т.ч. в сфере финтех, ищет в свою команду Middle и Senior IOS-разработчиков. Клиентами являются представители бизнеса России, Швеции, Германии, Финляндии, Польши и др. В компании стабильно появляются новые интересные проекты, которые чаще всего разрабатываются с нуля, что позволит тебе заниматься проектированием архитектуры и предлагать свои собственные решения. Со своей стороны компания предлагает команде приятную атмосферу и различные бонусы, подробнее о которых читай ниже. Компания ждёт от тебя: · Опыт коммерческой разработки под IOS от 1,5 лет Тебе предстоит: · Разработка мобильных приложений под IOS · Проектирование архитектуры приложений и итеративная работа над UI вместе с пиэмом и дизайнером Компания предлагает: · Разумеется, официальное трудоустройство · Гибкий график – компания ориентирована в первую очередь на результат · Прозрачную систему развития и возможность постоянного роста дохода (каждые полгода проходит пересмотр заработной платы) · ДМС со стоматологией · Корпоративное изучение английского языка в офисе компании · Частичная компенсация занятий фитнесом А ещё: · Участие в различных конференциях, meetup`ах, корпоративное обучение · Демократичную атмосферу и открытый, дружелюбный коллектив, где все на «ты», независимо от должности и возраста · Возможность решать любые вопросы напрямую, без лишней бюрократии · Выезды на природу и приятные поездки вместе с коллегами · Уютный офис в Технопарке (с диванчиками, кухней, гитарой, настолками, балансбордами и батутом) Заинтересовался? Оставляй отклик и мы обязательно с тобой свяжемся! Почему стоит обратиться именно к нам? ✓Прежде всего наши услуги бесплатны для кандидатов! ✓Мы более 10 лет занимаемся подбором IT-специалистов для крупнейших российских и международных компаний. А наш опыт по подбору сотрудников позволяет решать вопросы любого уровня сложности. ✓Мы умеем находить для компаний самых подходящих и по духу, и по техническим навыкам кандидатов. ✓ Мы можем предложить вам выбор вакансий и работодателей не только в Новосибирске, но и в разных странах. ✓И сможем помочь успешно трудоустроиться в той из них, которая больше всего нравится именно вам и на которую вы лучше всего подходите. ✓Нет, мы не занимаемся тем, что даем шпаргалки и решаем за кандидатов тестовые задания. Но скажем, как лучше подготовиться к прохождению собеседований и решению технических задач.",Без требований,Без обязанностей,Без условий,Swift|Objective C|iOS,4
70,70,ios,Новосибирск,100772.72727272726,139642.85714285713,Электронный город (ООО Новотелеком),2019-10-08T05:54:11+0300,От 1 года до 3 лет,Полный день,Полная занятость,"В &quot;Электронный город&quot; требуется Разработчик на проект мобильных приложений для управления умным домофоном и сопутствующими устройствами в проекте &quot;Мой дом&quot; О проекте: Мы ищем iOS-разработчика на проект &quot;Умный домофон&quot; Наш проект - это возможность изменить мир к лучшему. Привычные вещи сделать современными и удобными, понимающими тебя с полуслова. Или вовсе без слов. Уже в этом году мы несём домофон, не привязанный к архаичным технологиям, в десятки городов. Он уже управляется с мобильного, и вот-вот начнет узнавать своих и чужих по лицу и голосу. В перспективе это - полноценный умный двор, знающий привычки каждого жителя, и угадывающий его желания. Чтобы стать частью нашей команды, нужно знать: Знание iOS SDK, Human Interface Guidelines, Objective-C Опыт разработки клиент-серверных приложений (REST API, JSON, XML и т.д..) Знание ООП, паттернов проектирования, в том числе и архитектурных (MVC, MVP, MVVM, VIPER) Понимание модели управления памятью Cocoa Будет плюсом: Знание Swift, Dependency Injection, Socket, VoIP Push Dependency Injection Опыт написания Unit/UI тестов Условия работы: Рабочее место - офис по адресу ул. Семьи Шамшиных График работы - 5/2, 8-ми часовой рабочий день Официальное трудоустройство, белая заработная плата Плюшки и приятные бонусы: бесплатный интернет у Вас дома (при наличии технической возможности), возможность заниматься спортом",Без требований,Без обязанностей,Без условий,Android|Objective-C|SWIFT Alliance|iOS|iOS SDK,10
866,866,ios,Новосибирск,100772.72727272726,139642.85714285713,2ГИС,2019-10-01T06:34:51+0300,От 1 года до 3 лет,Полный день,Полная занятость,"Мы ищем разработчика в команду мобильного 2ГИС под iOS, который знает многое о современных технических трендах и новинках фреймворков, любит и лелеет своих пользователей, понимает Apple Human Interface Guidelines лучше нас, обладает умением самостоятельно находить решения задач, а также является инициативным для эффективной и продуктивной работы. Требования: отличное знание Swift уверенное знание Objective-C опыт разработки под iOS желание и стремление постоянно прокачивать свои знания и навыки. Компания предлагает: возможность гибкого графика работы; дружную команду, работающую по Scrum; современный станок Apple: mbpr 15”; офис в Технопарке Академгородка и Сан Сити; для иногородних кандидатов помощь в переезде; участие в конференциях, тренингах и внутренних семинарах; официальную заработную плату 2 раза в месяц. Немного об R&amp;D 2ГИС В Новосибирске у нас два больших офиса: этаж в Технопарке и одиннадцать этажей в Сан Сити. У нас нет дресс-кода и строгого графика. Кто-то приходит в 9, кто-то в 10, а кто-то когда удобно ему и команде. Главное, чтобы вы выполняли задачи в срок и были на связи с коллегами. Мы используем современные технологии и любим о них говорить. Выступаем на конференциях и сами их организуем. Уровень заработной платы определяется по результатам собеседования. Ждем ваших резюме!",Без требований,Без обязанностей,Без условий,iOS|Objective-C|Swift,17
