,Unnamed: 0,name,area,min_salary,max_salary,employer,published_at,experience,schedule,employment,description,requirements,duties,conditions,key_skills,days
114,114,ios,Новосибирск,80000.0,130000.0,Центр Цифровых Коммуникаций,2019-10-21T07:50:46+0300,От 1 года до 3 лет,Полный день,Полная занятость,"Cool – team: делаем мобильные приложения для рынка США. Актуальный продукт для тех, кто стремятся установить необходимые контакты и высоко ценит достоверность в общении! Наша команда активно растет и прямо сейчас в ней есть место для Middle iOS Developer, который может, умеет, практикует … мастерски разрабатывать на на Swift / Objective-C, желательно с практическим опытом от 2х лет и знанием iOS SDK, Human Interface Guidelines; хорошо понимать принципы ООП, SOLID, паттернов проектирования; разрабатывать клиент-серверных приложений (REST + WebSockets); комфортно работает в команде : постановка и декомпозиция задач, Git flow, code review; знает технический английский. Плюсом будет: опыт написания unit- и UI- тестов; опыт работы с записью/воспроизведением/оптимизацией видео/аудио, VoIP; опыт использования в приложениях облачных сервисов; понимание лучших практик в проектировании клиент-серверного API; знание современных тенденций в UX и UI. Работа в нашей команде - это: уникальный опыт создания, запуска и развития продукта на зарубежных рынках; увлекательные задачи, возможность использовать самые современные технологии разработки и исследований; честная зарплата и социальный пакет (отпускные, больничные, все необходимые налоговые отчисления, программа ДМС); широки возможности профессионального развития и обучения; современное рабочее место (27″ iMac 2017).",Без требований,Без обязанностей,Без условий,Java|kotlin|iOS|HTTP|iOS SDK,0
472,472,ios,Краснодар,100000.0,130000.0,MERA,2019-10-18T17:00:16+0300,От 1 года до 3 лет,Гибкий график,Полная занятость,"Разработка POS-решений на платформе iPad Долгосрочный, стабильный проект по развитию и поддержке передовой POS-системы от одного из мировых лидеров в этой области. Заказчик находится в Северной Америке, с несколькими R&amp;D центрами по всему миру. Команда MERA полностью отвечает за все области решения, включая мобильный/веб-интерфейс, серверную часть в облаке, тестирование продукта и DevOps услуги. С помощью нашего POS-решения ежедневно тысячи магазинов обслуживают своих покупателей по всему миру. Приложение успешно используется в крупных розничных и ресторанных сетях, а также адаптируется под нужды других видов бизнеса. POS-решение работает на устройствах iOS/Android и доступно в качестве веб-клиента. В процессе разработки привлекаются новейшие технологии, позволяющие принимать бесконтактные платежи, работать в режиме оффлайн и интегрироваться с многочисленными сторонними программными и аппаратными системами. В связи с расширением проекта мы ищем опытного iOS специалиста для работы с мобильным front-end POS системы. Вы станете частью команды MERA, ведущей разработку и поддержку iOS приложений в сотрудничестве с лидером по предоставлению POS (Point-Of-Sale) решений на рынках Северной Америки, Европы и Азии. Мы предлагаем работу в долгосрочном и стабильном проекте, интересные задачи, возможность профессионального и карьерного роста. Рассмотрим кандидатов для переезда в г.Нижний Новгород. Готовы частично помочь с переездом. Ваши задачи : Разработка, развитие и поддержка мобильных приложений на платформе iOS Активное участие в проектировании архитектуры приложения Оптимизация производительности системы, анализ узких мест и возможных ограничений, рефакторинг приложения Применение инженерных best practices и современных подходов к разработке ПО Работа в интернациональной Agile команде, регулярное общение на английском языке с представителями заказчика и разработчиками из США и Европы Необходимые навыки : Опыт разработки под iOS от 3х лет; Знание Objective-C (архитектура, принципы разработки), iOS SDK, Apple HIG, UIKit, XML, JSON, SQLite Навык эффективной работы с системой контроля версий (Git) Опыт использования практик: unit testing, code review, continuous integration Разговорный и письменный английский, достаточный для общения с заказчиком и участия в митингах Будет плюсом : Опыт работы в Point of Sale или Payment processing Опыт интеграции стороннего оборудования и сторонних API (REST, SOAP) с iOS приложением Портфолио работ или ссылки в AppStore на реализованные приложения Мы предлагаем: Работу в крупнейшей частной российской компании, специализирующейся на разработке заказного ПО в различных сферах: Telecommunications, Internet of Things &amp; Industrial Automation, Automotive &amp; Transport, Fintech Cоциальный пакет с ДМС для сотрудников компании Гибкий график, демократичный стиль управления и дружную команду Офисы в верхней или нижней части города, корпоративный автобус, столовую, медицинский кабинет, зоны отдыха Поддержку здорового образа жизни: корпоративный тренажерный зал, льготное членство в фитнес-клубах Физкульт и World Class, участие в различных спортивных мероприятиях (городских и корпоративных) Возможность профессионального обучения и развития: корпоративные программы обучения, технические митапы и многое другое",Без требований,Без обязанностей,Без условий,iOS|Git|Objective-C,3
997,997,ios,Екатеринбург,104333.33333333331,112000.0,СКБ ЛАБ,2019-10-19T08:53:54+0300,От 1 года до 3 лет,Гибкий график,Полная занятость,"SKB_Lab - это передовой IT-проект. Он создан для разработки абсолютно нового интернет-банка и мобильных приложений для него, как для физических, так и для юридических лиц. Если говорить про философию работы, то мы применяем agile подходы. Исходя из этого, можно сказать, что мы гибкие - у каждого есть возможность влиять на принятие решений в проектах! Вся команда, вместе с руководством, находится в офисе в Екатеринбурге, что, несомненно, влияет на скорость принятия решений, и отсутствие бюрократии. Мы ждем от вас: Опыт разработки под IOS от года Уверенное знание Swift, iOS SDK, XCode Знание форматов XML, JSON Умение работать с системой контроля версий Знание классических алгоритмов и структур данных Желателен опыт реализации собственных проектов под IOS Стремление повышать собственный уровень профессиональной квалификации Знание технического английского языка Что делать: Писать на Swift (никакого Objective-C) Руководить командой Разрабатывать новый функционал приложений Дорабатывать и поддерживать существующий функционал приложений Что предлагаем: Уровень дохода зависит от ваших навыков и технических знаний; Премии, не только по итогам года; Возможность развить &quot;профессиональную мускулатуру&quot;, работая вместе с профессионалами. Познакомиться с лучшими практиками; Возможность участвовать в развитии, предлагать идеи и технологии; Участие в мероприятиях для профессионального развития. Тренинги, учебные курсы; Удобное рабочее место с современной техникой; Компенсация занятий спортом; Оплата паркинга для автолюбителей, и Е-карта для пешеходов; Отличный офис с великолепным панорамным видом на город, кухней (фрукты, плюшки, чай, кофе прилагаются - как без глюкозы?;)) и зонами релакса; Велопарковка, душ, кикер, аэрохоккей, боксёрская груша и гимнастический станок; Отлаженные процессы. Минимум бюрократии; Лояльный график рабочего дня. Мы ценим: Тех, кто не боится ответственности Тех, кто работает на результат Тех, кто не требует микроменеджмента и постоянного менторства Тех, кто сказал, что все будет готово в пятницу, и финишировал в четверг вечером Тех, кто готов делиться своим опытом Красивый код Чувство юмора Ждем Вас в нашем офисе! Обсудим больше подробностей. При любых вопросах не стесняйтесь звонить или писать.",Без требований,Без обязанностей,Без условий,iOS|Xcode|SWIFT Alliance,2
429,429,ios,Краснодар,120000.0,130000.0,Новая клиника,2019-10-02T16:32:16+0300,Нет опыта,Гибкий график,Полная занятость,"Обязанности: Разработка приложении под IOS. Интеграция с облачной платформой VoxImplant для реализации видео звонков и чата. Взаимодействие с другими членами команды для решения возникающих проблем при разработке ПО. Требования: Знания Swift на уровне не ниже middle Навык эффективной работы с системой контроля версий (Git) Опыт разработки приложений, использующих сетевое взаимодействие (HTTP, REST API, JSON); Условия: График работы оговаривается с кандидатом;"," Знания Swift на уровне не ниже middle Навык эффективной работы с системой контроля версий (Git) Опыт разработки приложений, использующих сетевое взаимодействие (HTTP, REST API, JSON); ", Разработка приложении под IOS. Интеграция с облачной платформой VoxImplant для реализации видео звонков и чата. Взаимодействие с другими членами команды для решения возникающих проблем при разработке ПО. , График работы оговаривается с кандидатом;,Git|iOS|API,19
154,154,ios,Новосибирск,130000.0,130000.0,Movavi,2019-10-04T14:47:51+0300,От 1 года до 3 лет,Удаленная работа,Полная занятость,"Новосибирская IT-компания Movavi создает и продает программы для любительской обработки мультимедиа. Movavi Video Editor, Photo Editor, Video Converter, Screen Capture, мобильный видеоредактор Clips - одни из самых популярных продуктов в мире, ими пользуются в 200 странах. Наши программы помогают миллионам людей легко обрабатывать фото и видео, не требуя специальных знаний и навыков. Мы счастливы представлять Новосибирск на мировой IT-карте! Приглашаем тебя присоединиться к нашей команде и вместе с нами создавать одно из самый популярных приложений! Мы ищем разработчика на новый проект - мобильный PDF-редактор! Чем предстоит заниматься: разрабатывать мобильный PDF-редактор/сканер; изучать и внедрять новые, современные технологии; делиться знаниями с коллегами и повышать свой профессионализм; проводить code review; взаимодействовать с отделами тестирования и дизайна. Для успешного выполнения задач тебе потребуется: опыт разработки под iOS от 2-х лет; опыт работы с Git; Objective-C/Swift; знание и опыт работы с iOS SDK, Xcode; многопоточное программирование; стремление постоянно улучшать свои знания и навыки. Будет круто, если у тебя есть: знание шаблонов и принципов проектирования; умение работать с CocoaPods; опыт применения Unit-тестирования, SOLID, CI; опыт работы в командах, желательно Scrum/Agile/Lean. Работа в Movavi - это: команда профессионалов, готовых делиться знаниями и опытом; индивидуальный подход к профессиональному росту и развитию внутри компании; официальное трудоустройство с первого рабочего дня; белая заработная плата + компенсация питания и спорта; удобный график работы как для &quot;жаворонков&quot;, так и для &quot;сов&quot;; занятия йогой и английским языком, не выходя из офиса; здоровье с ДМС; обучение детей в IT-школе Movavi; приятная рабочая атмосфера, общение на &quot;ты&quot;; бодрящие корпоративы: горы и ели, море и пальмы, и никакого алкоголя. Хочешь 70K? Это не розыгрыш. Мы готовы тебе их дать! Порекомендуй нашу вакансию своему другу или знакомому, пришли его резюме на почту (см.контактную информацию) с пометкой &quot;Внешняя рекомендация на позицию Senior iOS Developer&quot; и получи бонус : 70 000р. за Senior-разработчика, после прохождения им испытательного срока. * Друг должен знать, что его рекомендуют. Если ты не получил ответ на отклик в течение 3-х рабочих дней: 1. Проверь папку &quot;Спам&quot; в электронной почте. Возможно, письмо с ответом оказалось там. 2. Позвони или напиши нам.",Без требований,Без обязанностей,Без условий,iOS|Git|Objective-C|Разработка ПО|Swift,17
54,54,ios,Новосибирск,135000.0,130000.0,MERA,2019-10-18T17:00:17+0300,От 1 года до 3 лет,Гибкий график,Полная занятость,"Разработка POS-решений на платформе iPad Долгосрочный, стабильный проект по развитию и поддержке передовой POS-системы от одного из мировых лидеров в этой области. Заказчик находится в Северной Америке, с несколькими R&amp;D центрами по всему миру. Команда MERA полностью отвечает за все области решения, включая мобильный/веб-интерфейс, серверную часть в облаке, тестирование продукта и DevOps услуги. С помощью нашего POS-решения ежедневно тысячи магазинов обслуживают своих покупателей по всему миру. Приложение успешно используется в крупных розничных и ресторанных сетях, а также адаптируется под нужды других видов бизнеса. POS-решение работает на устройствах iOS/Android и доступно в качестве веб-клиента. В процессе разработки привлекаются новейшие технологии, позволяющие принимать бесконтактные платежи, работать в режиме оффлайн и интегрироваться с многочисленными сторонними программными и аппаратными системами. В связи с расширением проекта мы ищем опытного iOS специалиста для работы с мобильным front-end POS системы. Вы станете частью команды MERA, ведущей разработку и поддержку iOS приложений в сотрудничестве с лидером по предоставлению POS (Point-Of-Sale) решений на рынках Северной Америки, Европы и Азии. Мы предлагаем работу в долгосрочном и стабильном проекте, интересные задачи, возможность профессионального и карьерного роста. Рассмотрим кандидатов для переезда в г.Нижний Новгород. Готовы частично помочь с переездом. Ваши задачи : Разработка, развитие и поддержка мобильных приложений на платформе iOS Активное участие в проектировании архитектуры приложения Оптимизация производительности системы, анализ узких мест и возможных ограничений, рефакторинг приложения Применение инженерных best practices и современных подходов к разработке ПО Работа в интернациональной Agile команде, регулярное общение на английском языке с представителями заказчика и разработчиками из США и Европы Необходимые навыки : Опыт разработки под iOS от 3х лет; Знание Objective-C (архитектура, принципы разработки), iOS SDK, Apple HIG, UIKit, XML, JSON, SQLite Навык эффективной работы с системой контроля версий (Git) Опыт использования практик: unit testing, code review, continuous integration Разговорный и письменный английский, достаточный для общения с заказчиком и участия в митингах Будет плюсом : Опыт работы в Point of Sale или Payment processing Опыт интеграции стороннего оборудования и сторонних API (REST, SOAP) с iOS приложением Портфолио работ или ссылки в AppStore на реализованные приложения Мы предлагаем: Работу в крупнейшей частной российской компании, специализирующейся на разработке заказного ПО в различных сферах: Telecommunications, Internet of Things &amp; Industrial Automation, Automotive &amp; Transport, Fintech Cоциальный пакет с ДМС для сотрудников компании Гибкий график, демократичный стиль управления и дружную команду Офисы в верхней или нижней части города, корпоративный автобус, столовую, медицинский кабинет, зоны отдыха Поддержку здорового образа жизни: корпоративный тренажерный зал, льготное членство в фитнес-клубах Физкульт и World Class, участие в различных спортивных мероприятиях (городских и корпоративных) Возможность профессионального обучения и развития: корпоративные программы обучения, технические митапы и многое другое",Без требований,Без обязанностей,Без условий,iOS|Git|Objective-C,3
