,Unnamed: 0,name,area,min_salary,max_salary,employer,published_at,experience,schedule,employment,description,requirements,duties,conditions,key_skills,days
335,335,ios,Новосибирск,100772.72727272726,139642.85714285713,Дневник.ру,2019-09-19T14:35:36+0300,От 1 года до 3 лет,Гибкий график,Полная занятость,"Дневник.ру - российская IT-компания с головным офисом в Санкт-Петербурге. Ключевой продукт компании &quot;Дневник.ру&quot; – закрытая защищённая цифровая образовательная платформа, в которой зарегистрировано большинство школ страны. Сегодня с платформой успешно работают 7,7 млн учащихся, 4 млн родителей и свыше 800 тыс. преподавателей из всех регионов России. По сути, нашим облачным решением пользуется каждая вторая школа. На данный момент у нас есть 3 мобильных приложения написанных на Swift с нуля. Мы планируем расширять возможности этих приложений. Мобильная команда &quot;Дневник.ру&quot; ищет опытного iOS разработчика, который будет ключевым мобильным разработчиком на проектах. Работа предполагает релокацию в г. Санкт-Петербург. Что необходимо: Уметь работать с Interface Builder, СocoaPods, fastlane и CI, универсальными приложениями и accessibility; Разбираться в больших фреймворках; Желание влиять на развитие продуктов; Преимуществом будет: Знание XMPP или другой опыт реализации чатов. Мы предлагаем: Высокий уровень компенсации (обсуждается индивидуально с каждым успешным кандидатом); Релокационный пакет; Работу над сложными и интересными проектами; Возможность непосредственно влиять на развитие продукта, привнося свои идеи в проект; Объективную оценку компетенций и достижений, возможность расти; Гибкий график (плавающее начало рабочего дня); Оформление по ТК РФ, «белая» заработная плата; Профессиональный и дружный коллектив; Корпоративные мероприятия; Офис в бизнес-центре А класса, в пешеходной доступности от метро Горьковская/Выборгская/Петроградская.",Без требований,Без обязанностей,Без условий,Interface Builder|iOS|CocoaPods|Swift|Fastlane|CI|Zeplin,29
333,333,ios,Новосибирск,100772.72727272726,139642.85714285713,Почта России,2019-09-20T11:57:40+0300,От 3 до 6 лет,Удаленная работа,Полная занятость,"Почта России – крупнейший работодатель страны. Нас более 335 000 человек. Мы находимся на этапе глобальной трансформации и стремимся к тому, чтобы сделать Почту России клиентоориентированной и технологичной компанией, надёжным и современным поставщиком почтовых, логистических и финансовых услуг для всей страны. Мы разрабатываем официальное мобильное приложение Почты России – приложение, которое помогает миллионам клиентов Почты России отслеживать посылки, получать уведомления о передвижении, заказывать доставку, вызывать курьера, сдавать без очереди и получать письма и посылки. В своей работе мы используем гибкие методологии, и подход JTBD, чтобы сделать наше приложение максимально удобным. Сейчас мы расширяем команду мобильной разработки в Почтовых Технологиях, чтобы поддержать стратегию развития Почты до 2023 года и ищем разработчиков, которые готовы принимать активное участие в создании одного из лучших продуктов в индустрии. Если у вас горят глаза от новых фич, анонсируемых на конференциях разработчиков WWDC или Google I/O, есть желание постоянно развиваться, умение работать в распределенной команде и портфолио реализованных проектов, то, возможно, мы ищем именно вас. Обеспечим интересными задачами: Участие в полном цикле разработки приложений; Взаимодействие с внутренними заказчиками; Обучение и консультация junior разработчиков. Ожидаем от вас следующие знания и компетенции: Опыт программирования под iOS от трех лет; Отличное знание Swift, Objective-C, iOS SDK, Application Lifecycle, распространенных фреймворков Опыт проектирования приложений с нуля; Понимание принципов работы HTTP, REST; Представления о методах обеспечения безопасности в мобильном приложении; Знакомство с принятыми и распространенными паттернами проектирования; Знания iOS Human Interface Guidelines; Опыт работы в команде; Умение учиться и обучать; Активные ссылки на приложения в AppStore. Взамен рады предложить: Работа в стабильной и успешной компании; Интересные задачи, дружный коллектив, перспективы профессионального и карьерного роста; Полное соблюдение ТК РФ; Достойный уровень вознаграждения по итогам собеседования; График работы: 5/2, возможна удаленная занятость; Расширенный ДМС после испытательного срока; Льготное кредитование в «Почта Банке», скидки у компаний-партнеров. Вакансия открыта на конкурсной основе.",Без требований,Без обязанностей,Без условий,Objective-C|iOS|Mac Os|Работа в команде|C/C++,28
182,182,ios,Новосибирск,100772.72727272726,139642.85714285713,Сайтсофт,2019-10-13T09:50:23+0300,От 1 года до 3 лет,Полный день,Полная занятость,"Компания «Сайтсофт» — один из признанных лидеров рынка в области разработки IT-решений для государственных организаций. Компания основана в 2005 году в Екатеринбурге. Наши основные направления деятельности: создание и поддержка интернет-проектов государственных организаций и крупного бизнеса, разработка мобильных приложений, продвижение в социальных сетях. Коллектив компании состоит из более 150 высококвалифицированных специалистов , работающих в офисах Москвы, Екатеринбурга и Новосибирска. Приглашаем в нашу команду программиста iOS От вас потребуется: знание архитектурных шаблонов и шаблонов проектирования, принципы SOLID; опыт разработки под iOS от 2-х лет; опыт работы с git / git-flow; умение искать информацию и находить решения; желание решать нетривиальные задачи. Дополнительными преимуществами будут опыт разработки под другие мобильные платформы и знания любых других языков программирования. Наш стек: Наш стек: Swift, Auto Layout, Alamofire, Realm, Cocoapods, XCTest . Если вы чего-то не знаете, но есть желание научиться, то давайте встречаться! В сферу ваших задач будет входить: Разработка приложений под iOS для федеральных органов власти и крупного бизнеса; Построение архитектуры и принятие технических решений на проекте; Написание unit-тестов Со своей стороны предлагаем: современный офис в БЦ Мост; гибкий рабочий график с началом работы с 8:00 до 12:00; полностью белая заработная плата. Уровень оклада обсуждается индивидуально в зависимости от профессиональных компетенций; ежегодный пересмотр заработной платы по результатам работы; возможности для профессионального и карьерного развития; качественное планирование вашей работы. Вы будете знать, чем вы будете заниматься через день, неделю, месяц; работа над востребованными продуктами, которыми пользуются миллионы граждан нашей страны. Среди наших проектов: Интернет-портал МВД России Интернет-портал МЧС России ФССП России и множество других Мы НЕ занимаемся разработкой простых коммерческих сайтов, визиток и т.д. Для нас разработка - это множество интеграционных решений, использование современных технологий, высоконагруженные проекты и сложные задачи. Мы понимаем ценность качественного кода и используемых решений и применяем весь спектр технологий для достижения поставленных целей. Мы поощряем инициативность, ответственность, желание развиваться и совершенствоваться. Мы также высоко ценим позитивное мышление и доброжелательность. Наш основной потенциал - это наши сотрудники. Работа в нашей жизни занимает значительное количество времени и мы делаем все для того, чтобы каждый сотрудник чувствовал себя комфортно. Минимум бюрократии - максимум человеческого отношения. Присоединяйтесь!",Без требований,Без обязанностей,Без условий,Objective-C|iOS|iPhone|iPad|Swift|C/C++,5
24,24,ios,Новосибирск,100772.72727272726,139642.85714285713,АЙФЭЛЛ,2019-09-26T12:14:19+0300,От 1 года до 3 лет,Полный день,Полная занятость,"iFellow – ИТ компания нового поколения, предлагающая сервисно-ориентированный подход к разработке ПО, тестированию и сопровождению информационных систем для бизнеса. Компания iFellow объединила в себе лучшие российские практики и передовой зарубежный опыт реализации проектов любой сложности для развития информационных технологий и бизнес-процессов. iFellow работает на ИТ рынке с 2015 года. Начиная с 2018 года, основной специализацией компании стало направление комплексной системной интеграции и разработка программного обеспечения. Сегодня компания предлагает целый ряд инновационных решений для финансовых, страховых и телекоммуникационных компаний, грузовой и пассажирской авиации, нефтегазовой отрасли, сельского хозяйства, а также ритейла и логистики. На текущий момент мы расширяем нашу команду и будем рады принять в наш дружный коллектив iOS разработчика: Предстоит: разработка мобильного приложения банка. Необходимо: опыт разработки клиентских приложений под iOS; наличие выпущенных приложений в AppStore; свободное владение iOS SDK; коммерческий опыт разработки на Swift; понимание цикла разработки ПО, гибких методологий (Scrum/Kanban); умение писать Clean Code (SOLID, KISS, DRY, YAGNI). Мы гарантируем: заработная плата два раза в месяц (обсуждается индивидуально, в зависимости от уровня Ваших проф.навыков); гибкое начало рабочего дня, график 5/2; ДМС после успешного прохождения испытательного срока; кроме продуктовых задач вы сможете выбрать направления, в которых вам интересно развиваться (CI/CD, design system, software architecture); отсутствие дресс-кода, общение в различных чатах, участие в митапах. iFellow Quality. Clarity. Performance. Reality.",Без требований,Без обязанностей,Без условий,iOS|Swift|Scrum|Kanban|SOLID|KISS,22
428,428,ios,Новосибирск,100772.72727272726,139642.85714285713,True Engineering,2019-10-13T18:15:20+0300,От 3 до 6 лет,Полный день,Полная занятость,"True Engineering – лаборатория технологических инноваций. Стратегические партнеры по цифровой трансформации бизнеса S7 Airlines, Leroy Merlin, «ВСК», «Ингосстрах», «АльфаСтрахование», ГК «ЭФКО», Imperial Tobacco и других. Проектируем и строим цифровые высокодоступные Business Critical платформы . Автоматизируем Core бизнес, создаем клиентские сервисы и сервисы для партнерских сетей. Наши герои - это люди. Именно они творят настоящую история о настоящих профессионалах, настоящих инженерах, настоящих нас. Мы собрали отличную команду в 150 инженеров и продолжаем расти. Ценим профессионализм, простоту, душевность и юмор. С азартом беремся за работу, играем в долгую, принимаем решения и делаем осознанный выбор. Выбор быть настоящими. Зовем приложить руку к разработке по-настоящему полезных и красивых решений . Увидеть на практике Continuous Integration, Continuous Delivery, Continuous Deployment. Что мы ждем от настоящего инженера: отличное знание Objective-C/Swift, iOS SDK; Опыт работы от 3 лет опыт работы с git; знание ООП, умение писать понятный и поддерживаемый код; знание Human Interface Guidelines, чувство прекрасного; опыт разработки клиент-серверных приложений; стремление изучать новые технологии и подходы; английский язык на уровне чтения технической документации. Во многих наших проектах используются технологи и , опыт работы с которыми будет плюсом : carthage fastlane CoreData MVVM + ReactiveCocoa/ReactiveSwift Продукт: Большое функциональное клиентское приложение для страхования. Уникальные клиентские сервисы, тысячи пользователей. Оформление, продление всех видов страхования через приложение, урегулирование убытков, видео-осмотры объектов страхования, распознавание документов. Максимум услуг в онлайне. Настоящий сервис. True Employer: От нас сильная команда дизайна и разработки, поддержка PM, профессиональное окружение, современный технологический стек. Умные, честные, открытые коллеги. Простор для инженерной мысли и уютная рабочая среда. C&amp;B Трудоустройство по ТК РФ Белая заработная плата Бесплатный спорт, бассейн Гибкий рабочий график Красивый офис Легендарные корпоративы Спортивные команды, турник в офисе Корпоративная библиотека Плюшки Закрытая парковка True Engineering - кто мы? Проектируем возможности, работаем на результат, делаем на перспективу . К нам приходят с бизнес-задачей, а мы переводим ее в плоскость информационных технологий и решаем. Инженерный подход позволяет закладывать в решение возможность его развития и глубокой модернизации. Создавать новые конкурентные преимущества для бизнеса. Мы инженеры ИТ-отрасли. Смотрим в будущее, мысленно мы всегда на шаг впереди. Делаем сегодня то, что приведет нас в завтра. Осознанно и рачительно относимся к ресурсам. Ловим технологические тренды , исследуем, применяем инструменты на практике. Умеем и любим учиться, создаем технологические компетенции внутри себя, растим отраслевую бизнес-экспертизу. Создание ценности - наша главная цель. Придумать работающее решение, создать его и добиться бизнес-результата. Знать, что в нем есть кусочек тебя лично, и ты можешь увидеть его в реальных цифрах, графиках, бизнес-показателях использования информационных систем. Наши технологические компетенции – Engineering, Data Mining &amp; Machine Learning, DevOps, Design &amp; Digital. Cтек технологий – Java, .Net, Angular, Vue, iOS, Android. Наш офис находится в новосибирском Академгородке. Мы помогаем с переездом из других городов. Если ты хочешь присоединиться к настоящим инженерам , напиши нам",Без требований,Без обязанностей,Без условий,iOS|Objective-C|Swift,4
548,548,ios,Новосибирск,100772.72727272726,139642.85714285713,Центр финансовых технологий,2019-09-30T19:12:46+0300,От 1 года до 3 лет,Гибкий график,Полная занятость,"Основная цель должности – разработка мобильных приложений для продуктов Faktura . Решение задач банка по созданию единой системы дистанционного обслуживания юридических и физических лиц с возможностью кастомизации интерфейса, и настройки функционала под конкретный банк. Задачи: разработка новых продуктов и развитие существующих; участие в Agile-разработке, Code Review, использование TDD; использование новых технологий, архитектурных подходов, совершенствование навыков программирования; обмен опытом с командой. Требования к кандидатам: опыт разработки под iOS; приветствуются базовые знания Objective-C; уверенное знания Git, Gradle; понимание ООП, принципов SOLID, Clean Architecture, знание основных паттернов проектирования. Условия работы: официальное трудоустройство, современный офис, возможность профессионального развития и личностного роста: внутренние и внешние конференции и тренинги, собственная библиотека и т.д., развитая корпоративная культура: весёлые корпоративы, живое общение во внутренней социальной сети, забота о здоровье: программы ДМС, врач на территории офиса скидки, бонусы на различные услуги.",Без требований,Без обязанностей,Без условий,iOS|iOS SDK|ООП|SOLID|Swift|Objective-C,17
