,Unnamed: 0,name,area,min_salary,max_salary,employer,published_at,experience,schedule,employment,description,requirements,duties,conditions,key_skills,days
239,239,ios,Новосибирск,135000.0,130000.0,Сибекст,2019-10-21T07:40:11+0300,От 1 года до 3 лет,Гибкий график,Полная занятость,"Привет! Меня зовут Катя. Я - HR manager компании Sibext. В нашей компании есть отдел IOS разработки. Работы очень много и нам нужны люди! Но особенность нашей компании заключается в том, что мы ищем не сотрудников, нам нужны единомышленники. Мы вместе решаем за круглым столом как сделать наш продукт лучше, как решить сложные задачи, какое направление нам выбрать и какие технологии будут внедрены сегодня. Давай я расскажу немного о нас и вакансии IOS разработчика. Мы ИТ компания, на рынке с 2013 года, находимся в Технопарке, есть офис в Новосибирске! Мы ориентированный на зарубежный рынок, работаем с заказчиками из Австралии и Европы. Сейчас работаем над одним большим проектом «Умный дом». Основная задача – разработка ПО для управления системами жизнеобеспечения дома через мобильные устройства. Наш стек технологий для IOS: Что мы ждем от тебя: - уверенные знания и опыт работы с Objective-C, Swift, Storyboard; - английский язык на уровне чтения технической документации; - готовность к работе в команде. Будут плюсом: - знания и опыт работы с C/C++, xCode, Cacoapods. Так как наши заказчики не знают русский зык, то мы переписываемся на английском. Если твой английских хромает, не беда! У нас есть корпоративный английский в понедельник и пятницу в рабочее время! Внешнее обучение тоже есть, про это можем поговорить на собеседовании. Мотивацию пересматриваем каждые 6 месяцев Мы предлагаем: удовольствие от работы над интересным проектом в компании увлеченных профессионалов; официальное трудоустройство, соц. пакет, стабильная з/п; дополнительное обучение по специализации; гибкий график; 2 офиса: в Академгородке (Технопарк) и в Новосибирске (Инская) рядом с метро Речной вокзал.",Без требований,Без обязанностей,Без условий,Swift|Objective-C|C/C++|Storyboard,0
17,17,ios,Новосибирск,135000.0,130000.0,Drom,2019-09-27T02:16:55+0300,От 1 года до 3 лет,Полный день,Полная занятость,"Drom.ru — это автомобильный интернет-портал федерального уровня. Ежедневно сайт посещает более 3 миллионов пользователей. Нам 20 лет, и мы продолжаем активно расти. В связи с расширением штата ищем разработчика приложений под iOS. Некоторые наши iOS-проекты: Дром Авто Приложение позволяет легко и быстро купить или продать автомобиль со смартфона или планшета. В базе объявлений Drom.ru уже более 600 000 предложений со всей России. Приложение написано на Objective-C, но новый код пишем только на Swift. Дром ПДД Приложение для тех, кто ещё учится в автошколе или готовится к экзамену в ГИБДД. Приложение написано на Objective-C. Дром Штрафы Приложение для проверки и оплаты штрафов ГИБДД. Написано полностью на Swift. Чем будем заниматься: - разрабатывать и поддерживать iOS-приложения; - дорабатывать и писать фреймворки, используемые в приложениях; - участвовать в кодревью команды; - обсуждать новые фичи и требования; - взаимодействовать с нашими командами продуктовой разработки (Владивосток, Томск, Новосибирск); - осваивать новые технологи, решать интересные и сложные задачи в ведущей IT-компании Дальнего Востока по разработке highload web-проектов. Мы ищем iOS-разработчика, который: - имеет опыт создания приложений под iOS; - знает Swift для написания нового кода и Objective-C для поддержки старого; - понимает базовые алгоритмы, ООП, шаблоны проектирования, парадигмы MVC; - умеет работать в команде и с чужим кодом, а также с системами контроля версий (мы используем Git). Плюсом будут: - опубликованные приложения в AppStore или активная страница на GitHub; - понимание AppStore Review Guidelines и Human Interface Guidelines; - знание архитектур VIPER, MVVM и других подходов к разработке приложений; -любовь к Unit-тестам и не только; А ещё круче будет, если в добавок тебе интересно пользовательское взаимодействие и интерфейсы, и ты готов расти в этом направлении Кто мы? Мы работаем над интересными и уникальными проектами. Используем Scrum и Kanban. Постоянно учимся новому, обмениваемся опытом, помогаем друг другу в реализации задач. Мы работаем в БЦ Новая высота (10 минут до метро). У нас есть уютная офисная кухня, на которой всегда есть кофе и полный холодильник; турники, спортивная стенка, кресло-мешки и многое другое. Мы носим кроксы, шорты и прочий нерегламентированный &quot;дресс-код&quot;. Мы ездим на конференции, смотрим в офисе вебинары на большом мониторе, покупаем всю нужную литературу. Тебя ждет: - полностью официальная зарплата, оформление по ТК РФ с первого дня работы, гибкий график и плавающее начало дня (с 8 до 10 утра); - уровень дохода, достойный твоей квалификации, определится по результатам собеседования и будет периодически расти. Напиши нам о себе. Присылай резюме, даже если ты не уверен в своих силах, мы готовы рассмотреть вариант обучения разработчиков без опыта, но с сильной теоретической базой и желанием работать в данном направлении. Нет резюме? Не страшно! Можно просто откликнуться на нашу вакансию, направить ссылки на профили в GitHub, StackOverflow, Хабр, а также на твои работы в AppStore. Будем рады пообщаться!",Без требований,Без обязанностей,Без условий,Objective-C|Git|ООП|MVC|iOS|Scrum,24
454,454,ios,Краснодар,150000.0,130000.0,"МАГНИТ, Розничная сеть",2019-09-30T10:13:49+0300,От 3 до 6 лет,Полный день,Полная занятость,"О нас : Информационные технологии Магнит - дочерняя компания крупнейшей федеральной retail-сети Магнит. Мы создаем передовые высоконагруженные, отказоустойчивые, масштабируемые IT решения в рознице, логистике и производстве. Наша команда - 1500 человек, разработано более 400 информационных решений Наш Центральный офис расположен в Краснодаре. 250 солнечных дней в году, близость моря и гор, развитая инфраструктура, высокая бизнес-активность – причины, по которым Краснодар неоднократно признавался лучшим городом для жизни в России. Мы предлагаем: Возможность удаленной работы Трудоустройство по ТК РФ, конкурентоспособную, полностью &quot;белую&quot; заработную плату, а также гарантируем её своевременную выплату. Заработная плата складывается из: оклада и премии. График работы с 08:00 до 17:00, 5-дневная рабочая неделя. Мы вкладываем ресурсы в развитие, поэтому у нас организовано корпоративное обучение, и есть реальная возможность профессионального и карьерного роста в Компании. Карту лояльности Магнит - Дисконт, которая дает широкие возможности получения скидок в компаниях партнеров по различным направлениям. Ключевые обязанности : Разработка мобильного приложения для корпоративных планшетов супервайзеров c &quot;нуля&quot; Разработка приложения для личных устройств директоров Ожидания от кандидатов : Знания Objective-C/Swift на уровне не ниже middle Знание алгоритмов и структур данных Знание и опыт разработки с использованием БД Oracle, SQLite, MSSQL, PostgreSQL Понимание клиент-серверных стандартов взаимодействий iOS SDK 8+, глубокое знание UIKit Умение работать в команде Мы стремимся создавать лучшие условия для работы и отдыха, поэтому наше рабочее пространство включает: Оснащенные всем необходимым рабочие места. Комфортные переговорные комнаты и несколько модернизированных конференц-залов. 2 бесплатных спортзала на территории офиса (кардио- и силовые тренажеры, залы для групповых занятий – пилатес, йога, танцы, кросс-фит, степ-аэробика, единборства). Удобную бесплатную общую автостоянку. Большую закрытую велопарковку. Открытую площадку с зоной воркаута, футбольное поле и два многофункциональных (теннис/баскетбол/волейбол). Просторную современную столовую, где наши повара с заботой о Вас, готовят вкусные завтраки/обеды и ужины. Для тех, кто предпочитает питаться домашней едой, имеются оборудованные кофе-комнаты в каждом корпусе. На прилегающей к офису территории, на свежем воздухе находятся 2 стильные Кофе-Лавки. Здесь Вы сможете насладиться свежесваренным зерновым кофе и провести обеденный перерыв в чудесной парковой зоне Компании. Мы искренне заботимся о здоровье наших сотрудников, поэтому у нас есть корпоративные медицинские кабинеты. Любой работник ГК может бесплатно получить там специализированную доврачебную помощь или консультацию по состоянию здоровья, принять участие в профилактических мероприятиях.",Без требований,Без обязанностей,Без условий,iOS|Objective-C|Swift|MS SQL|PostgreSQL,21
825,825,ios,Екатеринбург,195000.0,112000.0,TeamDirector,2019-09-25T13:57:32+0300,От 1 года до 3 лет,Удаленная работа,Полная занятость,"TeamDirector is an American company that develops next-generation computer-assisted dispatch (CAD) applications for all industries. Our team of engineers use the latest in cutting-edge technology to push the envelope on getting the right person to the right place in as little time possible. This job is Full-time, REMOTE . TeamDirector is looking for an iOS developer who possesses a passion for pushing mobile technologies to the limits and will work with our team of talented engineers to design and build the next generation of our mobile applications. Responsibilities - Design and build advanced applications for the iOS platform - Collaborate with cross-functional teams to define, design, and ship new features. - Unit-test code for robustness, including edge cases, usability, and general reliability. - Work on bug fixing and improving application performance. - Continuously discover, evaluate, and implement new technologies to maximize development efficiency. Requirements - Proven working experience in software development - Working experience in iOS development - Have published one or more iOS apps in the app store - A deep familiarity with Objective-C and Cocoa Touch - Experience working with iOS frameworks such as Core Data, Core Animation, Core Graphics and Core Text - Experience with third-party libraries and APIs - Working knowledge of the general mobile landscape, architectures, trends, and emerging technologies - Solid understanding of the full mobile development life cycle - Technical English level: Intermediate and upper. Non verbal skills required",Без требований,Без обязанностей,Без условий,Objective-C|iOS|C++|Mac Os|Design Patterns,26
69,69,ios,Новосибирск,195000.0,130000.0,TeamDirector,2019-09-25T13:57:32+0300,От 1 года до 3 лет,Удаленная работа,Полная занятость,"TeamDirector is an American company that develops next-generation computer-assisted dispatch (CAD) applications for all industries. Our team of engineers use the latest in cutting-edge technology to push the envelope on getting the right person to the right place in as little time possible. This job is Full-time, REMOTE . TeamDirector is looking for an iOS developer who possesses a passion for pushing mobile technologies to the limits and will work with our team of talented engineers to design and build the next generation of our mobile applications. Responsibilities - Design and build advanced applications for the iOS platform - Collaborate with cross-functional teams to define, design, and ship new features. - Unit-test code for robustness, including edge cases, usability, and general reliability. - Work on bug fixing and improving application performance. - Continuously discover, evaluate, and implement new technologies to maximize development efficiency. Requirements - Proven working experience in software development - Working experience in iOS development - Have published one or more iOS apps in the app store - A deep familiarity with Objective-C and Cocoa Touch - Experience working with iOS frameworks such as Core Data, Core Animation, Core Graphics and Core Text - Experience with third-party libraries and APIs - Working knowledge of the general mobile landscape, architectures, trends, and emerging technologies - Solid understanding of the full mobile development life cycle - Technical English level: Intermediate and upper. Non verbal skills required",Без требований,Без обязанностей,Без условий,Objective-C|iOS|C++|Mac Os|Design Patterns,26
