,Unnamed: 0,name,area,min_salary,max_salary,employer,published_at,experience,schedule,employment,description,requirements,duties,conditions,key_skills,days
63,63,ios,Новосибирск,135000.0,130000.0,Электронный город (ООО Новотелеком),2019-10-08T05:54:11+0300,От 1 года до 3 лет,Полный день,Полная занятость,"В &quot;Электронный город&quot; требуется Разработчик на проект мобильных приложений для управления умным домофоном и сопутствующими устройствами в проекте &quot;Мой дом&quot; О проекте: Мы ищем iOS-разработчика на проект &quot;Умный домофон&quot; Наш проект - это возможность изменить мир к лучшему. Привычные вещи сделать современными и удобными, понимающими тебя с полуслова. Или вовсе без слов. Уже в этом году мы несём домофон, не привязанный к архаичным технологиям, в десятки городов. Он уже управляется с мобильного, и вот-вот начнет узнавать своих и чужих по лицу и голосу. В перспективе это - полноценный умный двор, знающий привычки каждого жителя, и угадывающий его желания. Чтобы стать частью нашей команды, нужно знать: Знание iOS SDK, Human Interface Guidelines, Objective-C Опыт разработки клиент-серверных приложений (REST API, JSON, XML и т.д..) Знание ООП, паттернов проектирования, в том числе и архитектурных (MVC, MVP, MVVM, VIPER) Понимание модели управления памятью Cocoa Будет плюсом: Знание Swift, Dependency Injection, Socket, VoIP Push Dependency Injection Опыт написания Unit/UI тестов Условия работы: Рабочее место - офис по адресу ул. Семьи Шамшиных График работы - 5/2, 8-ми часовой рабочий день Официальное трудоустройство, белая заработная плата Плюшки и приятные бонусы: бесплатный интернет у Вас дома (при наличии технической возможности), возможность заниматься спортом",Без требований,Без обязанностей,Без условий,Android|Objective-C|SWIFT Alliance|iOS|iOS SDK,13
62,62,ios,Новосибирск,135000.0,130000.0,АЙФЭЛЛ,2019-10-21T07:13:27+0300,От 1 года до 3 лет,Полный день,Полная занятость,"iFellow – ИТ компания нового поколения, предлагающая сервисно-ориентированный подход к разработке ПО, тестированию и сопровождению информационных систем для бизнеса. Компания iFellow объединила в себе лучшие российские практики и передовой зарубежный опыт реализации проектов любой сложности для развития информационных технологий и бизнес-процессов. iFellow работает на ИТ рынке с 2015 года. Начиная с 2018 года, основной специализацией компании стало направление комплексной системной интеграции и разработка программного обеспечения. Сегодня компания предлагает целый ряд инновационных решений для финансовых, страховых и телекоммуникационных компаний, грузовой и пассажирской авиации, нефтегазовой отрасли, сельского хозяйства, а также ритейла и логистики. На текущий момент мы расширяем нашу команду и будем рады принять в наш дружный коллектив iOS разработчика: Предстоит: разработка мобильного приложения банка. Необходимо: опыт разработки клиентских приложений под iOS; наличие выпущенных приложений в AppStore; свободное владение iOS SDK; коммерческий опыт разработки на Swift; понимание цикла разработки ПО, гибких методологий (Scrum/Kanban); умение писать Clean Code (SOLID, KISS, DRY, YAGNI). Мы гарантируем: заработная плата два раза в месяц (обсуждается индивидуально, в зависимости от уровня Ваших проф.навыков); гибкое начало рабочего дня, график 5/2; ДМС после успешного прохождения испытательного срока; кроме продуктовых задач вы сможете выбрать направления, в которых вам интересно развиваться (CI/CD, design system, software architecture); отсутствие дресс-кода, общение в различных чатах, участие в митапах. iFellow Quality. Clarity. Performance. Reality.",Без требований,Без обязанностей,Без условий,iOS|Swift|Scrum|Kanban|SOLID|KISS,0
218,218,ios,Новосибирск,135000.0,130000.0,Центр финансовых технологий,2019-09-30T19:12:46+0300,От 1 года до 3 лет,Гибкий график,Полная занятость,"Основная цель должности – разработка мобильных приложений для продуктов Faktura . Решение задач банка по созданию единой системы дистанционного обслуживания юридических и физических лиц с возможностью кастомизации интерфейса, и настройки функционала под конкретный банк. Задачи: разработка новых продуктов и развитие существующих; участие в Agile-разработке, Code Review, использование TDD; использование новых технологий, архитектурных подходов, совершенствование навыков программирования; обмен опытом с командой. Требования к кандидатам: опыт разработки под iOS; приветствуются базовые знания Objective-C; уверенное знания Git, Gradle; понимание ООП, принципов SOLID, Clean Architecture, знание основных паттернов проектирования. Условия работы: официальное трудоустройство, современный офис, возможность профессионального развития и личностного роста: внутренние и внешние конференции и тренинги, собственная библиотека и т.д., развитая корпоративная культура: весёлые корпоративы, живое общение во внутренней социальной сети, забота о здоровье: программы ДМС, врач на территории офиса скидки, бонусы на различные услуги.",Без требований,Без обязанностей,Без условий,iOS|iOS SDK|ООП|SOLID|Swift|Objective-C,20
160,160,ios,Новосибирск,135000.0,130000.0,i20,2019-10-10T07:31:28+0300,От 1 года до 3 лет,Гибкий график,Полная занятость,"Наша команда ищет i⁢OS-разработчика для создания и сопровождения собственных продуктов и реализации проектов для Российских и международных заказчиков. Чем нужно будет заниматься: Участвовать в командной разработке уникальных мобильных приложений Следовать лучшим практикам разработки и улучшать внутренние стандарты Участвовать в Scrum-митингах, обсуждать план разработки и фичи Чего мы ждем от тебя: Опыт iOS разработки от 1 года Умение оценивать проекты и задачи Способность укладываться в свои оценки с разумной погрешностью Знание английского языка на уровне чтения тех. документации Уверенное знание Swift, плюсом будет опыт с Objective-C Хорошее знание Apple development guidelines Понимание назначения и осознанный опыт использования ООП CVS (желательно git) Опыт проектирования и интеграции REST API Твоим преимуществом будет: Знание Human Interface Guidelines Опыт реактивного программирования (RxSwift/RxCocoa/ReactiveCocoa) Сборка сложных проектов, конфигурация систем сборки В офисе тебя ждут: Большая и дружная команда разработчиков, готовых помочь в трудную минуту Стимулирование личностного и профессионального роста Просторная кухня со всем необходимым (бесплатные чай, кофе и вкусняшки) Удобный офис в 5 минутах от м. Площадь Ленина Официальное трудоустройство Гибкий график работы Турник Немного об i20 Group: i20 Group - высокотехнологичная IT-компания, которая предоставляет полный цикл digital-услуг для бизнеса. Уже более 8 лет мы разрабатываем высоконагруженные сайты, мобильные приложения, занимаемся тестированием и веб-дизайном для клиентов по всему миру. Наше портфолио включает в себя всемирно известные бренды, такие как: Всемирный Банк, Органы Государственной власти РФ, русские издания журналов Forbes и Geo, Adidas, IBS, LG Electronics, Голос и многие другие. Мы являемся лидером в сегменте Drupal разработки и входим в top-15 мирового рейтинга. А также по итогам недавно опубликованного Рейтинга Рунета i20 Group на 65 месте среди лучших разработчиков сайтов. Наш приоритет - это крупные проекты, продолжительностью от нескольких месяцев до нескольких лет. Это отличная среда для профессионального роста и развития. С такими проектами скучать не придется! При этом помимо заказной разработки мы развиваем и собственные продукты! В Новосибирске у нас 2 офиса: на пл. Ленина рядом с оперным театром и на вершине Технопарка. У нас нет дресс-кода и есть возможность адаптировать график работы под ваш жизненный ритм. Главное для нас - это качественный результат в срок. У нас принято помогать каждому реализоваться на полную и избегать ненужных рамок. А помимо должностного роста также предусмотрен пересмотр зарплаты в соответствии с ростом вашего опыта и навыков. Перспективы: В нашей команде собралось множество опытных специалистов мирового уровня у которых многому можно научиться. Мы предлагаем отличные перспективы роста для разработчика. Если вам по душе только техническая сторона, то вы можете стать Senior Developer’ом или Архитектором. Если же вы полны решимости и готовы брать ответственность не только за себя, то есть возможность стать Тим лидом, а если захотите, то и руководителем проектов. У нас принято помогать каждому реализоваться на полную и избегать ненужных рамок. А помимо должностного роста также предусмотрен пересмотр зарплаты в соответствии с ростом вашего опыта и навыков. Рост в компании ограничен только вашей зоной комфорта, все зависит от вас!",Без требований,Без обязанностей,Без условий,Без ключевых навыков,11
125,125,ios,Новосибирск,135000.0,130000.0,True Engineering,2019-10-08T08:28:14+0300,От 1 года до 3 лет,Полный день,Полная занятость,"Настоящий IOS developer True Engineering – лаборатория технологических инноваций. Стратегические партнеры по цифровой трансформации бизнеса S7 Airlines, Leroy Merlin, «ВСК», «Ингосстрах», «АльфаСтрахование», ГК «ЭФКО», Imperial Tobacco и других. Проектируем и строим цифровые высокодоступные Business Critical платформы . Автоматизируем Core бизнес, создаем клиентские сервисы и сервисы для партнерских сетей. Наши герои - это люди. Именно они творят настоящую история о настоящих профессионалах, настоящих инженерах, настоящих нас. Мы собрали отличную команду в 150 инженеров и продолжаем расти. Ценим профессионализм, простоту, душевность и юмор. С азартом беремся за работу, играем в долгую, принимаем решения и делаем осознанный выбор. Выбор быть настоящими. Зовем приложить руку к разработке по-настоящему полезных и красивых решений . Увидеть на практике Continuous Integration, Continuous Delivery, Continuous Deployment. Что мы ждем от настоящего инженера: знание Swift и\или Objective-C, iOS SDK опыт работы от 2 лет опыт работы с git знание ООП, умение писать понятный и поддерживаемый код знание Human Interface Guidelines, чувство прекрасного стремление изучать новые технологии и подходы Во многих наших проектах используются технологи и , опыт работы с которыми будет плюсом : carthage fastlane CoreData MVVM + ReactiveCocoa/ReactiveSwift Продукт: Большое функциональное клиентское приложение для страхования. Уникальные клиентские сервисы, тысячи пользователей. Оформление, продление всех видов страхования через приложение, урегулирование убытков, видео-осмотры объектов страхования, распознавание документов. Максимум услуг в онлайне. Настоящий сервис. True Employer: От нас сильная команда дизайна и разработки, поддержка PM, профессиональное окружение, современный технологический стек. Умные, честные, открытые коллеги. Простор для инженерной мысли и уютная рабочая среда. C&amp;B Трудоустройство по ТК РФ Белая заработная плата Бесплатный спорт, бассейн Гибкий рабочий график Красивый офис Легендарные корпоративы Спортивные команды, турник в офисе Корпоративная библиотека Плюшки Закрытая парковка True Engineering - кто мы? Проектируем возможности, работаем на результат, делаем на перспективу . К нам приходят с бизнес-задачей, а мы переводим ее в плоскость информационных технологий и решаем. Инженерный подход позволяет закладывать в решение возможность его развития и глубокой модернизации. Создавать новые конкурентные преимущества для бизнеса. Мы инженеры ИТ-отрасли. Смотрим в будущее, мысленно мы всегда на шаг впереди. Делаем сегодня то, что приведет нас в завтра. Осознанно и рачительно относимся к ресурсам. Ловим технологические тренды , исследуем, применяем инструменты на практике. Умеем и любим учиться, создаем технологические компетенции внутри себя, растим отраслевую бизнес-экспертизу. Создание ценности - наша главная цель. Придумать работающее решение, создать его и добиться бизнес-результата. Знать, что в нем есть кусочек тебя лично, и ты можешь увидеть его в реальных цифрах, графиках, бизнес-показателях использования информационных систем. Наши технологические компетенции – Engineering, Data Mining &amp; Machine Learning, DevOps, Design &amp; Digital. Cтек технологий – Java, .Net, Angular, Vue, iOS, Android. Наш офис находится в новосибирском Академгородке. Мы помогаем с переездом из других городов. Если ты хочешь присоединиться к настоящим инженерам , напиши нам",Без требований,Без обязанностей,Без условий,iOS|Objective-C|Swift,13
222,222,ios,Новосибирск,135000.0,130000.0,Технологика,2019-10-16T16:06:00+0300,От 1 года до 3 лет,Гибкий график,Полная занятость,"В команду мобильной разработки требуется iOS разработчик (Swift). В число проектов входят такие крупные проекты как: Система для поддержки рекрутинга атлетов в спортивные команды Uber-like сервис предоставления услуг Вам предстоит: участие в проектировании и создании архитектуры разработка (как UI, так и логики) взаимодействие с iOS командой и смежными командами (Android + Backend) Необходимые навыки и опыт: опыт разработки под iOS не менее 2 лет знание и понимание принципов и шаблонов объектно-ориентированного дизайна знание стандартных фрэймворков опыт работы с Git базовые знания HTML, XML, JavaScript, JSON, SQL Плюсом будут: опыт работы по Agile опыт командной разработки опыт использования кроссплатформенных фрэймворков, в частности React Native. опыт работы с профайлером Instruments опыт разработки под другие мобильные платформы Технологика – компания, специализирующаяся на разработке бизнес-приложений для западного и российского рынков с использованием передовых технологий. Мы работаем с такими компаниями, как Microsoft, IBM, American Airlines, Delta Airllines, Samsung, Philip Morris, БКС, МДМ Банк, ЕВРАЗ, ММК, Алроса. Мы предлагаем: гибкий график работы возможность профессионального и карьерного роста просторный офис и рабочая обстановка, способствующие спокойной, творческой работе обучение и сертификация за счет Компании четырехнедельный оплачиваемый отпуск, оплата больничных и другие гарантии согласно ТК РФ ДМС оплата занятий спортом",Без требований,Без обязанностей,Без условий,iOS|Objective-C|Git,5
