,Unnamed: 0,name,area,min_salary,max_salary,employer,published_at,experience,schedule,employment,description,requirements,duties,conditions,key_skills
161,161,программист c++ junior,Новосибирск,25000.0,40000.0,Форвард,2019-10-21T06:01:03+0300,Нет опыта,Полный день,Полная занятость,"Группа компаний Форвард – лидер в области разработки программных и аппаратных симуляторов автомобилей и различной спецтехники, а также программного обеспечения для теоретического обучения вождению, безопасности дорожного движения и т.д. Мы – увлеченная команда профессионалов, разрабатываем и применяем игровые технологии для создания высококачественных и реалистичных продуктов, которые помогают обучать специалистов и пользователей по всему миру. Наша продукция поставляется как по всей России, так и за рубеж – в США, различные страны Европы и т.д. Вас ждет широкий спектр задач – разработка графики, искусственного интеллекта, сетевого взаимодействия, работа с такими технологиями, как Oculus Rift, HTC Vive, Steam, Havok Physics и т.д. Опытная команда поможет изучить новое и прокачать Ваши навыки. Приглашаем стать частью нашей команды! Нам интересно Ваше: Знание C++, STL; Принципы и методы ООП; Основы линейной алгебры и аналитической геометрии; Понимание базовых структур данных и алгоритмов. Будет плюсом: Интерес к разработке компьютерных игр и симуляторов; Наличие собственных проектов игр/мультимедийных программ; Опыт программирования 3D графики (DirectX, OpenGL), работы с графическими «движками»; Опыт работы с игровыми «движками» – Unreal Engine, Unity и т.д.; Опыт работы в Microsoft Visual Studio, с системами контроля версий (SVN, Git и т.д.); Опыт разработки на С#, работы с .NET технологиями – WPF и т.д., с SQL и БД; Опыт разработки и оптимизации алгоритмов; Интерес к автомобильной тематике; Технический английский (чтение документации). Мы предлагаем: Молодой, профессиональный, дружелюбный коллектив; Комфортный офис в центре города, 5 минут от метро «Гагаринская»; Опытные коллеги и наставники; Удобное и современное рабочее место; Официальное трудоустройство, белая зарплата; Возможность совмещения работы с учебой; Профессиональный и карьерный рост; Доступ к современному VR-оборудованию, игровым рулям и т.д.; Возможность участия в семинарах и тренингах; Кухня с кофемашинами, разными «вкусняшками» для всегда позитивного настроения; Компенсация занятий спортом. Уровень заработной платы определяется по результатам собеседования.",,,,C++|STL|ООП
1018,1018,программист,Самара,25000.0,40000.0,777,2019-10-20T13:58:58+0300,От 1 года до 3 лет,Полный день,Полная занятость,"Обязанности : подключение и настройка оборудования Поддержка и консультирование пользователей 1С. Работа с данными (поиск и исправление ошибок, обработка данных, участие в переносах и проверке данных). Создание пользовательских инструкций для разрабатываемых и поддерживаемых ИС Создание отчетов и обработок для оперативного получения/изменения информации в БД. Локализация, исправление ошибок в штатном функционале. Поддержка интеграционных механизмов со смежными системами. Требования: Практический опыт по самостоятельному поиску решения проблем пользователей при каждодневном использовании ими систем 1С. Умение читать чужой код Навык разработки приложений на платформе 1С не мене уровня написания логики обработок данных и формирования запросов для получения данных. Знание платформы 1С и опыт разработки под клиент-серверную архитектуру и управляемые формы Опыт работы и разработки на базе конфигурации 1С: Бухгалтерия Предприятия 3.0,1С Розница Работа по интеграции с другими учетными системами на платформе 1С. Условия: официальное трудоустройство; своевременная выплата заработной платы"," Практический опыт по самостоятельному поиску решения проблем пользователей при каждодневном использовании ими систем 1С. Умение читать чужой код Навык разработки приложений на платформе 1С не мене уровня написания логики обработок данных и формирования запросов для получения данных. Знание платформы 1С и опыт разработки под клиент-серверную архитектуру и управляемые формы Опыт работы и разработки на базе конфигурации 1С: Бухгалтерия Предприятия 3.0,1С Розница Работа по интеграции с другими учетными системами на платформе 1С. ",, официальное трудоустройство; своевременная выплата заработной платы,1С: Комплексная автоматизация|1С: Торговля|Настройка сетевых подключений|Торговля|1С: Розница|1С программирование
647,647,начинающий javascript разработчик,Челябинск,25000.0,50000.0,СофтПлюс,2019-10-21T00:08:13+0300,От 1 года до 3 лет,Полный день,Полная занятость,"Требования – Умеете верстать (html+css) и писать простые скрипты на js; – Можете прочесть (с помощью goolge) php код, внести минимальные правки и сформировать SQL запрос к базе. У нас вы научитесь – Пользоваться webpack; – Освоите и React, и Vue, и Angular, и разработку на чистом JS; – Вносить правки и доработки на backend (node.js и php); – Работать со сверхбыстрой БД ClickHouse от Яндекс; – Обеспечивать безопасность продукта с HashiCorp(Consul, Vault); – Строить сервисную архитектуру и пользоваться очередями RabbitMQ; – Настраивать мониторинг на Prometheus и Graphite. Условия – Офис открыт с 08.00 до 22.00, выберите своё время работы самостоятельно; – С вас - качество работ, с нас - информация и оборудование по запросу; – Оплачиваем образование: курсы и профильные конференции; – Работаем без KPI. Zaycev.FM – одна из первых интернет станций в Рунете, существует с 2010 г. Работает без стационарной студии. Занимаемся различными музыкальными проектами стриминга (интернет вещания): от интернет-радио, до интеллектуального музыкального помощника - рекомендательной сети на исскуственном интелекте. Стек основных технологий: php, node.js, MySQL. В разных проектах использованы React, Vue.js и Angular 6. Стремимся внедрить CI/CD на 100% проектов. Команда разработки трудится в офисе в Челябинске.",,,,JavaScript|HTML|CSS3
942,942,ведущий специалист по 1с отдела поддержки информационных систем,Екатеринбург,28700.0,32387.0,Почта России,2019-10-02T06:39:35+0300,От 1 года до 3 лет,Полный день,Полная занятость,"Обязанности: Администрирование 1С ЗУП; Поддержка в рамках сопровождения 1С ЗУП и прочих ИС на базе 1С; Участие в разработке инструкций. технический регламентов по работе с ИС; Поддержка в рамках сопровождения прочих ИС на базе 1С. Требования: Опыт работы с 1С Зарплата и управление персоналом. Редакция КОРП. Опыт работы с 1С Управление закупками; Опыт настройки обменов между различными информационными системами; Понимание кадрового делопроизводства; Опыт работы с системами регистрации инцидентов; Понимание принципов ITIL; Умение работать самостоятельно и в команде; Умение делегировать и контролировать; Ответственность. Условия: Работа в крупнейшей российской компании; Оформление трудовых отношений и выплата заработной платы в соответствии с ТК РФ; ДМС; Социальный пакет; Профессиональный и карьерный рост; Молодой коллектив; Удобное месторасположение - центр города, доступны все виды общественного транспорта.", Опыт работы с 1С Зарплата и управление персоналом. Редакция КОРП. Опыт работы с 1С Управление закупками; Опыт настройки обменов между различными информационными системами; Понимание кадрового делопроизводства; Опыт работы с системами регистрации инцидентов; Понимание принципов ITIL; Умение работать самостоятельно и в команде; Умение делегировать и контролировать; Ответственность. , Администрирование 1С ЗУП; Поддержка в рамках сопровождения 1С ЗУП и прочих ИС на базе 1С; Участие в разработке инструкций. технический регламентов по работе с ИС; Поддержка в рамках сопровождения прочих ИС на базе 1С. ," Работа в крупнейшей российской компании; Оформление трудовых отношений и выплата заработной платы в соответствии с ТК РФ; ДМС; Социальный пакет; Профессиональный и карьерный рост; Молодой коллектив; Удобное месторасположение - центр города, доступны все виды общественного транспорта.",
627,627,"junior middle web разработчик, г. челябинск",Челябинск,30000.0,60000.0,Анида,2019-09-28T10:07:03+0300,От 1 года до 3 лет,Полный день,Полная занятость,"Маркетинговое агентство &quot;Колос&quot; ищет в команду Junior и Middle Web-разработчика из Челябинска для плодотворного и продолжительного взаимовыгодного сотрудничества! Со сдельной заработной платой труда, удаленно или в офисе. Все коммуникации ведутся в команде 3-5 человек через CRM, мессенджеры и видео-чаты. Необходимые знания языков: html, css, php, js Умение разбираться в чужом коде Опыт работы с БД Знание каких-либо CMS из списка: Wordpress, Opencart, ModX, 1С-Bitrix (особенно важно пункт, сразу пишите в сопроводительном письме, с какими CMS работали, какой опыт) Настройка шаблонов и модулей, а также их редактирование Умение верстать адаптивные кроссбраузерные макеты дизайна Приветствуется опыт разработки мобильных приложений (для мидлов) Условия: сдельная заработная плата: 2 раза в месяц отличные перспективы роста большое кол-во работ У нас дружный молодой коллектив, который быстро развивается и ищет трудолюбивого 1-2 программиста для работы над текущими и новыми проектами. П.С. на старте для определения уровня специалиста выдаются 2 тестовых оплачиваемых задания",,," сдельная заработная плата: 2 раза в месяц отличные перспективы роста большое кол-во работ У нас дружный молодой коллектив, который быстро развивается и ищет трудолюбивого 1-2 программиста для работы над текущими и новыми проектами. П.С. на старте для определения уровня специалиста выдаются 2 тестовых оплачиваемых задания",CSS|JavaScript|MySQL|PHP|Bootstrap|HTML|jQuery|CMS Wordpress|SQL|HTML5|CSS3|PHP5|MS SQL|Java|Ajax
145,145,специалист технической поддержки (2 линия),Новосибирск,30000.0,50000.0,AD.RU,2019-10-01T11:35:00+0300,От 1 года до 3 лет,Полный день,Полная занятость,"Мы - AD.RU - крупный международный холдинг. Наша команда развивает проекты в сфере ADtech, HRtech, EDtech, B2C и Mobile и помогает значительно повысить капитализацию стартапов, используя уникальный маркетинговый опыт. В холдинге работает более 700 профессионалов, наши российские офисы расположены в Москве, Новосибирске, Воронеже, Калининграде, Туле, Ростове-на-Дону, Волгодонске. Представительские офисы в Лондоне и Сингапуре. Задачи: диагностика и решение инцидентов, связанных с работоспособностью международных ERP и CRM систем; оперативная техническая поддержка пользователей ERP и CRM систем; аналитика данных/построение статистики. Для успешного выполнения задач, вам понадобится: опыт работы(или сопровождения) с высоконагруженными системами(ERP/CRM/биллинговые/финансовые/прочими); опыт решения инцидентов с доступом к сетевым ресурсам; опыт ведения рабочего процесса в системах ServiceDesk/Help Desk; опыт анализа данных и построения статистики (MS Excel); построение запросов SQL; технический английский (письменная обработка обращений англоязычных пользователей). Нам важно, чтобы наш сотрудник работал в максимально комфортных условиях, для этого мы предлагаем: возможность получить опыт/реализовать себя в международной IT/digital компании с интернациональной командой в проектах от Америки до Китая; корпоративные занятия английским языком и возможность использовать язык в работе (наши коллеги в других странах говорят на английском); возможность посещать профильные внешние конференции по всему миру; комфортные условия работы в одном из наших офисов г. Новосибирска, по улице Коммунистическая улица, м. Площадь Ленина; гибкий график: возможность расстаться с утренними пробками; официальное трудоустройство с первого дня по ТК РФ.",,,,
810,810,специалист отдела it,Екатеринбург,30000.0,30000.0,Автобан,2019-10-18T15:50:23+0300,Нет опыта,Полный день,Полная занятость,"Сеть дилерских автоцентров ГК «Автобан», приглашает на работу Специалиста отдела IT. Требования: - Высшее образование - Аналитический склад ума, умение работать в режиме многозадачности, быстро усваивать материал - Рассмотрим без опыта работа Обязанности: Администрирование БД Консультирование пользователей Диспетчеризация заявок Разбор стандартных/нестандартных ситуаций Условия работы: Мы стараемся создать условия для развития наших сотрудников: + Официальное трудоустройство (соц.пакет, &quot;белая&quot; заработная плата) + Уровень оплаты труда: 30 000 (подробности на собеседовании с руководителем) + График работы: 5/2, с 9-00 до 18-00 + Дружный коллектив + Возможность карьерного роста + Кафе на территории салона + Комфортное рабочее место + Место работы: ул. Металлургов (ВИЗ)",,,,
849,849,инженер программист асу тп,Екатеринбург,30000.0,36000.0,ГАЗЭКС,2019-10-18T15:36:02+0300,Нет опыта,Полный день,Полная занятость,"Обязанности: разработка и поддержка и корпоративной информационной системы; документирование, разработка инструкций; поддержка пользователей организации (обучение, инструктирование); разработка отчетов; разработка ПО в составе коллектива разработчиков программного обеспечения. Требования: высшее образование; возможен прием без опыта работы; приветствуются навыки работы с АСУТП и телеметрией; желательно знание TSQL и одного из языков ООП. Условия: трудоустройство согласно ТК РФ; пятидневная рабочая неделя с 9.00. до 18.00, выходные суббота и воскресенье; офис в районе Южного Автовокзала; официальная заработная плата 2 раза в месяц.", высшее образование; возможен прием без опыта работы; приветствуются навыки работы с АСУТП и телеметрией; желательно знание TSQL и одного из языков ООП. ," разработка и поддержка и корпоративной информационной системы; документирование, разработка инструкций; поддержка пользователей организации (обучение, инструктирование); разработка отчетов; разработка ПО в составе коллектива разработчиков программного обеспечения. "," трудоустройство согласно ТК РФ; пятидневная рабочая неделя с 9.00. до 18.00, выходные суббота и воскресенье; офис в районе Южного Автовокзала; официальная заработная плата 2 раза в месяц.",ООП|Грамотная речь|Разработка инструкций|Автоматизация документооборота|MS PowerPoint
1000,1000,специалист по it,Самара,30000.0,40000.0,ПромСтройПроект,2019-10-15T13:43:16+0300,От 1 года до 3 лет,Полный день,Полная занятость,"Обязанности: оперативное решение возникающих проблем у пользователей; контроль и поддержка технической работы отделов. Требования: опыт работы от 1 года; знание основных сервисов и программ; аналитический склад ума, грамотность; общая IT грамотность. Условия: график работы с 8:30-17:30 оформление по ТК РФ"," опыт работы от 1 года; знание основных сервисов и программ; аналитический склад ума, грамотность; общая IT грамотность. ", оперативное решение возникающих проблем у пользователей; контроль и поддержка технической работы отделов. , график работы с 8:30-17:30 оформление по ТК РФ,Пользователь ПК|Грамотная речь|Грамотность
