,Unnamed: 0,name,area,min_salary,max_salary,employer,published_at,experience,schedule,employment,description,requirements,duties,conditions,key_skills
329,329,верстальщик (frontend разработчик),Краснодар,50000.0,60000.0,Студия Ярга,2019-09-23T10:13:25+0300,От 1 года до 3 лет,Полный день,Полная занятость,"Ищем в студию Frontend разработчика. Студия IARGA – один из лидеров в стране по разработке магазинов на 1с-Битрикс (3 место - не просто так). Создаем и продвигаем магазины и E-commerce проекты, профессионально выводим торговые компании в онлайн. В месяц мы выпускаем 2-3 магазина и могли бы выпускать больше, но для этого нам нужен еще один верстальщик. Кого хотим видеть в своей команде? Специалиста с опытом верстки адаптивных макетов из PSD и Figma Обязанности: Верстка страниц сайтов по готовым PSD-макетам Доработка/развитие существующих проектов Анимация и интерактивные эффекты элементов пользовательского интерфейса Взаимодействие с дизайнером Требования: Профессионализм Знание HTML Умение работать быстро и качественно Уверенная работа с CSS, JS, Jquery Умение верстать макет так, как он задуман и нарисован дизайнером Знание особенностей современных браузеров и опыт кроссбраузерной верстки. Опыт верстки адаптивного дизайна. Способность определять и соблюдать сроки; НАЛИЧИЕ ПОРТФОЛИО Что мы предлагаем : Официальное трудоустройство по ТК РФ; Полный соц. пакет; Интересные задачи и проекты; Обучение и повышение квалификации;",, Верстка страниц сайтов по готовым PSD-макетам Доработка/развитие существующих проектов Анимация и интерактивные эффекты элементов пользовательского интерфейса Взаимодействие с дизайнером ,,
894,894,консультант 1c,Екатеринбург,50000.0,60000.0,Уральский завод гражданской авиации,2019-10-18T05:38:32+0300,От 1 года до 3 лет,Полный день,Полная занятость,"АО «Уральский завод гражданской авиации» приглашает кандидатов принять участие в конкурсе на вакансию «Консультант 1С» Требования: высшее образование (техническое, финансово-экономическое); опыт работы с 1С: Бухгалтерия – 3.0, ЗУП – 2.5; 3.1, УПП – 1.3, Документооборот; опыт поддержки программных продуктов 1С; знание основ бухгалтерского учета; коммуникабельный, ответственный, исполнительный, пунктуальный. Обязанности: консультирование пользователей 1С работе с программными продуктами: 1С УПП, ЗУП, Бух., Документооборот; добавление, удаление пользователей баз 1С; назначение, изменение, анализ прав пользователей 1С; аудит работы БД 1С (выявление ошибок в работе пользователей); контроль выполнения обменов между информационными базами 1С; составление инструкций, презентаций, описание доработок по работе с ПО 1С. Условия работы: работа на крупном развивающемся предприятии; официальное трудоустройство в соответствии с ТК РФ; достойная заработная плата; расширенный соц. пакет, полис ДМС; обучение, повышение квалификации и карьерный рост; корпоративные мероприятия (праздники в формате активного отдыха на горнолыжных базах, туристические слеты, концертные мероприятия, детские праздники для сотрудников с детьми); спортивные секции (бассейн, волейбол, футбол, хоккей, парашютная секция, фитнес-клуб на корпоративных условиях) и соревнования (по футболу, настольному теннису, боулингу, бильярду и др.); возможность изучения английского языка и различные личностные тренинги; ведомственный детский сад; район работы г. Екатеринбург, БЦ Арена; график работы: 5/2 с 08.00 до 17.00.",,,,
598,598,программист 1с,Челябинск,50000.0,50000.0,Форпост,2019-10-21T07:46:04+0300,От 1 года до 3 лет,Полный день,Полная занятость,"Крупный дистрибьютор Уральского региона приглашает на постоянную работу программиста 1С. ( новая штатная единица в связи с увеличением объема работ) Условия: график работы: 5-ти дневная рабочая неделя, с 9:00 до 18:00; трудоустройство в соответствии с ТК РФ; заработная плата индивидуально обсуждается с кандидатом на собеседовании; рабочее место – ул. Радонежская, 15 (доставка служебным транспортом). Обязанности: поддержка конфигураций на базе 1С: Управление торговлей ред. 11.2 и других. глубокая модернизация существующих систем на базе 1С. разработка новых отчетов, доработка старых. поддержка многочисленных обменов, различных форматов выполнение задач по программированию на основе ТЗ. Требования: высшее образование; опыт работы от 1 года; профессиональное программирование на платформе 1С Предприятие; нацеленность на результат; внимательность; ответственность.",," поддержка конфигураций на базе 1С: Управление торговлей ред. 11.2 и других. глубокая модернизация существующих систем на базе 1С. разработка новых отчетов, доработка старых. поддержка многочисленных обменов, различных форматов выполнение задач по программированию на основе ТЗ. "," график работы: 5-ти дневная рабочая неделя, с 9:00 до 18:00; трудоустройство в соответствии с ТК РФ; заработная плата индивидуально обсуждается с кандидатом на собеседовании; рабочее место – ул. Радонежская, 15 (доставка служебным транспортом). Обязанности: поддержка конфигураций на базе 1С: Управление торговлей ред. 11.2 и других. глубокая модернизация существующих систем на базе 1С. разработка новых отчетов, доработка старых. поддержка многочисленных обменов, различных форматов выполнение задач по программированию на основе ТЗ. Требования: высшее образование; опыт работы от 1 года; профессиональное программирование на платформе 1С Предприятие; нацеленность на результат; внимательность; ответственность.",
1108,1108,ведущий специалист по информационным системам (программист 1с),Самара,58000.0,58000.0,"ФГУП Госкорпорация по ОрВД, Филиал Аэронавигация Центральной Волги",2019-09-24T08:49:35+0300,От 1 года до 3 лет,Полный день,Полная занятость,"Обязанности: Работа в группе программистов 1С. Сопровождение, и доработка конфигурации 1С УПП на платформе 8.3; Сопровождение, и доработка конфигурации 1С ЗУП на платформе 8.3; Разработка инструкций и регламентов, связанных с использованием, доработкой и поддержкой конфигураций 1С; Постановка задачи для ТП аутсорсинга 1С и тестирование результатов. Установка обновлений конфигураций с учетом имеющихся доработок; Консультирование сотрудников по работе в 1С; Участие в реализации проектов предприятия на платформе 1С (автоматизация закупочной деятельности, и другие). Требования: Обязательные требования: Оконченное высшее техническое (профильное) образование, опыт работы с продуктами 1С от 3 лет Опыт программирования на платформе 1С 8.2-8.3 от 2-3 лет; Навыки в разработке процессов интеграции между продуктами 1С:Предприятие; Навыки общения с пользователями для анализа их требований, сопоставления с возможностями учетной системы и выработки технически грамотных решений по доработкам; Умение и готовность разбираться в чужом коде; Наличие сертификатов 1С приветствуется. Знание бухгалтерского учета, умение и желание разбираться в предметной области. Умение аналитически мыслить и работать с большими объемами информации; Активность, ответственность, желание развиваться и работать на результат; Готовность к интенсивной и интересной работе в команде. ответственность, аккуратность, трудолюбие, умение работать в коллективе, предрасположенность к самообучению; - лояльное (корректное) отношение к пользователям, умение разобраться в проблеме и оказать пользователям помощь; Условия: Доставка туда/обратно транспортом предприятия (вахта).З/п полностью белая, выплачивается 2 раза в месяц (аванс+з/п). Ежегодная обязательная индексация З/п. Премия по итогам работы за год. Возможны премии за особо важные и срочные работы. Полный социальный пакет в соответствии с трудовым кодексом РФ. Доплата за выслугу лет, дополнительные дни к отпуску. Дополнительные социальные льготы, определяемые Коллективным договором и связанные с выслугой лет. Обучение на КПК за счет предприятия. Собственная столовая и спортивный комплекс на территории."," Обязательные требования: Оконченное высшее техническое (профильное) образование, опыт работы с продуктами 1С от 3 лет Опыт программирования на платформе 1С 8.2-8.3 от 2-3 лет; Навыки в разработке процессов интеграции между продуктами 1С:Предприятие; Навыки общения с пользователями для анализа их требований, сопоставления с возможностями учетной системы и выработки технически грамотных решений по доработкам; Умение и готовность разбираться в чужом коде; Наличие сертификатов 1С приветствуется. Знание бухгалтерского учета, умение и желание разбираться в предметной области. Умение аналитически мыслить и работать с большими объемами информации; Активность, ответственность, желание развиваться и работать на результат; Готовность к интенсивной и интересной работе в команде. ответственность, аккуратность, трудолюбие, умение работать в коллективе, предрасположенность к самообучению; - лояльное (корректное) отношение к пользователям, умение разобраться в проблеме и оказать пользователям помощь; "," Работа в группе программистов 1С. Сопровождение, и доработка конфигурации 1С УПП на платформе 8.3; Сопровождение, и доработка конфигурации 1С ЗУП на платформе 8.3; Разработка инструкций и регламентов, связанных с использованием, доработкой и поддержкой конфигураций 1С; Постановка задачи для ТП аутсорсинга 1С и тестирование результатов. Установка обновлений конфигураций с учетом имеющихся доработок; Консультирование сотрудников по работе в 1С; Участие в реализации проектов предприятия на платформе 1С (автоматизация закупочной деятельности, и другие). "," Доставка туда/обратно транспортом предприятия (вахта).З/п полностью белая, выплачивается 2 раза в месяц (аванс+з/п). Ежегодная обязательная индексация З/п. Премия по итогам работы за год. Возможны премии за особо важные и срочные работы. Полный социальный пакет в соответствии с трудовым кодексом РФ. Доплата за выслугу лет, дополнительные дни к отпуску. Дополнительные социальные льготы, определяемые Коллективным договором и связанные с выслугой лет. Обучение на КПК за счет предприятия. Собственная столовая и спортивный комплекс на территории.",1С программирование|1С: Управление Производственным Предприятием|SQL|XML|1С: Зарплата и управление персоналом
648,648,программист c#,Челябинск,60000.0,60000.0,Мегаполис,2019-10-17T18:05:06+0300,От 1 года до 3 лет,Полный день,Полная занятость,"Обязанности: 1. Развитие существующих проектов. 2. Разработка новых программных продуктов. 3. Консультирование пользователей предприятия, работающих с внедренным ПО. Требования: Профильное образование Хорошее знание C# Опыт работы с MS Visual Studio для C#. Наличие законченных проектов на C# Опыт использования систем управления версиями. Знание реляционный баз данных, MS SQL Server (написание и оптимизация SQL запросов в Transact SQL) Дополнительным плюсом будет опыт работы с базами данных Firebird. Условия: Группа компаний &quot;Мегаполис&quot; примет на постоянную работу программиста C#. Мы предлагаем: Пятидневную рабочую неделю с 10.00 до 19.00. Официальное трудоустройство, полный соц. пакет. Дружный молодой коллектив. Интересные задачи, возможности профессионального и карьерного роста."," Профильное образование Хорошее знание C# Опыт работы с MS Visual Studio для C#. Наличие законченных проектов на C# Опыт использования систем управления версиями. Знание реляционный баз данных, MS SQL Server (написание и оптимизация SQL запросов в Transact SQL) Дополнительным плюсом будет опыт работы с базами данных Firebird. "," 1. Развитие существующих проектов. 2. Разработка новых программных продуктов. 3. Консультирование пользователей предприятия, работающих с внедренным ПО. "," Группа компаний &quot;Мегаполис&quot; примет на постоянную работу программиста C#. Мы предлагаем: Пятидневную рабочую неделю с 10.00 до 19.00. Официальное трудоустройство, полный соц. пакет. Дружный молодой коллектив. Интересные задачи, возможности профессионального и карьерного роста.",
428,428,преподаватель курсов по программированию,Краснодар,,20000.0,Алгоритмика г. Краснодар,2019-09-24T20:04:28+0300,От 1 года до 3 лет,Гибкий график,Частичная занятость,"Алгоритмика -­ это крупнейший образовательный проект по обучению детей программированию! С 2016 года мы активно занимаемся разработкой и внедрением новейших IT технологий в обучение школьников. На наших уроках дети не только учатся программированию, но и развивают логику и мышление, учатся проектной и командной работе, проявлять креативность и творческие способности. У нас чёткие и достижимые цели! Мы постоянно обучаемся сами и развиваем свою команду! Наша компания активно развивается, и мы ищем энергичных и доброжелательных преподавателей! НАМ ВАЖНО, ЧТОБЫ ВЫ ОБЛАДАЛИ: Ответственностью Пунктуальностью Грамотной речью Опытом работы с детьми Умением объяснять сложные вещи простыми словами Знанием любого языка программирования Интересом к сфере образования Желанием развиваться И любили общаться с детьми ЧЕМ НУЖНО БУДЕТ ЗАНИМАТЬСЯ: Проводить мастер-классы и занятия по программированию для детей 6-17 лет Поддерживать интерес и мотивацию учеников к обучению Формировать у учеников лигическое мышление, развивать их технические и творческие способности Работать в бэк-офисе и вести отчётность ЧЕГО НЕ БУДЕТ: Рутины Скуки Бездушного отношения Унылой команды ЧТО МЫ ПРЕДЛАГАЕМ: Гибкий график. Согласуем индивидуально! Можно работать от 2-х часов в неделю Возможность обучать замотивированных детей, которые стремятся узнать все о современных технологиях Корпоративные обучения Карьерный рост Дружелюбный коллектив, увлеченный своим делом Если Вы хотите в нашу команду, то в отклике укажите чем вас заинтересовала наша вакансия, расскажите о своих навыках и почему именно вы идеально впишетесь в нашу команду.",,,,Работа в команде|Преподаватель|Навыки межличностного общения|Коммуникабельность
