,Unnamed: 0,name,area,min_salary,max_salary,employer,published_at,experience,schedule,employment,description,requirements,duties,conditions,key_skills
996,996,программист omnitracker,Екатеринбург,35000.0,50000.0,Уральский центр систем безопасности,2019-10-21T11:31:36+0300,Нет опыта,Полный день,Полная занятость,"УЦСБ - один из ведущих системных интеграторов на Урале, мы специализируемся на решениях по информационной безопасности. Мы открываем вакансию в группе поддержки системы OMNITRACKER, с помощью которой мы автоматизируем большое количество бизнес-процессов нашей компании. Нам нужен сотрудник, желающий развиваться в прикладной и аналитической областях направления автоматизации бизнес-процессов, имеющий хотя бы базовые навыки программирования и готовый изучать новые для себя продукты и процессы. Со своей стороны гарантируем обучение, поддержку и большое количество интересных задач - скучно не будет, мы обещаем :) Мы ждем от вас: Высшее образование (техническое, математическое). Логическое/системное мышление, склонность к упорядочиванию и систематизации информации. Понимание, что такое ООП, умение разрабатывать и описывать алгоритмы. Навык написания скриптов на vb/vba (макросы в MS Office подходят). Умение разбираться в чужой логике и выявлять в ней ошибки. Умение объяснять «на пальцах» очевидные и не очень вещи непосвященным пользователям. Устную и письменную грамотность. Терпеливость и дружелюбие. Обучаемость и желание учиться. Приветствуются: Знания VBS / CSS / PHP / HTML. Опыт разработки сопроводительной документации, инструкций для пользователей. Опыт работы с базами данных MS SQL. Обязанности: Доработка существующей конфигурации OMNITRACKER в соответствии с имеющимися требованиями. Документирование результата (разработка инструкций, памяток). Оказание консультаций по функционалу и использованию системы (поддержка пользователей). Мы предлагаем: Обучение всем необходимым навыкам. Большое количество разноплановых и интересных задач. Возможность профессионального роста и развития. Дружную команду и здоровую атмосферу :)",,,,VBScript|CSS|PHP|HTML|MS SQL|ООП|VBA
262,262,web дизайнер,Краснодар,35000.0,40000.0,АйТиПарк,2019-10-14T15:33:49+0300,От 1 года до 3 лет,Полный день,Полная занятость,"Обязанности: Разработка концепций и реализация дизайна интерфейсов; Отрисовка макетов и элементов интерфейса / адаптив; Контроль качества реализации интерфейсов разработчиками; Требования: Опыт работы от 1 года Наличие портфолио; Знание основ композиции, типографики; Понимание принципов пользовательского взаимодействия и UX; Основы анимации интерфейсов и знания принципов HTML‚ CSS верстки будут плюсом; Готовность выполнить тестовое задание. Знание программ: Illustrator; Photoshop; Figma/Sketch; Ключевые навыки: Figma/Sketch; Illustrator; Photoshop; Грамотная устная и письменная речь; Активная жизненная позиция, дисциплинированность и ответственность; Умение анализировать и предлагать обоснованные решения. Мы предлагаем: Стабильную заработную плату + премии и бонусы, Профессиональное развитие и карьерный рост, Самореализацию и востребованность, Удобное месторасположение офиса (в центре города), Регулярные корпоративные мероприятия: выезды на море и в горы, велопрогулки, праздники и другие поводы. Официальное оформление согласно ТК РФ, Удобный график работы. В нашей компании каждый — профессионал своего дела. Стань частью команды ITipark!",, Разработка концепций и реализация дизайна интерфейсов; Отрисовка макетов и элементов интерфейса / адаптив; Контроль качества реализации интерфейсов разработчиками; ,,Adobe Illustrator|Adobe Photoshop|CSS|UI|HTML
920,920,специалист по программному обеспечению,Екатеринбург,35000.0,40000.0,Уральский завод гражданской авиации,2019-09-27T06:21:39+0300,От 1 года до 3 лет,Полный день,Полная занятость,"АО «Уральский завод гражданской авиации» приглашает принять участие в конкурсе на позицию специалиста по программному обеспечению летательных аппаратов: Обязанности: настройка и калибровка систем самолёта; тестирование самолётных систем; работа со специализированным программным обеспечением. Требования: высшее техническое образование - электроника/электротехника; стаж работы на производстве на подобных должностях от 1 года; ответственность, исполнительность, готовность к самообучению. Условия: работа в дружном коллективе на крупном развивающемся предприятии; достойная и своевременная заработная плата + расширенный соц. пакет; официальное трудоустройство в соответствии с ТК РФ; место работы: г. Арамиль, аэропорт Уктус; удобный график работы: 5/2 с 8.00 до 17.00; возможность личностного и профессионального роста; предоставление мест в детском саду; корпоративные мероприятия, спорт."," высшее техническое образование - электроника/электротехника; стаж работы на производстве на подобных должностях от 1 года; ответственность, исполнительность, готовность к самообучению. ", настройка и калибровка систем самолёта; тестирование самолётных систем; работа со специализированным программным обеспечением. ," работа в дружном коллективе на крупном развивающемся предприятии; достойная и своевременная заработная плата + расширенный соц. пакет; официальное трудоустройство в соответствии с ТК РФ; место работы: г. Арамиль, аэропорт Уктус; удобный график работы: 5/2 с 8.00 до 17.00; возможность личностного и профессионального роста; предоставление мест в детском саду; корпоративные мероприятия, спорт.",
999,999,ведущий программист,Екатеринбург,35000.0,40000.0,"Новая больница, Медицинское объединение",2019-10-14T12:17:29+0300,От 3 до 6 лет,Полный день,Полная занятость,"ООО МО &quot;Новая больница&quot; (Фармотдел) приглашает Ведущего ПРОГРАММИСТА Требования: - знание Delphi или другого языка ООП; - знание общих принципов работы и программирования баз данных; - опыт написания и/или доработки реальных программ. Дополнительно: - представление о языках запросов SQL; - опыт работы с большими проектами, коллективной работы. - знакомство с системами ERP типа 1С и другими; Обязанности: - программирование Microsoft Navision. Условия: &quot;белая&quot; заработная плата; стабильность, интересные задачи; официальное трудоустройство; район работы: ВИЗ."," - знание Delphi или другого языка ООП; - знание общих принципов работы и программирования баз данных; - опыт написания и/или доработки реальных программ. Дополнительно: - представление о языках запросов SQL; - опыт работы с большими проектами, коллективной работы. - знакомство с системами ERP типа 1С и другими; Обязанности: - программирование Microsoft Navision. ",," &quot;белая&quot; заработная плата; стабильность, интересные задачи; официальное трудоустройство; район работы: ВИЗ.",
816,816,эксперт (радиотехнические экспертизы),Екатеринбург,35000.0,40000.0,ЭКЦ ГУ МВД России по Свердловской области,2019-10-12T05:33:52+0300,Нет опыта,Полный день,Полная занятость,"Основные требования к кандидатам на должность: - высшее техническое в области конструирования и технологии производства радиоэлектронных средств; - годность по состоянию здоровья к службе в органах внутренних дел (к военной службе). Обязанности: - производство радиотехнических экспертиз . Предоставляются льготы: - льготная пенсия; - оплачиваемый отпуск от 40 дней; - оплачиваемый проезд к месту проведения отпуска и обратно сотруднику и одному члену семьи; - предоставление места ребенку в детском дошкольном учреждении, школе вне очереди; - бесплатное медицинское обслуживание; - бесплатное страхование жизни и здоровья; - и др.",,,,
943,943,веб программист,Екатеринбург,35000.0,60000.0,Media Army,2019-10-01T07:16:33+0300,От 1 года до 3 лет,Полный день,Полная занятость,"Ищем web-программиста для разработки проектов на Битриксе в команду Media Army для проектного сотрудничества. Задачи Выполнение задач по разработке и поддержке сайтов на системе Битрикс: вёрстка по дизайн-макетам, программирование различного функционала, правка багов, доработки. Уровень профессионализма Знание веб-разработки, умение четко и понятно коммуницировать с менеджером проекта, умение решать проблемы за отведённое время, приветствуется знание системы Битрикс и опыт работы с ней. Требования — Знание веб-разработки (PHP, JavaScript, CSS, HTML). — Пунктуальность и умение уложиться в отведённое на задачу время. — Умение понятно и четко коммуницировать в письменной форме. — Аккуратность и педантичность в работе. Условия — Официальное трудоустройство. — Пятидневная рабочая неделя с 9:00 до 18:00. — Офис в центре Екатеринбурга. — Стабильная работа в надежной компании. — Интересные и сложные задачи.",,,,CSS|JavaScript|MySQL|PHP|HTML|1С-Битрикс
651,651,программист 1с,Челябинск,35000.0,50000.0,"Эмис, ГК",2019-10-21T07:56:53+0300,Нет опыта,Полный день,Полная занятость,"Обязанности: Поддержание работы существующей базы 1С, доработка конфигурации, создание внешних печатных форм, обработок, отчетов. Написание инструкций, консультирование и обучение пользователей работе с программой. Требования: Законченное высшее профильное образование. Разработка в среде 1С:Предприятие 8.2-8.3 – хороший уровень. Знание основ бухгалтерского и налогового учета. Знание различных методик обмена данными. Знание предметных областей: RLS, управляемые блокировки. Опыт разработки управляемого приложения (управляемые формы). Хорошие знания языка запросов и СКД. Приветствуется наличие сертификатов 1С. Коммуникабельность. Ответственность. Стрессоустойчивость. Самостоятельность. Умение работать в команде. Условия: Отечественное производственное предприятие Стабильная заработная плата. Отдельные виды поощрения за инициативность. Корпоративный отдых. Дружный, молодой коллектив. Пятидневная рабочая неделя, рабочий день с 8-30ч до 17-00ч Предприятие находится в д. Казанцево, доставка служебным транспортом. Обязательно резюме по электронной почте, с указанием вакансии."," Законченное высшее профильное образование. Разработка в среде 1С:Предприятие 8.2-8.3 – хороший уровень. Знание основ бухгалтерского и налогового учета. Знание различных методик обмена данными. Знание предметных областей: RLS, управляемые блокировки. Опыт разработки управляемого приложения (управляемые формы). Хорошие знания языка запросов и СКД. Приветствуется наличие сертификатов 1С. Коммуникабельность. Ответственность. Стрессоустойчивость. Самостоятельность. Умение работать в команде. "," Поддержание работы существующей базы 1С, доработка конфигурации, создание внешних печатных форм, обработок, отчетов. Написание инструкций, консультирование и обучение пользователей работе с программой. "," Отечественное производственное предприятие Стабильная заработная плата. Отдельные виды поощрения за инициативность. Корпоративный отдых. Дружный, молодой коллектив. Пятидневная рабочая неделя, рабочий день с 8-30ч до 17-00ч Предприятие находится в д. Казанцево, доставка служебным транспортом. Обязательно резюме по электронной почте, с указанием вакансии.",1С программирование
801,801,web разработчик,Екатеринбург,35000.0,45000.0,МКСмедиа,2019-10-18T16:00:15+0300,От 1 года до 3 лет,Полный день,Полная занятость,"MKSmedia – это динамично развивающееся рекламное агентство, с очень амбициозными целями. Наш основной актив – это профессионалы, работающие в команде. В копилке MKSmedia более 100-и постоянных клиентов, более 2 000 успешно реализованных проектов в области SEO, сайтостроения, контекстной рекламы. И сегодня у вас есть отличная возможность влиться в наш коллектив, прокачать себя и неплохо заработать. Напишите в сопроводительном письме почему именно вы должны занять данную должность. В чем ваше преимущества перед другими. Основные направления нашей деятельности: Комплексный интернет-маркетинг: создание и продвижение web-проектов в поисковых системах, контекстная реклама (Яндекс.Директ и Google.Adwords), реклама в социальных сетях; В нашу команду требуется первоклассный Web-программист с желанием развиваться и стремлением зарабатывать. Наши требования к кандидатам: Знания HTML5, CSS3 (вёрстка кроссбраузерная и кроссплатформенная); Умение работать с js, ajax, js-фреймворками (jquery); Знание PHP на уровне правок; Опыт работы с системами управления; Умение писать чистый и короткий, семантичный код CSS/HTML; Знание основ СЕО-оптмизации и семантики; Свое письмо вы должны закончить фразой-только вперед ни шагу назад. Способность разобраться в любой CMS; Знание различия браузеров; Способность быстро входить в суть задач и оперативно их реализовывать; Внимательность к деталям, скрупулезность; Опыт работы от года; Ваши обязанности в рамках компании: Участие в разработке сайта компании в различной сложности; Управление и техническая поддержка сайта компании; Решите загадку, ответ напишите в сопроводительном письме. У отца Мэри есть 5 дочерей: Чача, Чече, Чичи, Чочо. Как зовут 5 дочь? Верстка макетов, инфографики; Корректировка и добавление информации на сайтах; Доработка и правки на базе программных модулей CMS Что мы можем предложить: Идеально для тех, кто хочет реализовать свои навыки и получать за это деньги; Работа удаленная, Вы можете находится в любой точке мира; Официальное трудоустройство, оформление по ТК РФ; График работы: 5/2; Открытость руководства к новым идеям;",,,,
