,Unnamed: 0,name,area,min_salary,max_salary,employer,published_at,experience,schedule,employment,description,requirements,duties,conditions,key_skills
524,524,web программист,Челябинск,50000.0,,ПрограмЛаб,2019-09-23T13:20:43+0300,От 3 до 6 лет,Полный день,Полная занятость,"Обязанности: Разработка Web-сервисов Разработка API для мобильных приложений Разработка внутренних сервисов компании Требования: Понимание и использование принципов ООП Работа с БД Уверенное знание PHP или Python и Django Опыт разработки высоконагруженных систем Условия: Работа над интересными и долгосрочными проектами Молодой и дружный коллектив Официальное трудоустройство Полный рабочий день, 5 дней в неделю (10.00 – 18.00) Заработная плата по результату собеседования Свое резюме отправляйте на указанную эл. почту!", Понимание и использование принципов ООП Работа с БД Уверенное знание PHP или Python и Django Опыт разработки высоконагруженных систем , Разработка Web-сервисов Разработка API для мобильных приложений Разработка внутренних сервисов компании ," Работа над интересными и долгосрочными проектами Молодой и дружный коллектив Официальное трудоустройство Полный рабочий день, 5 дней в неделю (10.00 – 18.00) Заработная плата по результату собеседования Свое резюме отправляйте на указанную эл. почту!",Python|Django Framework|JavaScript|CSS|HTML|PHP|MySQL|Git|ООП|jQuery|HTML5|HTTP|CSS3|PostgreSQL|PHP4|Yii|Ajax|XML|SQL|Nginx|phpMyAdmin
1019,1019,web программист,Самара,50000.0,110000.0,БАСС,2019-10-21T08:17:27+0300,От 1 года до 3 лет,Полный день,Полная занятость,"Обязанности: Участие в проектировании и разработке web-проектов различной степени сложности. Развитие существующих проектов компании, создание новых модулей, интеграция со сторонними сервисами. Требования: Опыт разработки Web-приложений не менее 2-х лет ; Знание ООП, успешный опыт работы с PHP 5.x Понимание реляционных баз данных (MySQL, PostgreSQLи т.п., опыт по оптимизации БД и запросов в них Понимание работы REST API и HTTP Опыт работы с системой контроля версий GIT Понимание верстки, уверенное владение HTML,CSS JavaScript Приветствуются навыки: Ajax, WebSocket, SOAP; Понимание принципов работы серверов (Apache, Nginx) Опыт работы с API сторонних сервисов (билетные системы, платежные системы и т.д.), парсерами, написание собственных Технический английский Условия: Заработная плата на руки, по результатам собеседования - от 50 000 до 110 000 рублей. Размер и темпы её роста мы обсуждаем на собеседовании, и зависят оба этих показателя в основном от коэффициента полезности каждого конкретного сотрудника (отталкиваться будем от опыта, знаний). Зарплата белая, фиксированная (не зависит от количества проектов), и своевременная. График работы 5/2. Испытательный срок 3 месяца. Официальное оформление, отпуск, больничный, согласно Трудового Кодекса РФ. Оформление полиса ДМС (добровольное медицинское страхование), корпоративные мероприятия с выездами на природу за счёт работодателя. Команда профессионалов, готовых поддержать твои инициативы. Возможность работы с новыми технологиями. Перспектива профессионального и карьерного роста. Обучение. Если тебе хочется большего, всегда есть возможности самореализации. Стильный чистый офис в тихом районе города, с хорошей транспортной развязкой (утром и вечером добираться против пробок). Современная техника, дополнительные мониторы и всё что нужно для продуктивной работы. Изолированное помещение с кондиционером и видом на сквер. Уголок релакса с мягким диваном и шезлонг качалкой, массажное кресло, кофемашина."," Опыт разработки Web-приложений не менее 2-х лет ; Знание ООП, успешный опыт работы с PHP 5.x Понимание реляционных баз данных (MySQL, PostgreSQLи т.п., опыт по оптимизации БД и запросов в них Понимание работы REST API и HTTP Опыт работы с системой контроля версий GIT Понимание верстки, уверенное владение HTML,CSS JavaScript Приветствуются навыки: Ajax, WebSocket, SOAP; Понимание принципов работы серверов (Apache, Nginx) Опыт работы с API сторонних сервисов (билетные системы, платежные системы и т.д.), парсерами, написание собственных Технический английский "," Участие в проектировании и разработке web-проектов различной степени сложности. Развитие существующих проектов компании, создание новых модулей, интеграция со сторонними сервисами. "," Заработная плата на руки, по результатам собеседования - от 50 000 до 110 000 рублей. Размер и темпы её роста мы обсуждаем на собеседовании, и зависят оба этих показателя в основном от коэффициента полезности каждого конкретного сотрудника (отталкиваться будем от опыта, знаний). Зарплата белая, фиксированная (не зависит от количества проектов), и своевременная. График работы 5/2. Испытательный срок 3 месяца. Официальное оформление, отпуск, больничный, согласно Трудового Кодекса РФ. Оформление полиса ДМС (добровольное медицинское страхование), корпоративные мероприятия с выездами на природу за счёт работодателя. Команда профессионалов, готовых поддержать твои инициативы. Возможность работы с новыми технологиями. Перспектива профессионального и карьерного роста. Обучение. Если тебе хочется большего, всегда есть возможности самореализации. Стильный чистый офис в тихом районе города, с хорошей транспортной развязкой (утром и вечером добираться против пробок). Современная техника, дополнительные мониторы и всё что нужно для продуктивной работы. Изолированное помещение с кондиционером и видом на сквер. Уголок релакса с мягким диваном и шезлонг качалкой, массажное кресло, кофемашина.","PHP, MySQL, JavaScript, CSS, HTML"
356,356,web программист,Краснодар,75000.0,,Базэл Аэро,2019-09-23T13:22:06+0300,От 1 года до 3 лет,Полный день,Полная занятость,"Дирекция по информационным и производственным технологиям приглашает в свои ряды человека, который: Обладает аналитическими способностями – умеет разбираться в текущих бизнес-процессах компании, сможет предложить новые инновационные варианты их автоматизации и оптимизации; Коммуникабелен. Знает современные методологии ведения проектов и разработки программных продуктов для реализации своих амбициозных задач как самостоятельно, так и в организованной команде профессионалов; Обладает инженерными навыками – умеет программировать, решать сложные алгоритмические задачи, структурировать разрозненные массивы данных и находить истинно верные решения. Обязанности: Краткосрочное планирование работы. Разработка по требованиям заказчика. Программирование под web. Внедрение и тестирование программных решений. Отслеживание современных трендов и внедрение инновационных ИТ-технологий в компании. Анализ эффективности существующих бизнес-процессов, их автоматизация и оптимизация. Сбор данных из разных источников для последующей оперативной обработки. Взаимодействие с сотрудниками подразделений компании с целью поиска новых точек развития. Сопровождение программных решений, обучение пользователей. Требования: Высшее образование: инженерное/техническое. Опыт работы – от 2-х лет. Знание одного или нескольких языков программирования (PHP, Html, CSS, JS, jQuery, Ajax). Опыт работы с базами данных MySQL, PostgreSQL, MS SQL. Знание одной из методологий управления проектами. Опыт самостоятельного решения нестандартных задач. Желательно знание методологии Agile. Опыт подготовки технических заданий. Понимание принципов MVC. Навыки работы с CMS Битрикс, Wordpress. Навыки работы с инструментами git, composer. Базовые навыки работы с современными фреймворками Yii2, Laravel, Bootstrap, Semantic-UI. Приветствуется опыт программирования для мобильных платформ. Знание английского языка – чтение технической литературы. Условия: Работа в компании АО &quot;Международный аэропорт &quot;Краснодар&quot;. Полный рабочий день 08:00-17:00, 5/2 (возможен ненормированный рабочий день). Оформление по ТК РФ. Возможность профессионального роста и развития. Стандартный срок рассмотрения резюме - 10 дней. Если Вы не получили положительного ответа на Ваше резюме, значит, пока мы не готовы сделать Вам предложение по работе. Но Ваше резюме будет сохранено в нашей базе данных и, в случае появления подходящей вакансии, мы обязательно свяжемся с Вами по указанным телефонам. Благодарим Вас за желание построить свою карьеру в нашей компании!"," Высшее образование: инженерное/техническое. Опыт работы – от 2-х лет. Знание одного или нескольких языков программирования (PHP, Html, CSS, JS, jQuery, Ajax). Опыт работы с базами данных MySQL, PostgreSQL, MS SQL. Знание одной из методологий управления проектами. Опыт самостоятельного решения нестандартных задач. Желательно знание методологии Agile. Опыт подготовки технических заданий. Понимание принципов MVC. Навыки работы с CMS Битрикс, Wordpress. Навыки работы с инструментами git, composer. Базовые навыки работы с современными фреймворками Yii2, Laravel, Bootstrap, Semantic-UI. Приветствуется опыт программирования для мобильных платформ. Знание английского языка – чтение технической литературы. "," Краткосрочное планирование работы. Разработка по требованиям заказчика. Программирование под web. Внедрение и тестирование программных решений. Отслеживание современных трендов и внедрение инновационных ИТ-технологий в компании. Анализ эффективности существующих бизнес-процессов, их автоматизация и оптимизация. Сбор данных из разных источников для последующей оперативной обработки. Взаимодействие с сотрудниками подразделений компании с целью поиска новых точек развития. Сопровождение программных решений, обучение пользователей. "," Работа в компании АО &quot;Международный аэропорт &quot;Краснодар&quot;. Полный рабочий день 08:00-17:00, 5/2 (возможен ненормированный рабочий день). Оформление по ТК РФ. Возможность профессионального роста и развития. Стандартный срок рассмотрения резюме - 10 дней. Если Вы не получили положительного ответа на Ваше резюме, значит, пока мы не готовы сделать Вам предложение по работе. Но Ваше резюме будет сохранено в нашей базе данных и, в случае появления подходящей вакансии, мы обязательно свяжемся с Вами по указанным телефонам. Благодарим Вас за желание построить свою карьеру в нашей компании!",PHP|HTML|CSS|jQuery|Ajax|MySQL|PostgreSQL|MS SQL|Agile Project Management|MVC|Git|Avid Media Composer|Bootstrap
453,453,web программист,Краснодар,80000.0,90000.0,Кубань Инструмент,2019-10-14T16:29:44+0300,Нет опыта,Полный день,Полная занятость,"Обязанности: 1. Доработка существующих проектов на базе 1С-Битрикс 2. Интегрирование с внешними системами; 3. Администрирование серверов в части настройки (LAMP/LEMP) 4. Предлагать улучшения к этим проектам и реализовывать их; Требования: Опыт работы с 1С-Битрикс, умнее разрабатывать собственные компоненты и модули; Уверенное знание PHP; Умение работать с базами MySQL, уметь написать чистые запросы и с использованием популярных ORM; Знание JS на уровне, достаточном для написания фронтовой части к своим компонентам с нуля; Знание HTML, CSS, чтобы самостоятельно уметь сверстать по макету из Figma, PSD; Условия: пятидневка работа в офисе с 9 до 18:00 оплачивается питание (обед) оформление по ТК"," Опыт работы с 1С-Битрикс, умнее разрабатывать собственные компоненты и модули; Уверенное знание PHP; Умение работать с базами MySQL, уметь написать чистые запросы и с использованием популярных ORM; Знание JS на уровне, достаточном для написания фронтовой части к своим компонентам с нуля; Знание HTML, CSS, чтобы самостоятельно уметь сверстать по макету из Figma, PSD; ", 1. Доработка существующих проектов на базе 1С-Битрикс 2. Интегрирование с внешними системами; 3. Администрирование серверов в части настройки (LAMP/LEMP) 4. Предлагать улучшения к этим проектам и реализовывать их; , пятидневка работа в офисе с 9 до 18:00 оплачивается питание (обед) оформление по ТК,MySQL|HTML|PHP|Git|CSS
1118,1118,web программист,Самара,,75000.0,Группа компаний «Деньги сразу»,2019-09-30T10:36:08+0300,От 1 года до 3 лет,Удаленная работа,Полная занятость,"Обязанности: Доработка и совершенствование веб-проектов компании; Участие в проектировании и разработка новых проектов. Требования: знание операционных системы на базе ядра linux; умение настраивать свое собственное веб окружение (включая полную сборку из исходников); уверенное знание языка PHP 7; уверенное знание HTML; уверенное знание JavaScript; уверенное знание CSS3; опыт работы со сборщиками проектов gulp, webpack; уверенное знание git; продвинутое знание фреймворка yii2 (проект пишется на нем); умение работать в IDE PhpStorm (писать код в блокноте запрещено); знание протокола SOAP, написание веб-сервисов для обмена с другими системами; знание REST; опыт работы с системами управления проектами. Условия: Профессиональный и карьерный рост, новые знания, интересные задачи; Оформление согласно ТК РФ; График работы: 5/2. с 09.00 до 18.00 (часы работы обсуждаем индивидуально); Удаленный режим работы; Достойная заработная плата."," знание операционных системы на базе ядра linux; умение настраивать свое собственное веб окружение (включая полную сборку из исходников); уверенное знание языка PHP 7; уверенное знание HTML; уверенное знание JavaScript; уверенное знание CSS3; опыт работы со сборщиками проектов gulp, webpack; уверенное знание git; продвинутое знание фреймворка yii2 (проект пишется на нем); умение работать в IDE PhpStorm (писать код в блокноте запрещено); знание протокола SOAP, написание веб-сервисов для обмена с другими системами; знание REST; опыт работы с системами управления проектами. ", Доработка и совершенствование веб-проектов компании; Участие в проектировании и разработка новых проектов. ," Профессиональный и карьерный рост, новые знания, интересные задачи; Оформление согласно ТК РФ; График работы: 5/2. с 09.00 до 18.00 (часы работы обсуждаем индивидуально); Удаленный режим работы; Достойная заработная плата.",
