,Unnamed: 0,name,area,min_salary,max_salary,employer,published_at,experience,schedule,employment,description,requirements,duties,conditions,key_skills,days,"(12995.0, 43440.0]","(43440.0, 73885.0]","(73885.0, 104330.0]","(104330.0, 134775.0]","(134775.0, 165220.0]","(165220.0, 195665.0]","(195665.0, 226110.0]","(226110.0, 256555.0]","(256555.0, 287000.0]","(18500.0, 61555.556]","(61555.556, 104611.111]","(104611.111, 147666.667]","(147666.667, 190722.222]","(190722.222, 233777.778]","(233777.778, 276833.333]","(276833.333, 319888.889]","(319888.889, 362944.444]","(362944.444, 406000.0]",Екатеринбург,Краснодар,Новосибирск,Самара,Челябинск,Более 6 лет,Нет опыта,От 1 года до 3 лет,От 3 до 6 лет,Вахтовый метод,Гибкий график,Полный день,Сменный график,Удаленная работа,Полная занятость,Проектная работа,Стажировка,Частичная занятость,Без ключевых навыков,аналитические способности,Исполнительность,Грамотность,внимательность,Другое
296,296,аналитик,Краснодар,50000.0,42500.0,"МАГНИТ, Розничная сеть",2019-10-18T10:33:08+0300,От 1 года до 3 лет,Полный день,Полная занятость,"Обязанности: Сопровождение контрактования наемного транспорта; расчет уровня сервиса контрагентов; планирование расстановки транспорта по РФ; анализ разработанных бизнес-процессов и инструментов контроля; формирование и анализ регулярной отчетности; взаимодействие с контрагентами по вопросам качества предоставленных услуг. Требования: высшее образование (математическое, информатика, системный анализ, математические методы в экономике); опыт работы в аналогичной должности от 1 года; уверенный пользователь ПК: MS Office (Excel). Условия: Работа в Головной Компании сети магазинов &quot;Магнит&quot; (г. Краснодар) Официальная заработная плата; Интересная работа в команде профессионалов; Корпоративное обучение; Корпоративные пенсионные программы; Спортивный зал для сотрудников."," высшее образование (математическое, информатика, системный анализ, математические методы в экономике); опыт работы в аналогичной должности от 1 года; уверенный пользователь ПК: MS Office (Excel). ", Сопровождение контрактования наемного транспорта; расчет уровня сервиса контрагентов; планирование расстановки транспорта по РФ; анализ разработанных бизнес-процессов и инструментов контроля; формирование и анализ регулярной отчетности; взаимодействие с контрагентами по вопросам качества предоставленных услуг. , Работа в Головной Компании сети магазинов &quot;Магнит&quot; (г. Краснодар) Официальная заработная плата; Интересная работа в команде профессионалов; Корпоративное обучение; Корпоративные пенсионные программы; Спортивный зал для сотрудников.,Анализ данных|Аналитические исследования|Факторный анализ|Математический анализ,0.1,0,1,0,0,0,0,0,0,0,1,0,0,0,0,0,0,0,0,0,1,0,0,0,0,0,1,0,0,0,1,0,0,1,0,0,0,0,0,0,0,0,1
390,390,аналитик,Краснодар,50000.0,45000.0,"МАГНИТ, Розничная сеть",2019-10-01T15:04:41+0300,Нет опыта,Полный день,Полная занятость,"Обязанности: Осуществлять анализ основных показателей по направлению; Проводить анализ, подготавливать аналитические материалы; Участвовать во внедрении результатов анализа отчетности и регулярных процессах компании. Готовить предложения для принятия управленческих решений. Требования: Высшее образование (прикладная математика, прикладная информатика, экономика); Высокий уровень логического мышления, знание математической логики, приветствуются навыки программирования; Владение навыками пользования компьютером и специализированными программами для обработки статистических данных, умение собирать различные цифровые данные, анализировать и в последствии уметь правильно трактовать их, прогнозировать возможный результат на основе имеющейся информации; Аналитический склад ума, ответственность, целеустремлённость, внимательность, умение работать в команде, гибкость, дипломатичность, способность работать в режиме многозадачности; Желателен опыт работы в сфере аналитики от 1 года непрерывной работы; Уверенный пользователь MS Excel (сводные таблицы, впр, логические формулы).; Базовые знания MS SQL (на уровне простых запросов). Условия: Работа в Головной компании сети магазинов Магнит график работы: 5/2, с 09:00 до 18:00; официальная заработная плата; интересная работа в команде профессионалов; корпоративное обучение; корпоративные пенсионные программы; спортивный зал для сотрудников."," Высшее образование (прикладная математика, прикладная информатика, экономика); Высокий уровень логического мышления, знание математической логики, приветствуются навыки программирования; Владение навыками пользования компьютером и специализированными программами для обработки статистических данных, умение собирать различные цифровые данные, анализировать и в последствии уметь правильно трактовать их, прогнозировать возможный результат на основе имеющейся информации; Аналитический склад ума, ответственность, целеустремлённость, внимательность, умение работать в команде, гибкость, дипломатичность, способность работать в режиме многозадачности; Желателен опыт работы в сфере аналитики от 1 года непрерывной работы; Уверенный пользователь MS Excel (сводные таблицы, впр, логические формулы).; Базовые знания MS SQL (на уровне простых запросов). "," Осуществлять анализ основных показателей по направлению; Проводить анализ, подготавливать аналитические материалы; Участвовать во внедрении результатов анализа отчетности и регулярных процессах компании. Готовить предложения для принятия управленческих решений. "," Работа в Головной компании сети магазинов Магнит график работы: 5/2, с 09:00 до 18:00; официальная заработная плата; интересная работа в команде профессионалов; корпоративное обучение; корпоративные пенсионные программы; спортивный зал для сотрудников.",Статистический анализ|MS Excel|MS SQL,0.6666666666666666,0,1,0,0,0,0,0,0,0,1,0,0,0,0,0,0,0,0,0,1,0,0,0,0,1,0,0,0,0,1,0,0,1,0,0,0,0,0,0,0,0,1
263,263,аналитик,Краснодар,50000.0,48000.0,"МАГНИТ, Розничная сеть",2019-10-07T09:32:57+0300,От 1 года до 3 лет,Полный день,Полная занятость,"Обязанности: анализ основных показателей магазина; разработка технологий для проведения анализа товарного запаса; выявление проблем, влияющих на корректность заказа; подготовка разовой и регулярной аналитики. Требования: высшее образование (прикладная информатика, математика, системный анализ); уверенный пользователь Excel, SQL; коммуникабельность, стрессоустойчивость, умение работать в режиме многозадачности; Условия: график работы 5/2 с 9:00 до 18:00; официальная заработная плата; интересная работа в команде профессионалов; корпоративное обучение; спортивный зал для сотрудников."," высшее образование (прикладная информатика, математика, системный анализ); уверенный пользователь Excel, SQL; коммуникабельность, стрессоустойчивость, умение работать в режиме многозадачности; "," анализ основных показателей магазина; разработка технологий для проведения анализа товарного запаса; выявление проблем, влияющих на корректность заказа; подготовка разовой и регулярной аналитики. ", график работы 5/2 с 9:00 до 18:00; официальная заработная плата; интересная работа в команде профессионалов; корпоративное обучение; спортивный зал для сотрудников.,Без ключевых навыков,0.4666666666666667,0,1,0,0,0,0,0,0,0,1,0,0,0,0,0,0,0,0,0,1,0,0,0,0,0,1,0,0,0,1,0,0,1,0,0,0,1,0,0,0,0,0
323,323,аналитик,Краснодар,50000.0,51375.0,Сеть аптек Аптечный склад,2019-10-18T12:12:15+0300,От 1 года до 3 лет,Полный день,Полная занятость,"Работа в нашей компании - это возможность реализовать себя как специалиста, «расти» вместе с нами, получить карьерный рост. Уже сейчас у нас открыто более 1500 аптек, мы представлены в 40 регионах, у нас 3 формата работы, чтобы соответствовать запросам разных клиентов. Не упусти свой шанс начать карьеру в стабильной, крупной компании! Обязанности: - Формализация, моделирование и оптимизация бизнес-процессов Компании; - Формализация требований к программному обеспечению на основании потребностей заказчиков - Подготовка и согласование технических заданий на разработку и модернизацию программного обеспечения; - Построение и описание моделей функциональных подсистем, процессов и объектов предметной области; - Составление пользовательских инструкций и документаций - Контроль качества разработки программных продуктов. - Контроль соблюдения сроков выполнения работ в зоне ответственности Требования: - образование (техническое, экономическое, прикладная информатика, математика); - Опыт подготовки технических заданий к разработке программного обеспечения; - Опыт моделирования бизнес-процессов предприятия; - Базовые знания SQL, опыт работы с СУБД (Oracle, MS Access); - Приветствуется опыт работы бизнес-аналитиком или системным аналитиком; - Приветствуется опыт внедрения программного обеспечения, контроля качества; - Приветствуется опыт работы с Visio, ERwin, BPwin, Rational Rose; - Ориентация на результат, ответственность, целеустремленность, готовность к саморазвитию, умение работать в команде. - Системность, способность расставлять приоритеты, способность вести несколько задач одновременно, стрессоустойчивость; - Грамотная письменная речь Условия: - Официальное трудоустройство; - График 5/2 с 9:00 до 18:00; - Работа в крупной и стабильной компании; - Интересные и разнообразные задачи - Интересная работа в команде профессионалов - Возможность внутрифирменного обучения и роста - Рабочее место ЮМР."," - образование (техническое, экономическое, прикладная информатика, математика); - Опыт подготовки технических заданий к разработке программного обеспечения; - Опыт моделирования бизнес-процессов предприятия; - Базовые знания SQL, опыт работы с СУБД (Oracle, MS Access); - Приветствуется опыт работы бизнес-аналитиком или системным аналитиком; - Приветствуется опыт внедрения программного обеспечения, контроля качества; - Приветствуется опыт работы с Visio, ERwin, BPwin, Rational Rose; - Ориентация на результат, ответственность, целеустремленность, готовность к саморазвитию, умение работать в команде. - Системность, способность расставлять приоритеты, способность вести несколько задач одновременно, стрессоустойчивость; - Грамотная письменная речь "," - Формализация, моделирование и оптимизация бизнес-процессов Компании; - Формализация требований к программному обеспечению на основании потребностей заказчиков - Подготовка и согласование технических заданий на разработку и модернизацию программного обеспечения; - Построение и описание моделей функциональных подсистем, процессов и объектов предметной области; - Составление пользовательских инструкций и документаций - Контроль качества разработки программных продуктов. - Контроль соблюдения сроков выполнения работ в зоне ответственности ", - Официальное трудоустройство; - График 5/2 с 9:00 до 18:00; - Работа в крупной и стабильной компании; - Интересные и разнообразные задачи - Интересная работа в команде профессионалов - Возможность внутрифирменного обучения и роста - Рабочее место ЮМР.,СУБД|Моделирование бизнес процессов|ORACLE|MS Access,0.1,0,1,0,0,0,0,0,0,0,1,0,0,0,0,0,0,0,0,0,1,0,0,0,0,0,1,0,0,0,1,0,0,1,0,0,0,0,0,0,0,0,1
388,388,аналитик,Краснодар,50000.0,51375.0,"МАГНИТ, Розничная сеть",2019-10-07T09:33:25+0300,От 1 года до 3 лет,Полный день,Полная занятость,"Обязанности: Создание, поддержка и развитие аналитических инструментов и отчетов; аналитика торгового пространства; анализ тестовых мероприятий в внутри торговой точки; анализ эффективности ассортимента и его оптимизация; расчет эталонов и матриц; факторный анализ категорий (влияние ассортимента, цены, промо-мероприятий и других факторов на потребление категорий); подготовка аналитических записок с выводами и предложениями). Требования: высшее образование (математическое, информатика, системный анализ, математические методы в экономике); знание математической статистики, математических методов; опыт методологической проработки и разработки отчетности; опыт подготовки презентаций; умение строить модели, проверять гипотезы и давать рекомендации на основании проведенного анализа (уметь разрабатывать собственные методики анализа); знание методов анализа (корреляционный, регрессионный, факторный, кластерный); уверенный пользователь ПК: MS Office (Excel), SQL; опыт владения R или Python; знание пакета анализа данных, power Pivot, Power BI, Tableau опыт работы с базами данных (желательно Teradata). Условия: Работа в Головной Компании сети магазинов &quot;Магнит&quot; (г. Краснодар) Официальная заработная плата; Интересная работа в команде профессионалов; Корпоративное обучение; Корпоративные пенсионные программы; Спортивный зал для сотрудников."," высшее образование (математическое, информатика, системный анализ, математические методы в экономике); знание математической статистики, математических методов; опыт методологической проработки и разработки отчетности; опыт подготовки презентаций; умение строить модели, проверять гипотезы и давать рекомендации на основании проведенного анализа (уметь разрабатывать собственные методики анализа); знание методов анализа (корреляционный, регрессионный, факторный, кластерный); уверенный пользователь ПК: MS Office (Excel), SQL; опыт владения R или Python; знание пакета анализа данных, power Pivot, Power BI, Tableau опыт работы с базами данных (желательно Teradata). "," Создание, поддержка и развитие аналитических инструментов и отчетов; аналитика торгового пространства; анализ тестовых мероприятий в внутри торговой точки; анализ эффективности ассортимента и его оптимизация; расчет эталонов и матриц; факторный анализ категорий (влияние ассортимента, цены, промо-мероприятий и других факторов на потребление категорий); подготовка аналитических записок с выводами и предложениями). ", Работа в Головной Компании сети магазинов &quot;Магнит&quot; (г. Краснодар) Официальная заработная плата; Интересная работа в команде профессионалов; Корпоративное обучение; Корпоративные пенсионные программы; Спортивный зал для сотрудников.,Python|Базы данных|Математическая статистика|Анализ данных|Аналитические исследования|Факторный анализ|Математический анализ|Power BI|Power Pivot|SQL|Statistica,0.4666666666666667,0,1,0,0,0,0,0,0,0,1,0,0,0,0,0,0,0,0,0,1,0,0,0,0,0,1,0,0,0,1,0,0,1,0,0,0,0,0,0,0,0,1
