,Unnamed: 0,name,area,min_salary,max_salary,employer,published_at,experience,schedule,employment,description,requirements,duties,conditions,key_skills,days
62,62,backend,Новосибирск,95666.66666666669,146288.46153846153,НЦГИ,2019-10-09T09:55:10+0300,От 3 до 6 лет,Удаленная работа,Частичная занятость,"Привет! Мы ищем web-разработчика на платформе Bitrix (PHP web-developer) для развития нашего веб-сайта MyGenetics.ru и автоматизации бизнес-процессов. О нас: MyGenetics работает в области персональной генетики с 2013 года. Мы занимаемся разработкой ДНК-тестов, расшифровкой их результатов и составлением рекомендаций в области питания, спорта, косметологии, здоровья и нейрогенетики. MyGenetics — резидент Технопарка новосибирского Академгородка, ведущего центра развития наукоемких компаний в России, и квалифицированный резидент инновационного центра Skolkovo. За последний год мы разработали новый сайт, выпустили несколько новых продуктов, увеличили продажи в два раза. Чтобы делать еще больше новых и крутых продуктов, нам необходимо пополнение в рядах web-разработчиков. Что мы ждём от тебя: умение работать в команде умение работать самостоятельно любовь к обучению и поиску нестандартных решений знание платформы Bitrix - разработка, администрирование, кастомизация хорошее понимание полного стека web-технологий РНР / HTML / CSS / JS / jQuery базовые навыки веб-мастера и умение работать с облачной инфраструктурой умение создавать и работать с веб-API понимание принципов автоматизации Если у тебя есть портфолио, мы с удовольствием с ним познакомимся. Тебе предстоит делать: обеспечивать надежность, безопасность и удобство нашего сайта помочь нам в интеграции веб-сайта с другими бизнес-процессами компании: продажи, лаборатория, бухгалтерия, аналитика улучшить существующие и создать новые вспомогательные инструменты ведения бизнеса работать с командой разработки продуктов, сторонними исполнителями и партнерами Что мы предлагаем: работу в высокопрофессиональной команде не только IT-специалистов, но и генетиков. Это означает, что ты сможешь развиваться не только в своей сфере, но и получить полезные знания по питанию, спорту и продуктивности зарплата по итогам собеседования",Без требований,Без обязанностей,Без условий,Веб-программирование|1С-Битрикс|PHP|JavaScript|HTML,9
30,30,backend,Новосибирск,95666.66666666669,146288.46153846153,Экспобанк,2019-10-03T10:29:49+0300,От 3 до 6 лет,Полный день,Полная занятость,"В новое направление Экспобанк ищет Senior web-разработчика (PHP) для выполнения следующих задач: Разработка архитектуры проекта для системы управления и автоматизации конвейера карт. Выбор оптимальных программных и аппаратных решений Интеграция с различными внутренними и внешними сервисами и системами. Присоединяйся к нашей команде и принимай непосредственное участие в развитии новых технологий в банке! Требования: Опыт проектирования архитектуры приложений. Опыт работы с MySQL или PostgreSQL Опыт разработки на PHP (Laravel приветствуется). Опыт разработки на JavaScript (Vue.js приветствуется). Опыт оптимизации кода и базы данных Умение работать с Git. Желательно: Опыт работы с MongoDB Опыт работы с Redis Опыт оптимизации кода и базы данных Мы предлагаем: Конкурентный уровень дохода. &quot;Белая&quot; заработная плата. Официальное трудоустройство согласно ТК РФ, отпуск, больничный лист. Добровольное медицинское страхование (со стоматологией) после 6-ти месяцев работы в компании. График работы: понедельник-четверг с 9:00 до 18:00, пятница с 9.00 до 16.45. Удобное расположение офиса компании по линии м. Площадь Ленина.",Без требований,Без обязанностей,Без условий,Без ключевых навыков,15
419,419,backend,Новосибирск,95666.66666666669,146288.46153846153,AD.RU,2019-10-01T11:35:15+0300,От 3 до 6 лет,Полный день,Полная занятость,"Мы - AD.RU - крупный международный холдинг. Наша команда развивает проекты в сфере ADtech, HRtech, EDtech, B2C и Mobile и помогает значительно повысить капитализацию стартапов, используя уникальный маркетинговый опыт. В холдинге работает более 700 профессионалов, наши российские офисы расположены в Москве, Новосибирске, Воронеже, Калининграде, Туле, Ростове-на-Дону, Волгодонске. Представительские офисы в Лондоне и Сингапуре. В связи с активным расширением бизнеса и ростом пула задач мы приглашаем Вас присоединиться к нашей команде. Ваши Day-to-day задачи: возглавлять команду backend разработчиков в проектах; принимать активное участие в обсуждениях, решениях всех вопросов, связанных с проектом; самостоятельно писать код на проекте; разработка и масштабирование архитектуры и непосредственное участие в разработке новых и уже существующих проектов по мере их роста нагрузки и функционала; планирование, распределение задач, постановка целей в рамках команды, также организация командной работы; code review. Для успешного выполнения задач Вам понадобится: опыт управления проектами и командами от 5-ти человек более 2-ух лет; опыт реализации проектов на PHP 7; знание и опыт работы с Symfony 4.x (допустимо YII 2.x); опыт работы с GIT или другой системой управления версиями; знание и опыт работы с PostgreSQL/MYSQL(умение оптимизировать запросы для больших объемов данных); умение проектировать и создавать удобные remote APIs; понимание принципов OOP, SOLID и применение их на практике; знание и применение на практике паттернов проектирования; знание английского языка на уровне чтения технической документации; умение разбираться с чужим кодом и быстро включаться в процесс. Нам важно, чтобы наш сотрудник работал в максимально комфортных условиях, для этого мы предлагаем: возможность получить опыт/реализовать себя в международной digital компании с интернациональной командой в проектах от Америки до Китая; корпоративные занятия английским языком и возможность использовать язык в работе (наши коллеги в других странах говорят на английском); возможность посещать профильные внешние конференции по всему миру; неизменный оклад и дополнительные бонусы согласно выполненному KPI, которые будут превышать Ваши ожидания; комфортные условия работы в одном из наших офисов г. Новосибирска, по улице Коммунистическая улица, 6, м. Площадь Ленина; гибкий график: возможность расстаться с утренними пробками; официальное трудоустройство с первого дня по ТК РФ (все соц. выплаты согласно ТК РФ).",Без требований,Без обязанностей,Без условий,PHP|Git|ООП|Yii|Symfony|MySQL,17
116,116,backend,Новосибирск,95666.66666666669,146288.46153846153,Akvelon,2019-10-14T11:05:26+0300,От 3 до 6 лет,Удаленная работа,Полная занятость,"Наша компания является участником Vendor Program, которая предоставляет возможность сотрудникам работать на проектах клиентов как в России, так и в США (это Microsoft, HPE, T-Mobile, Reddit, Lyft, DoorDash и другие). Это отличная возможность перенять опыт и поработать напрямую с ведущими инженерами компаний с мировым именем. Готовы рассмотреть удаленное сотрудничество. Возможны командировки в США, а в дальнейшем и релокация. Ищем опытного Scala Developer для участия в enterprise проекте с Hewlett Packard Enterprise– группа приложений, построенных на основе Theatre Control Tower. Предполагается разработка data processing pipelines для системы поддержки принятия решений. Чем будете заниматься: * Разработка data processing pipelines для крупной enterprise компании * Работа в распределенной команде Что мы хотели бы видеть: - Spark - Scala (или Java/Python) - Английский Плюсом будет: * Опыт с HDFS, HBase, Hive, Kafka и Data Warehouse(Vertica) * Опыт работы с зарубежными заказчиками * Разговорный английский Мы предлагаем: Действительно интересные проекты, о которых не стыдно написать в резюме Высокую заработную плату Официальное трудоустройство Гибкий график работы ДМС Мы проводим множество мероприятий: хакатоны, конференции, вечеринки, субботники, скучно не будет Оплачиваем и поощряем получение сертификаций Обучаем английскому и оплачиваем фитнес Готовы продвигать вас и помогать в реализации как профессионалу Возможны рабочие командировки в США Возможен переезд в Штаты при желании",Без требований,Без обязанностей,Без условий,Spark|Hive|Kafka|Data Warehouse|Java|SCALA|Python,4
621,621,backend,Новосибирск,95666.66666666669,146288.46153846153,Реклама Онлайн Группа компаний,2019-09-24T05:39:25+0300,От 1 года до 3 лет,Полный день,Полная занятость,"Требования: – высшее образование и стаж работы от 2-х лет – знание PHP 7.2 (OOP), Sql (Mysql, MariaDb), Javascript (jQuery, Angular 2x), HTML/CSS Условия: – работа в офисе на полный рабочий день – Зарплата – по договоренности Опыт работы/навыки: – опыт работы с ZF1, ZF2,Yii2 (MVC, Forms) – опыт работы с системами контроля версий (Git), Composer – опыт работы в среде Linux (рабочее место), продвинутый пользователь Обязанности: – разработка новых и рефакторинг существующих модулей сайта r-o.ru (ZF1, ZF2) и корпоративного интранет портала (ZF1,ZF2 .. + в т.ч. legacy)."," – высшее образование и стаж работы от 2-х лет – знание PHP 7.2 (OOP), Sql (Mysql, MariaDb), Javascript (jQuery, Angular 2x), HTML/CSS ",Без обязанностей," – работа в офисе на полный рабочий день – Зарплата – по договоренности Опыт работы/навыки: – опыт работы с ZF1, ZF2,Yii2 (MVC, Forms) – опыт работы с системами контроля версий (Git), Composer – опыт работы в среде Linux (рабочее место), продвинутый пользователь Обязанности: – разработка новых и рефакторинг существующих модулей сайта r-o.ru (ZF1, ZF2) и корпоративного интранет портала (ZF1,ZF2 .. + в т.ч. legacy).",JavaScript|HTML|CSS|SQL|PHP,24
314,314,backend,Новосибирск,95666.66666666669,146288.46153846153,Бинго-Софт,2019-10-06T16:46:49+0300,От 1 года до 3 лет,Полный день,Полная занятость,"Наша компания занимается созданием и внедрением информационных систем, построенных на базе собственной платформы - конструктора информационных систем Акцент . Мы разрабатываем решения как для органов государственной власти, так и для коммерческих организаций, и являемся одним из ведущих поставщиков информационных систем для контрольных и надзорных органов. В связи с развитием направления приглашаем PHP разработчика в команду новосибирского офиса . От соискателя ожидаем: уверенного знания PHP и SQL знания принципов ООП и шаблонов проектирования понимание механизмов сетевого взаимодействия умения разбираться в чужом коде наличия навыков, достаточных для изучения новых фреймворков и библиотек Дополнительным плюсом будет: навыки разработки на JavaScript знание и умение использовать алгоритмы криптозащиты Со своей стороны кандидату предлагаем: оформление по ТК; график работы 9.00–18.00 с возможностью сдвига‚ пн-пт; конкурентную «белую» зп – фиксированный оклад + премии по итогам сдачи проектов дружескую обстановку и доброжелательное отношение современный офис в Академгородке Если вы еще не обладаете всеми необходимыми навыками, это не является препятствием, чтобы познакомиться с нами и стать полноправным участником нашей команды. Мы готовы рассмотреть кандидатов на начальном этапе карьеры, а опытные сотрудники всегда придут на помощь новичку. Более подробно о нас и чем мы занимаемся можно почитать на сайте.",Без требований,Без обязанностей,Без условий,Ext JS|JavaScript|MySQL|PHP5|PHP|Redis|PostgreSQL|SOAP,12
25,25,backend,Новосибирск,95666.66666666669,146288.46153846153,ТЭК-Торг,2019-10-15T10:20:10+0300,От 1 года до 3 лет,Удаленная работа,Полная занятость,"Обязанности: устранение инцидентов и причин их возникновения в Web-приложении; внесение исправления в БД или в программный код для решения инцидента; решение системных проблем, порождающих инциденты; реализация дополнительного функционала, рефакторинг; выполнение доработок системы, реализация которых снижает число обращений и число инцидентов; выполнение запросов, требующих внесение изменений в БД внештатными средствами; развитие автоматизированного тестирования Требования: аналитический склад ума; опыт работы в области разработки ПО; владение PHP 7, SQL, JavaScript; базовое знание OC Linux желательно; опыт работы с системой контроля версий исходных текстов Условия: - работа удалённая; - начало работы с 08.00 утра по Московскому времени; - работа в крупнейшей компании в отрасли Предусмотрено тестовое задание"," аналитический склад ума; опыт работы в области разработки ПО; владение PHP 7, SQL, JavaScript; базовое знание OC Linux желательно; опыт работы с системой контроля версий исходных текстов "," устранение инцидентов и причин их возникновения в Web-приложении; внесение исправления в БД или в программный код для решения инцидента; решение системных проблем, порождающих инциденты; реализация дополнительного функционала, рефакторинг; выполнение доработок системы, реализация которых снижает число обращений и число инцидентов; выполнение запросов, требующих внесение изменений в БД внештатными средствами; развитие автоматизированного тестирования ", - работа удалённая; - начало работы с 08.00 утра по Московскому времени; - работа в крупнейшей компании в отрасли Предусмотрено тестовое задание,Без ключевых навыков,3
