,Unnamed: 0,name,area,min_salary,max_salary,employer,published_at,experience,schedule,employment,description,requirements,duties,conditions,key_skills,days
961,961,backend,Новосибирск,80000.0,200000.0,Геймгард,2019-10-12T19:54:43+0300,От 1 года до 3 лет,Полный день,Полная занятость,"Legionfarm - это крупнейшая платформа для найма профессионалов в виртуальных мирах. Тысячи пользователей из 48 стран ежедневно пользуются нашим сервисом для обучения и совместной игры с экспертами в онлайн играх на ПК и консолях, а также в VR. У нас сильная команда, состоящая из 70+ человек. И сейчас мы объявляем конкурс на позицию PHP разработчика. Чем предстоит заниматься? Будем ходить в API игр, анализировать игровые профили наших клиентов, строить рекомендательные системы. Автоматическая отправка сообщений через API в мессенджеры: discord, telegram, fb, будем сводить общение наших клиентов через мессенджеры в единую систему intercom.com. Автоматизация процессов в нашей команде (полуавтоматизированные инструменты для работы с сайтом). Инфраструктурные задачи (переделать текущую структуру хранения данных, добавлять новые структуры, настраивать взаимодействие между моделями в ORM). Что ты должен знать/уметь? Знание PHP на хорошем уровне. Знание Linux. Понимание работы протоколов передачи данных, ООП. Умение работать в системах контроля версий. Знание mysql, redis. Опыт работы с различными API. Что будет твоим преимуществом перед другими кандидатами? Сильный математический бэкграунд. Базовое знание html, CSS, JavaScript. Опыт работы с фронтенд фреймворками. Что мы предлагаем? В зависимости от твоих текущих навыков по результатам собеседования ты можешь рассчитывать на зарплату от 80 000 до 200 000. Возможность работать как из офиса, так и удаленно. Работу в уютном и современном лофт-офисе недалеко от центра - м. Парк Культуры. Вся инфраструктура - рукой подать. Корпоративный английский язык, тренинги, мероприятия с коллегами и прокачку своих скиллов. Мы следим за модными тенденциями, поэтому чай, кофе, сахар и даже сахарозаменитель - ждут тебя на кухне за барной стойкой Почему мы? У нас крутая команда. Мы отлично работаем, но и толк в отдыхе знаем. Твои коллеги будут твоими друзьями! Мы создаём профессию будущего - геймер. Мы хотим, чтобы сотни миллионов игроков по всему миру получили возможность официально зарабатывать деньги в играх.",Без требований,Без обязанностей,Без условий,PHP|Linux|Протоколирование|Базы данных|ABC-анализ|ABC analysis|MS SQL|Redis|API|HTML|CSS|JavaScript|MySQL|frontend|SQL|jQuery|Facebook API|Автоматизация процессов|Автоматизация продаж|Аналитические исследования|Маркетинговые исследования,5
304,304,backend,Новосибирск,80000.0,150000.0,Kama Flow,2019-10-13T12:36:50+0300,От 1 года до 3 лет,Полный день,Полная занятость,"Международная компания-разработчик решений в сфере финансовых технологий и сервисов ищет специалистов. Обязанности: разработка и поддержка электронных кошельков, мобильных банков и других приложений, требующих соответствующий уровень надежности и безопасности. Чем придется заниматься? Участие в разработке веб сервисов, API и микросервисов Разработка unit &amp; acceptance тестов Проектирование баз данных Оптимизация проектов под меняющиеся условия и нагрузки Поиск простых решений для сложных задач Требования : Законченное высшее образование по IT специальности Знание и понимание ООП Знание и понимание паттернов и принципов проектирования Опыт разработки на PHP от 2-ух лет Опыт работы с одним или несколькими из перечисленных фреймвороков: Yii2, Symfony 3.x, Symfony 4.x, Laravel Уверенное владение SQL и MySQL. Триггеры, хранимые процедуры, оптимизация запросов и т.д. Опыт работы с одной или несколькими из перечисленных NoSQL баз данных: MongoDb, Redis, Tarantool Опыт работы со связкой nginx + php-fpm Умение писать unit, acceptance и functional тесты Вы уверенный пользователь Git, Docker, Composer, Linux Знание английского на уровне чтения технической документации Будет большим плюсом: Опыт работы с Go или C++ Опыт работы с AngularJs, TypeScript, VueJs Знание и понимание структур и алгоритмов Наличие открытого репозитория с примерами вашего кода, на github, или любом другом ресурсе. Опыт профилирования нагрузок и нагрузочного тестирования Плотное знакомство с OWASP документацией Опыт командной разработки. Agile, SCRUM, СI Условия: Стабильная заработная плата, полный день, пятидневная рабочая неделя Scrum, Agile и CI Комфортный офис со всеми удобствами в центре г. Новосибирска Работа в международной команде",Без требований,Без обязанностей," Стабильная заработная плата, полный день, пятидневная рабочая неделя Scrum, Agile и CI Комфортный офис со всеми удобствами в центре г. Новосибирска Работа в международной команде",PHP|ООП|Yii2|Symfony 3.x|Symfony 4.x|Laravel|NoSQL|MySQL|Redis|Tarantool|MongoDB|Nginx,5
944,944,backend,Новосибирск,80000.0,150000.0,iSpring,2019-10-08T14:41:59+0300,Нет опыта,Полный день,Полная занятость,"iSpring — крупнейший российский разработчик решений для корпоративного обучения, работающий кроме России еще в 154 странах мира. Входит в Топ 3 рынка EdTech (по данным РБК). Среди клиентов iSpring крупные мировые и российские компании: «Яндекс», «Сбербанк», «Альфа-Капитал», «Балтика», Unilever, Honeywell, Bayer, Lamoda. С 2010 года iSpring получает золотые награды в престижном отраслевом конкурсе Brandon Hall Group и занимает высокие позиции в рейтингах G2 Crowd, GetApp, Software Advice, Capterra. Мы ищем крутых разработчиков, готовых вместе с нами создавать лучшие в мире продукты для онлайн обучения. Что нужно делать: Наш ключевой продукт - платформа для дистанционного обучения, ядро которой написано на PHP 7+Symfony 4. Сейчас мы активно переходим на микросервисы на Go. Система CI/CD разворачивает платформу в Docker-контейнерах под управлением Kubernetes, что позволяет выкатывать релизы по нескольку раз в день. Качество кода стоит на первом месте. Поэтому в разработке мы применяем подходы Clean Architecture и Domain-Driven Design. Ответственные участки кода покрываем тестами и проводим регулярное Code review. Разработка ведётся кросс-функциональными командами по Scrum. Требования: Знание PHP или Golang ; Опыт работы с MySQL ; Знание и понимание ООП , принципов SOLID и основных паттернов проектирования; Желание развивать свои профессиональные навыки и личностные качества. Работа Вам подойдет, если Вы: Амбициозны и хотите работать с командой высокого уровня, создавать мировой продукт и устанавливать новые рекорды вместе с нами; Трудолюбивы и настойчивы, доходите да самой сути и привыкли достигать результата; Ответственны и осознаете важность своего вклада в общее дело, уважаете командный труд; Хотите жить в чистом экологичном месте вдалеке от шума и суеты; Имеете опыт работы с Symfony; Понимаете принципы чистой архитектуры и DDD; Обладаете навыками написания юнит тестов, умеете разрабатывать код по TDD/BDD; Имеете опыт разработки высоконагруженных отказоустойчивых приложений и опыт; работы с gRPC/REST, Protobuf, Docker + Kubernetes, ОС Linux; Имеете профильное образование. Что мы предлагаем: Официальное трудоустройство; Конкурентоспособную, полностью белую зарплату; Возможность обучения и преподавания в “Институте программных систем”; Оплату трансфера до Йошкар-Олы вам и членам вашей семьи, а также аренду квартиры с комфортными условиями в центре города (на 6 мес.); Обучение, наставничество, поездки на курсы и зарубежные конференции, бесплатные корпоративные тренинги; Современный офис с кухней, столовой, спортзалом и библиотекой. Работа в г. Йошкар-Ола. Откликайтесь, будем знакомиться !",Без требований,Без обязанностей,Без условий,MySQL|ООП|Linux|Golang,10
874,874,backend,Новосибирск,80000.0,120000.0,Bazon,2019-10-14T11:57:40+0300,От 3 до 6 лет,Полный день,Полная занятость,"Ты хороший программист и хочешь работать в активно растущей компании? Хочешь быть не просто рядовым сотрудником, выполняющим скучные технические задачки, а полноценным активным членом команды, со своими идеями, которые будут услышаны, и со своим мнением, которое будут уважать? Тогда давай знакомиться! Мы Bazon – развивающаяся быстрыми темпами, специализированная учетная система для продавцов б/у автозапчастей, и мы ищем именно тебя! Мы не зацикливаемся на старых технологиях, постоянно совершенствуемся и используем новые, современные способы для решения поставленных задач. Наши клиенты – это компании, продающие контрактные и б/у автозапчасти. Сейчас мы обслуживаем более 400 компаний от Москвы до Владивостока, и являемся лидером в своей сфере. Тебя ждут интересные задачи, огромное поле для идей и новшеств, дружный коллектив, который не только поддержит, но и направит, если вдруг сбился с курса, а ещё просторный офис с видом на реку, и другие плюшки, которые мы обсудим с тобой при личной встрече! Что мы уже делаем: Развиваем и сопровождаем крупный нагруженный проект с бизнес-логикой на PHP, MySQL и NodeJS, развитым фронтендом на JS, внешними API (сервисы и мобильные приложения). Мы активно используем CI/CD, Docker. И все это работает в Kubernetes. Что ты точно будешь делать: Решать задачи самого разного плана: начиная от исправления небольшого бага до разработки и внедрения сложных бизнес-процессов компании; Рефакторить, оптимизировать и искать узкие места в уже существующем коде; Предлагать и обсуждать идеи, внедрять свои собственные решения. Чего тебе делать не придется: Скучать и раскладывать Косынку от нечего делать :) Сидеть на долгих и нудных совещаниях – все решения мы принимаем быстро. Требования: Опыт разработки проектов на PHP + MySQL не менее 3 лет; Знание любого современного фреймворка (Yii2, Laravel, Symfony); Понимание принципов построения HighLoad-сервисов с высоким SLA; Хорошее знание любой СУБД (MySQL, PostgreSQL и т.д.); Понимание и опыт применения паттернов проектирования (понимание принципов SOLID и MVC); Знание UNIX-подобных ОС (уровень продвинутого пользователя); Опыт командной разработки с использованием Git или Mercurial; Опыт разработки коммерческих продуктов; Ориентация на результат, а не процесс. Условия: Официальное трудоустройство; Работа в небольшой команде; Просторный офис с видом на реку; Современное рабочее место; Гибкий график работы; Только полная занятость и работа в офисе; Перспективы для профессионального и карьерного роста. Уровень заработной платы по результатам собеседования."," Опыт разработки проектов на PHP + MySQL не менее 3 лет; Знание любого современного фреймворка (Yii2, Laravel, Symfony); Понимание принципов построения HighLoad-сервисов с высоким SLA; Хорошее знание любой СУБД (MySQL, PostgreSQL и т.д.); Понимание и опыт применения паттернов проектирования (понимание принципов SOLID и MVC); Знание UNIX-подобных ОС (уровень продвинутого пользователя); Опыт командной разработки с использованием Git или Mercurial; Опыт разработки коммерческих продуктов; Ориентация на результат, а не процесс. ",Без обязанностей, Официальное трудоустройство; Работа в небольшой команде; Просторный офис с видом на реку; Современное рабочее место; Гибкий график работы; Только полная занятость и работа в офисе; Перспективы для профессионального и карьерного роста. Уровень заработной платы по результатам собеседования.,PHP|MySQL|JavaScript|Ajax|HTML|jQuery|CSS,4
42,42,backend,Новосибирск,80000.0,146288.46153846153,ВилайнТв,2019-10-09T15:01:00+0300,От 3 до 6 лет,Удаленная работа,Полная занятость,"В нашу компанию требуется FullStack разработчик для создания и развития нового проекта Видео тематики. Технологии PHP, NodeJS, React. Условия Работа в офисе или возможность работать удаленно на полный рабочий день; Трудоустройство в соответствии с ТК РФ; График работы с Пн по Пт; Просторный офис в центре Новосибирска либо удаленно Начало рабочего дня ненормировано; Требования к кандидату Вы программируете на JS хотя бы 1 год. Вы программируете на PHP хотя бы 2 года. Решение любой front-задачи начинаете с составления модели данных. Умение работать со сложными SQL-запросами. Самостоятельность и умение планировать свою работу. Опыт создания сайтов «под ключ» Навыки работы с системами контроля версий Обязательно понимание валидной, кросс-браузерной и адаптивной верстки. Будет плюсом, если работали с большими проектами и нагрузками. Ждем в нашу команду инициативного, ответственного сотрудника.",Без требований,Без обязанностей,Без условий,PHP|Node.js|MySQL|Git|Linux|ООП|Nginx,9
