,Unnamed: 0,name,area,min_salary,max_salary,employer,published_at,experience,schedule,employment,description,requirements,duties,conditions,key_skills,days
799,799,backend,Новосибирск,95666.66666666669,146288.46153846153,МТС,2019-10-10T11:22:39+0300,От 1 года до 3 лет,Полный день,Полная занятость,"Более 25 лет МТС развивает сотрудников в собственном корпоративном университете. Мы создаем инновации в обучении постоянно внедряем продвинутые образовательные программы. Поэтому в 2017 году МТС Университет вышел на рынок профессионального обучения и сегодня успешно развивает компетенции будущего у наших клиентов - https://mtscu.ru/ Чем предстоит заниматься: разработкой витрин продаж (лэндинги курсов, механизм приема платежей, интеграция с сервисами почтовых рассылок). Система построена на CMS Wordpress. разработкой образовательной части проекта - построена на CMS Moodle (личный кабинет ученика). bitrix24 CRM - необходимо настраивать различные API интеграции. Помимо этого, в проекте стоят задачи: построения собственного видеохостинга на базе S3 файлового хранилища; сбор метрик и последующая их обработка, интеграция процессов с CRM; развитие системы геймификации образовательного процесса у студентов корпоративного университета. От Вас мы ожидаем: уверенное владение PHP. Опыт написания плагинов для wordpress или moodle будут плюсом; JS уровня фреймворка Jquery, другие фреймворки будут плюсом; знание MySQL, составление связанных запросов, оптимизация; понимание и опыт работы с REST API на уровне реализации. Написание сервера, написание клиента; навыки работы в среде unix/linux – умение настроить рабочую среду, работа с файлами, разворачивание проекта в среде; навыки работы c Git; работа с тестами, покрытие ими проекта. Мы предлагаем: стабильную &quot;белую&quot; заработную плату и премии (20% от суммарного годового дохода). скучно не будет - у нас дружелюбная команда и интересный продукт :) саморазвитие - сотрудники имею доступ ко всем образовательным программам повышения квалификации университета бесплатно заботу о здоровье своих сотрудников - ДМС со стоматологией. спорт - корпоративные соревнования по футболу, баскетболу и волейболу, различные спорт-программы и компенсацию вашего фитнес-абонемента. хороший отдых - отпуск 28 календарных дней + 3 календарных дня дополнительно ежегодно. Наши сотрудники на проекте «Корпоративный университет МТС» имеют доступ: ко всем материалам университета; к образовательным программам повышения квалификации.",Без требований,Без обязанностей,Без условий,Без ключевых навыков,8
19,19,backend,Новосибирск,95666.66666666669,146288.46153846153,TeamDirector,2019-09-27T16:49:34+0300,От 3 до 6 лет,Удаленная работа,Полная занятость,"TeamDirector is an American company that develops next-generation computer-assisted dispatch (CAD) applications for all industries. Our team of engineers use the latest in cutting-edge technology to push the envelope on getting the right person to the right place in as little time possible. This job is Full-time, REMOTE . Mission: - Take ownership of large-scale project and deliver solutions - Writing clean, well designed, testable, efficient code - Investigate current solutions and new solutions Requirements: - 4+ years experience with JavaScript (ES6, Design Patterns, OOP) - 3+ years hands-on experience in Node.js - Strong proficiency with JavaScript - Knowledge of Node.js and main frameworks for microservices - Knowledge of main mechanisms for authentication/authorization in distributed architectures - Integration of multiple data sources and databases into one system - Understanding fundamental design principles behind scalable applications - Knowledge of relational databases and document-oriented databases - Implementing unit tests/integration tests - Proficient knowledge of git - Technical English level: Intermediate and upper. Non verbal skills required - Good communication skills Will be a plus: - Knowledge of containers and Docker - Understanding AWS services",Без требований,Без обязанностей,Без условий,JavaScript|Английский язык|Data Analysis|Time management|Business English,21
905,905,backend,Новосибирск,95666.66666666669,146288.46153846153,Drom,2019-09-27T03:55:18+0300,От 1 года до 3 лет,Полный день,Полная занятость,"Drom.ru — это автомобильный интернет-портал федерального уровня. Ежедневно сайт посещает более 3 миллионов пользователей. Нам 20 лет, и мы продолжаем активно расти. В связи с расширением штата ищем backend-разработчика. Чем будем заниматься: - разрабатывать новые и поддерживать существующие сервисы; - оптимизировать код под постоянно растущие нагрузки; - участвовать в кодревью команды; - обсуждать новые фичи и требования, участвовать в процессе их реализации и внедрения; - взаимодействовать с нашими командами продуктовой разработки (Владивосток, Томск, Новосибирск); - осваивать новые технологи, решать интересные и сложные задачи в ведущей IT-компании Дальнего Востока по разработке highload web-проектов. Что нужно знать и уметь: - PHP; - ООП и SOLID-принципы; - оценивать сроки на разработку; - работать в команде; - проектировать реляционные базы данных. Кто мы? Мы работаем над интересными и уникальными проектами. Используем Scrum и Kanban. Постоянно учимся новому, обмениваемся опытом, помогаем друг другу в реализации задач. Мы работаем в БЦ Новая высота (10 минут до метро). У нас есть уютная офисная кухня, на которой всегда есть кофе и полный холодильник; турники, спортивная стенка, кресло-мешки и многое другое. Мы носим кроксы, шорты и прочий нерегламентированный &quot;дресс-код&quot;. Мы ездим на конференции, смотрим в офисе вебинары на большом мониторе, покупаем всю нужную литературу. Тебя ждет: - полностью официальная зарплата, оформление по ТК РФ с первого дня работы, гибкий график и плавающее начало дня (с 8 до 10 утра); - уровень дохода, достойный твоей квалификации, определится по результатам собеседования и будет периодически расти. Напиши нам о себе. Присылай резюме, даже если ты не уверен в своих силах, мы готовы рассмотреть вариант обучения разработчиков без опыта, но с сильной теоретической базой и желанием работать в данном направлении. Нет резюме? Не страшно! Можно просто откликнуться на нашу вакансию, направить ссылки на профили в GitHub, StackOverflow, Хабр. Будем рады пообщаться!",Без требований,Без обязанностей,Без условий,PHP|ООП|MS SQL|Веб-программирование,21
912,912,backend,Новосибирск,95666.66666666669,146288.46153846153,Wrike,2019-10-15T16:04:10+0300,От 3 до 6 лет,Гибкий график,Полная занятость,"Wrike — это SaaS для управления проектами и совместной работы, входящий в топ-3 подобных решений на мировом рынке. Это комплексный web-клиент с большой кодовой базой, который делают на сегодня 28 команд разработки, благодаря настроенным скрам-процессам, CI/CD и продуктовым релизам 1-3 раза в день. У нас более 17 тыс компаний-клиентов из 120 стран: от маленьких маркетинговых студий до компаний Google, AirBnb, Western Union, Kaspersky Lab, Fitbit, Hootsuite. Развитие такого масштабного продукта ставит перед бэкенд-разработчиками уникальные инженерные задачи, требует архитектурного мышления и превращает их в настоящих highload экспертов. В технических командах бэкенд-разработчики: Решают интеграционные задачи по масштабированию приложения Реализуют максимально эффективное взаимодействие с распределенными дата-центрами Занимаются реализацией поддержки гибридной инфраструктуры Решаем задачи по масштабированию и улучшению скорости загрузки интерфейса Работают над задачами по сокращению общего цикла разработки крупных фичей, от идеи до публичного релиза Постоянно автоматизируют рутину, пишут или адаптируют инструменты, позволяющие нам работать быстро и слаженно. ​​​​Стек технологий: Java 8, Spring, PostgreSQL. Инженерное сообщество Wrike — это клуб умных и отзывчивых людей, которым по-настоящему нравится работать вместе. С одной стороны, нам важно не потерять эту атмосферу, с другой — развивать ее, приглашая в этот клуб профессионалов с высоким культурным и интеллектуальным потенциалом. Условия: Высокая и полностью белая заработная плата; Гибкий график работы; Просторный офис в бизнес-центре класса «А» с массажным креслом, душем, кикером и Xbox; Бесплатные обеды в ресторане бизнес-центра; ДМС со стоматологией; ДМС для детей и родственников; Частичная компенсация расходов на парковку; Занятия английским языком в офисе (несколько групп разного уровня, в т. ч. с носителем языка); Спортивные команды по футболу, баскетболу и волейболу; Помощь в переезде кандидатам из других городов; Незабываемые корпоративные праздники и вечеринки. Вакансия открыта в Санкт-Петербурге . Мы понимаем, что принимать решение о переезде может быть трудно, поэтому помогаем с релокацией (оплачиваем билеты, предоставляем возможность размещения в корпоративной квартире на период поиска постоянного жилья и выплачиваем подъемный бонус).",Без требований,Без обязанностей," Высокая и полностью белая заработная плата; Гибкий график работы; Просторный офис в бизнес-центре класса «А» с массажным креслом, душем, кикером и Xbox; Бесплатные обеды в ресторане бизнес-центра; ДМС со стоматологией; ДМС для детей и родственников; Частичная компенсация расходов на парковку; Занятия английским языком в офисе (несколько групп разного уровня, в т. ч. с носителем языка); Спортивные команды по футболу, баскетболу и волейболу; Помощь в переезде кандидатам из других городов; Незабываемые корпоративные праздники и вечеринки. Вакансия открыта в Санкт-Петербурге . Мы понимаем, что принимать решение о переезде может быть трудно, поэтому помогаем с релокацией (оплачиваем билеты, предоставляем возможность размещения в корпоративной квартире на период поиска постоянного жилья и выплачиваем подъемный бонус).",Java|Spring Framework|PostgreSQL|Apache Tomcat|Git|MyBatis ORM,3
162,162,backend,Новосибирск,95666.66666666669,146288.46153846153,МобайлДевелопмент (IceRock Development),2019-10-08T07:24:01+0300,От 1 года до 3 лет,Удаленная работа,Полная занятость,"IceRock Development разрабатывает мобильные и Web приложения. Компания обладает обширной географией проектов (Россия, USA, Европа и т.д.), а наш подход к работе дает большой простор для осуществления сложных архитектурных решений. На текущий момент мы в поиске Backend developer-a к нам в компанию для работы удаленно. Чем ты будешь заниматься в нашей команде: Разрабатывать новые, а также поддерживать существующие web-приложения и интернет-проекты для Российских и международных заказчиков; Что мы хотим видеть у тебя: Отличное знание PHP; Знание и умение применять ООП, принципы проектирования; Знание SQL и опыт работы с MySQL, Postgres; Опыт написания, оптимизации и тестирования кода; Опыт работы с системами контроля версий (Git); Умение писать понятный, документированный код; Умение придерживаться стиля в коде. Будет плюсом: Опыт работы с HTML5/JS; Опыт разработки не только на PHP-платформе (Python, Node.js etc.); Опыт работы с REST API; Опыт работы с Java/Kotlin; Знакомство с современными NoSQL решениями (Redis, MongoDB, Memcached, etc); Опыт работы с Docker, понимание принципов контейнеризации; Опыт работы согласно концепции СI/CD. Возможности вместе с нами: Работа на интересных проектах с профессиональной командой; Полная занятость по индивидуальному графику из любого города; Получать достойную заработную плату. Если вы ищете удаленную работу и готовы пройти техническое интервью - ждем ваш отклик.",Без требований,Без обязанностей,Без условий,PHP|yii2,10
886,886,backend,Новосибирск,95666.66666666669,146288.46153846153,Космос-Веб,2019-10-13T08:21:11+0300,От 3 до 6 лет,Полный день,Полная занятость,"Космос-Веб — интерактивное агентство полного цикла с большим опытом сложных и ответственных проектов. Создаём корпоративные сайты и интернет-магазины, привлекаем посетителей из поисковых систем и соцсетей, внедряем сквозную аналитику и развиваем проекты. Ищем в команду талантливого разработчика, способного существенно усилить отдел разработки. Основная задача — разработка программной части веб-сайтов (в основном на 1С-Битрикс). Требования : профессиональное знание PHP и МySQL; твердые знания Git, JavaScript и jQuery; приветствуется опыт работы с Zend Framework и Laravel; базовые навыки работы в консоли Unix; жажда новых знаний и постоянного профессионального роста. Условия : уровень з/п по результатам собеседования (оклад + премии); работа в офисе, без прямого общения с клиентами; испытательный срок до 2 месяцев; условия для карьерного роста и время на саморазвитие; демократичные взаимоотношения, оперативное принятие любых решений; классный молодой, дружный, интересный и весёлый коллектив; стабильность (более 14 лет на рынке); удобное расположение офиса; официальное трудоустройство по ТК РФ; офис на 12-ом этаже с шикарным видом на город.",Без требований,Без обязанностей,Без условий,1С-Битрикс|jQuery|MySQL|PHP5|ООП|Git,5
327,327,backend,Новосибирск,95666.66666666669,180000.0,Кадровое агентство Алексея Сухорукова,2019-09-18T05:38:42+0300,От 1 года до 3 лет,Гибкий график,Полная занятость,"Компания, разрабатывающая собственную маркетинговую платформу, ищет в свою команду ведущего PHP-разработчика. В основе платформы - анализ больших данных о продажах и поведении клиентов в интернете. Ежедневно платформа обрабатывает данные о покупательском поведении более 50 млн человек. Клиентами компании являются федеральные сети розничной торговли. Задачи: Разработка компонентов платформы; Участие в разработке архитектуры; Участие design и code reviews; Участие в исследованиях, работа над прототипами; Участие в оптимизации процессов департамента производства. От вас требуется: Опыт разработки на PHP не менее 2 лет; Опыт участия в проектах разработки нагруженных и отказоустойчивых систем; Опыт практического использования в проектах, серверов очередей (RabbitMQ/Beanstalkd или им подобных), Redis (или аналогов), написания демонов; Опыт работы с Laravel, либо Symfony; Знание шаблонов проектирования и опыт их практического применения; Знание английского на уровне чтения и понимания документации. Компания предлагает: Официальное трудоустройство Заработную плату по результатам собеседования Рабочее место в Технопарке Академгородка Возможность работать по гибкому графику Ждем Ваш отклик и свяжемся с Вами в ближайшее время! Почему стоит обратиться к нам? ✓Прежде всего наши услуги бесплатны для кандидатов! ✓Мы более 10 лет занимаемся подбором IT-специалистов для крупнейших российских и международных компаний. А наш опыт по релокации новоиспеченных сотрудников за границу позволяет решать вопросы любого уровня сложности. ✓Мы сотрудничаем с десятками компаний по всему миру. Мы знаем все о них. Мы знаем все о странах, в которые они ищут своих будущих сотрудников. Мы знаем все тонкости процессов рекрутинга в каждой из них. ✓Мы умеем находить для них самых подходящих и по духу, и по техническим навыкам кандидатов. ✓ Мы можем предложить вам выбор вакансий и работодателей в разных странах. ✓И сможем помочь успешно трудоустроиться в той из них, которая больше всего нравится именно вам и на которую вы лучше всего подходите. ✓Нет, мы не занимаемся тем, что даем шпаргалки и решаем за кандидатов тестовые задания. Но скажем, как лучше подготовиться к прохождению собеседований и решению технических задач.",Без требований,Без обязанностей,Без условий,PHP|MySQL|NoSQL|Redis,30
