,Unnamed: 0,name,area,min_salary,max_salary,employer,published_at,experience,schedule,employment,description,requirements,duties,conditions,key_skills
954,954,системный аналитик,Екатеринбург,40000.0,70000.0,ДартИТ,2019-09-26T09:04:05+0300,От 1 года до 3 лет,Полный день,Полная занятость,"Нам требуется системный аналитик на проект разработки CRM-системы для корпоративных клиентов – абонентов оператора фиксированной и мобильной связи. Мы используем как основу для разработки платформу собственного производства, построенную с применением свободного программного обеспечения Apache Camel, Activiti. Что нужно будет делать: проанализировать требования к информационной системе, понять и оценить задачу, предложить решения и варианты реализации, согласовать с командой и заказчиком выбранное решение; спроектировать объектную модель данных, подготовить спецификацию API для интеграционного взаимодействия со смежными системами; создать типы данных, пользовательские интерфейсы, настроить бизнес-процессы на платформе с помощью конструктора; написать постановку для разработчиков ПО, если задача требует их привлечения; провести тестирование разработанной функциональности; сдать работающую функциональность заказчику, задокументировать реализованное. Мы ждем от кандидатов: высшее техническое образование (прикладная математика, информационные технологии или др.); умение работать с требованиями, их выявлением и документированием; понимание принципов и жизненного цикла разработки корпоративных информационных систем, знание основ реляционных баз данных; умение работать с заказчиком и умение работать в команде; опыт участия в проектах разработки и внедрения ПО, желание развиваться в направлении системного анализа, участвовать в крупных проектах интеграции и разработки; приветствуются навыки программирования на JavaScript, Groovy; приветствуются навыки работы с BPM-системами, знания методологии BPM. Мы предлагаем: заработная плата, соответствующая квалификации; участие в масштабном проекте автоматизации в области телекоммуникаций, погружение в новые технологии, получение новых знаний и опыта; гибкий график работы; официальное трудоустройство, &quot;белая&quot; заработная плата, социальный пакет; офис в центре города.",,,,
887,887,системный аналитик,Екатеринбург,50000.0,,"ХОСТ, Группа компаний",2019-10-16T09:07:12+0300,От 1 года до 3 лет,Полный день,Полная занятость,"ХОСТ - это компания с 26-ти летней историей, обладает репутацией надежного партнера в бизнесе и хорошего работодателя на рынке труда. Мы гордимся тем, что реализуем социально значимые проекты. Одним из ключевых направлений бизнеса Компании является разработка информационно-аналитических систем «МедВедь». Это комплекс информационных систем, которые автоматизируют процессы в области Здравоохранения и обеспечивают возможность пользоваться населению электронными услугами. Например, мы создаем системы, которые: Помогают формировать, выгружать и отправлять отчеты больницам и поликлиникам на уровень Минздрава; Помогают пациентам записываться на прием к врачам; Помогают вести учет лекарственных средств; Интегрируют между собой региональные медицинские системы; И другие проекты. Мы быстро развиваемся, количество проектов растет. Нашей команде нужно усиления, поэтому мы в поисках системного аналитика ! Задачи, которые нужно решать: Анализ бизнес-процессов и регламентирующих документов заказчика; Написание ТЗ, постановки задач для программистов; Проектирование баз данных; Участие в тестировании ИТ-решений; Внедрение ИТ-решений у заказчика; Проведение презентаций у заказчика, согласование состава работ с заказчиком. Необходимые компетенции: Знание принципов построения баз данных; Базовые знания языка SQL; Понимание принципов построения веб-приложений; Знание XML-технологий и опыт работы с ними: XML, XSD, XSLT, WSDL, SOAP; Опытный пользователь ПК (MS Office, MS Visio, MS Excel). Мы предлагаем: Нетривиальные проекты и задачи, которые поддерживают мозг в тонусе:) Поддержка со стороны руководства внешнего и внутреннего обучения; Заботу компании о своих сотрудниках (ДМС, софинансирование спорта и изучения иностранных языков, дополнительно 7 дней социального отпуска); Достойный доход, который обсуждаем индивидуально; Насыщенную корпоративную жизнь: отмечаем Новый год, играем в интеллектуальные игры, ходим в походы. За 2018-2019 годы покорили Конжак, Юрму, Зюраткуль, Иремель.",,,,
158,158,системный аналитик,Новосибирск,50000.0,,НПФ Гранч,2019-10-17T09:22:45+0300,От 1 года до 3 лет,Полный день,Полная занятость,"Мы 25 лет на рынке. Наши инновационные продукты (электронные приборы и ПО) позволяют не только уверенно занимать лидирующие позиции на рынке, но и задавать вектор направления развития отрасли. Мы формируем отдельную команду аналитиков с тем, чтобы усовершенствовать выпускаемый нами продукт &quot;Умная шахта&quot; и не только! Приглашаем к сотрудничеству профессиональных аналитиков, желающих получить опыт работы в большом высоконагруженном проекте c возможностью роста до руководителя группы. Обязанности: анализ и оптимизация процессов внутри разрабатываемых и уже готовых продуктов; проектирование логической модели системы, интерфейса ПО; постановка задач для разработчиков проекта, выработка рекомендаций, составление технических заданий на разработку/доработку ПО; взаимодействие с заказчиком и техническими экспертами, сбор и анализ требований; предварительное тестирование функционала; подготовка программы функционального тестирования, участие в приёмо-сдаточных испытаниях. Требования: высшее техническое образование; опыт работы в области бизнес/системного анализа желательно в IT-сфере; понимание основ проектирования, разработки, документирования программного обеспечения; аналитический склад ума, инициативность; умение работать с готовыми техническими заданиями и готовить технические задания на доработку системы; умение формализовывать и структурировать информацию; знание методов системного анализа; знание MS Office на уровне грамотного пользователя. Вашим преимуществом будут: профильное образование по направлению Системный анализ; опыт работы с SQL, Excel; опыт работы с пакетами математического моделирования; понимание или хотя бы представление о работе стека протоколов TCP/IP и принципах работы сетевого оборудования; понимание принципов передачи данных по каналу связи, способность анализировать функционирование сетей и аппаратных интерфейсов. Мы предлагаем: работу в компании, продукты которой не имеют аналогов на рынке; участие в формировании стратегии по развитию продуктов; постоянное развитие, участие в интересных проектах и расширение профессиональной экспертизы; участие в профильных семинарах, конференциях, выставках; отлично оборудованный комфортный офис в 15 мин от ст. метро &quot;Березовая роща&quot;; дружный коллектив, корпоративные праздники и мероприятия; бесплатный спортзал с душем, оборудованная кухня и вкусный кофе в офисе, несколько хороших столовых и кафе рядом с офисом. Условия: график работы пн-пт с 8:00 до 17:00, сб, вс - выходной (в индивидуальном порядке возможна корректировка); оформление по ТК РФ; размер заработной платы готовы обсуждать с кандидатами в зависимости от их уровня знаний и опыта. Мы ищем в команду человека, который: постоянно учиться и развивается; всегда нацелен на результат; умеет работать в команде; не боится сложных задач; обладает самостоятельностью; любит свою работу. Решаем интересные разноплановые задачи. Ключевые навыки: MS Visio UML Data Analysis SQL Анализ данных"," высшее техническое образование; опыт работы в области бизнес/системного анализа желательно в IT-сфере; понимание основ проектирования, разработки, документирования программного обеспечения; аналитический склад ума, инициативность; умение работать с готовыми техническими заданиями и готовить технические задания на доработку системы; умение формализовывать и структурировать информацию; знание методов системного анализа; знание MS Office на уровне грамотного пользователя. Вашим преимуществом будут: профильное образование по направлению Системный анализ; опыт работы с SQL, Excel; опыт работы с пакетами математического моделирования; понимание или хотя бы представление о работе стека протоколов TCP/IP и принципах работы сетевого оборудования; понимание принципов передачи данных по каналу связи, способность анализировать функционирование сетей и аппаратных интерфейсов. Мы предлагаем: работу в компании, продукты которой не имеют аналогов на рынке; участие в формировании стратегии по развитию продуктов; постоянное развитие, участие в интересных проектах и расширение профессиональной экспертизы; участие в профильных семинарах, конференциях, выставках; отлично оборудованный комфортный офис в 15 мин от ст. метро &quot;Березовая роща&quot;; дружный коллектив, корпоративные праздники и мероприятия; бесплатный спортзал с душем, оборудованная кухня и вкусный кофе в офисе, несколько хороших столовых и кафе рядом с офисом. "," анализ и оптимизация процессов внутри разрабатываемых и уже готовых продуктов; проектирование логической модели системы, интерфейса ПО; постановка задач для разработчиков проекта, выработка рекомендаций, составление технических заданий на разработку/доработку ПО; взаимодействие с заказчиком и техническими экспертами, сбор и анализ требований; предварительное тестирование функционала; подготовка программы функционального тестирования, участие в приёмо-сдаточных испытаниях. "," график работы пн-пт с 8:00 до 17:00, сб, вс - выходной (в индивидуальном порядке возможна корректировка); оформление по ТК РФ; размер заработной платы готовы обсуждать с кандидатами в зависимости от их уровня знаний и опыта. Мы ищем в команду человека, который: постоянно учиться и развивается; всегда нацелен на результат; умеет работать в команде; не боится сложных задач; обладает самостоятельностью; любит свою работу. Решаем интересные разноплановые задачи. Ключевые навыки: MS Visio UML Data Analysis SQL Анализ данных",
237,237,системный аналитик,Новосибирск,50000.0,,Корпорация  Сибирское здоровье,2019-10-20T19:42:27+0300,От 1 года до 3 лет,Полный день,Полная занятость,"Мы ищем специалиста по сопровождению и документированию процедур бизнес-процессов организации. Основные функции: Оформление бизнес-требований: Описание текущих бизнес-процессов. Оформление требований к процессу. Оформление сопроводительной документации: Создание разделов сопроводительной документации в соответствие с видами процессов. Передача требований ИТ специалистам на разработку. Аудит текущих процессов: Аудит соответствий ПО и бизнес-требований компании. Аудит сопроводительной документации: Контроль заполнения разделов. Контроль обновления разделов. Регламентирование процессов разработки ПО: Регламентирование пользовательских требований: Ведение нумерации процессов. Ведение регламентированной документации по процессам. Ведение документации по изменениям. Регламентирование форм исполнения задания: Формы требований. Формы приемки задания. Реестр внесенных изменений. Регламентирование процессов сопроводительной документации: Ведение разделов технической документации Контроль заполнения документации по формам Требования: Опыт работы в должности менеджера СМК (система менеджмента качества). Опыт работы от двух лет. Знание разделов ISO 90001/ГОСТ 9001. Владение навыками написания нотаций: IDEF, BPMN, UML. Условия: График работы: понедельник-пятница рабочие дни, ненормированный рабочий день. Постоянный профессиональный рост. Размер заработной платы определяется по итогам собеседования. Периодический пересмотр заработной платы по итогам работы."," Опыт работы в должности менеджера СМК (система менеджмента качества). Опыт работы от двух лет. Знание разделов ISO 90001/ГОСТ 9001. Владение навыками написания нотаций: IDEF, BPMN, UML. ",," График работы: понедельник-пятница рабочие дни, ненормированный рабочий день. Постоянный профессиональный рост. Размер заработной платы определяется по итогам собеседования. Периодический пересмотр заработной платы по итогам работы.",Системный анализ|UML|Информационные технологии|СМК
