,Unnamed: 0,name,area,min_salary,max_salary,employer,published_at,experience,schedule,employment,description,requirements,duties,conditions,key_skills
778,778,программист 1с,Екатеринбург,75000.0,,Энергомост,2019-10-01T08:38:15+0300,От 1 года до 3 лет,Полный день,Полная занятость,"Обязанности: Создание новых и модификация существующих документов, отчетов, обработок; Техническая поддержка, обучение и консультирование пользователей при работе с 1С. Администрирование баз данных 1С. Обновление типовых и нетиповых(измененных) конфигураций; Разработка нестандартных решений на базе 1С. Выполнение работ по задачам пользователей (от формулировки до исполнения); Поиск ошибок в программном коде и исправление их. Помощь в поиске ошибок в данных и исправления их; Создание инструкций по работе с новым функционалом. Требования: Высшее профильное образование; Опыт разработки программных решений на платформе 1С: Предприятие 8.2-8.3 (конфигурации «Управление производственным предприятием 1.3», Зарплата и управление персоналом, Бухгалтерия). По возможности 1С: Предприятие 7.7; Опыт проектирования и реализации нового функционала, интеграция с типовыми конфигурациями. Уметь реализовать обмен данными. Знание предметных областей учета на предприятии (бухгалтерия, кадровый и управленческий учёты, производство); Коммуникабельность, ответственность. Условия: Официальное трудоустройство в соответствии с ТК РФ; Заработная плата от 75 000 руб.; Пятидневная рабочая неделя с 08.00 до 17.00; Доставка служебным транспортом; Место работы - г. Екатеринбург, ул. Маневровая."," Высшее профильное образование; Опыт разработки программных решений на платформе 1С: Предприятие 8.2-8.3 (конфигурации «Управление производственным предприятием 1.3», Зарплата и управление персоналом, Бухгалтерия). По возможности 1С: Предприятие 7.7; Опыт проектирования и реализации нового функционала, интеграция с типовыми конфигурациями. Уметь реализовать обмен данными. Знание предметных областей учета на предприятии (бухгалтерия, кадровый и управленческий учёты, производство); Коммуникабельность, ответственность. "," Создание новых и модификация существующих документов, отчетов, обработок; Техническая поддержка, обучение и консультирование пользователей при работе с 1С. Администрирование баз данных 1С. Обновление типовых и нетиповых(измененных) конфигураций; Разработка нестандартных решений на базе 1С. Выполнение работ по задачам пользователей (от формулировки до исполнения); Поиск ошибок в программном коде и исправление их. Помощь в поиске ошибок в данных и исправления их; Создание инструкций по работе с новым функционалом. "," Официальное трудоустройство в соответствии с ТК РФ; Заработная плата от 75 000 руб.; Пятидневная рабочая неделя с 08.00 до 17.00; Доставка служебным транспортом; Место работы - г. Екатеринбург, ул. Маневровая.",
991,991,программист 1с,Екатеринбург,80000.0,,Мебельная фабрика Любимая кухня,2019-10-20T21:09:34+0300,От 1 года до 3 лет,Полный день,Полная занятость,"Федеральная торгово-производственная Компания ЛЮБИМАЯ КУХНЯ уже больше 10 лет радует своих клиентов качественной и красивой мебелью. Сегодня сеть фирменных салонов работает в 19 городах России, и 8 салонов – в Екатеринбурге. Будучи одним из ведущих производителей кухонь и шкафов-купе, ЛЮБИМАЯ КУХНЯ каждый день продолжает учиться, совершенствоваться и расти - открывать новые салоны и расширять производство. Визитная карточка компании – скорость и качество, гордость – клиенты и сотрудники. Приглашаем в команду Программиста 1с. Ценнейший опыт, масштабные задачи и интересные проекты гарантируем! А также работу в отличной профессиональной команде, и активно развивающейся амбициозной компании. Обязанности: Доработка, развитие и поддержка информационной структуры торгово-производственного предприятия на базе 1С 8.3 (конфигурация «УНФ»); Разработка решений на платформе 1С 8.3. в соответствии с тех. заданиями заказчиков (компания и ее подразделения), написание и оптимизация сложных запросов; Интеграция с различными IT-сервисами; Разработка и настройка отчетов по бухгалтерскому, оперативному и управленческому учету, корректировка разработанных программ на основе анализа итоговых данных; Поддержка пользователей. Требования: Профессиональное IT-образование; Знание платформы 1С и опыт программирования в конфигурации 1С 8, 8.3 (от 1 года); Знание принципов бухгалтерского и товарного учета; Готовность слышать запрос, умение взаимодействовать с заказчиком, анализировать возникающие проблемы и предлагать решения; Умение и желание работать в команде. Условия: Комфортный режим работы (обсуждается индивидуально); ЗП - оклад 80000 р. + премиальная часть (обсуждается индивидуально с кандидатами); Официальное трудоустройство; Возможность обучения за счет работодателя; Интересные задачи и возможности профессионального роста; Дружный и стабильный коллектив; Возможность получения корпоративного кредита; Испытательный срок – 2 месяца."," Профессиональное IT-образование; Знание платформы 1С и опыт программирования в конфигурации 1С 8, 8.3 (от 1 года); Знание принципов бухгалтерского и товарного учета; Готовность слышать запрос, умение взаимодействовать с заказчиком, анализировать возникающие проблемы и предлагать решения; Умение и желание работать в команде. "," Доработка, развитие и поддержка информационной структуры торгово-производственного предприятия на базе 1С 8.3 (конфигурация «УНФ»); Разработка решений на платформе 1С 8.3. в соответствии с тех. заданиями заказчиков (компания и ее подразделения), написание и оптимизация сложных запросов; Интеграция с различными IT-сервисами; Разработка и настройка отчетов по бухгалтерскому, оперативному и управленческому учету, корректировка разработанных программ на основе анализа итоговых данных; Поддержка пользователей. ", Комфортный режим работы (обсуждается индивидуально); ЗП - оклад 80000 р. + премиальная часть (обсуждается индивидуально с кандидатами); Официальное трудоустройство; Возможность обучения за счет работодателя; Интересные задачи и возможности профессионального роста; Дружный и стабильный коллектив; Возможность получения корпоративного кредита; Испытательный срок – 2 месяца.,1С программирование|1С: Предприятие 8|MS SQL|1C: Бухгалтерия|1С: Производство
535,535,программист 1с,Челябинск,80000.0,,Копейский машзавод,2019-10-07T06:22:09+0300,Более 6 лет,Полный день,Полная занятость,"Обязанности: Доработка конфигурации 1С Предприятия по требованиям. Создание и доработка документов, отчетов и обработок. Обновление не типовых конфигураций. Установка регламентной отчетности. Проведение аналитической работы с целью устранения ошибок в системе, увеличения уровня автоматизации бизнес-процессов, оптимизации работы в системах. Постановка технического задания и его выполнение. Оперативное закрытие месяца. Интеграция систем. Консультирование пользователей. Требования: Высшее образование. Опыт работы в должности программиста 1С. Опыт работы с 1С УПП, 1С Управление холдингом, 1С ERP. Аналитическая работа.Хороший уровень владения ПК и офисного программного обеспечения. Английский язык, достаточный для выполнения обязанностей. Программирование в 1С: Предприятие 8.2 и 8.3. Обновление не типовых (доработанных, изменённых) конфигураций. Знание СКД. Знание основ налогового, финансового, бухгалтерского учета, бюджетирования и казначейства. Условия: Официальное трудоустройство, полный соц. пакет. Пятидневный режим работы с 8-00 до 17-00."," Высшее образование. Опыт работы в должности программиста 1С. Опыт работы с 1С УПП, 1С Управление холдингом, 1С ERP. Аналитическая работа.Хороший уровень владения ПК и офисного программного обеспечения. Английский язык, достаточный для выполнения обязанностей. Программирование в 1С: Предприятие 8.2 и 8.3. Обновление не типовых (доработанных, изменённых) конфигураций. Знание СКД. Знание основ налогового, финансового, бухгалтерского учета, бюджетирования и казначейства. "," Доработка конфигурации 1С Предприятия по требованиям. Создание и доработка документов, отчетов и обработок. Обновление не типовых конфигураций. Установка регламентной отчетности. Проведение аналитической работы с целью устранения ошибок в системе, увеличения уровня автоматизации бизнес-процессов, оптимизации работы в системах. Постановка технического задания и его выполнение. Оперативное закрытие месяца. Интеграция систем. Консультирование пользователей. "," Официальное трудоустройство, полный соц. пакет. Пятидневный режим работы с 8-00 до 17-00.",1С программирование|1С: Бухгалтерия|1С: Предприятие 8|1С: Зарплата и управление персоналом|1С: Управление Производственным Предприятием
83,83,программист 1с,Новосибирск,80000.0,,Микросан,2019-10-21T07:22:56+0300,От 3 до 6 лет,Полный день,Полная занятость,"Обязанности: доработка 1С под потребности компании, программирование и внедрение изменений; программирование на платформе 1С 8.3; написание читаемого, оптимального кода; создание и изменение новых документов ,справочников, обработок, отчетов; разработка и настройка в рабочее состояние механизмов обмена данными между конфигурациями 1С и другими программами; оптимизация расчетов в программе 1С; консультирование пользователей по работе в 1С; поддержка пользователей системы; Требования: высшее техническое образование в области IT; опыт работы по программированию в среде 1С платформы 8.3 от 3 лет; умение разбираться в чужом коде; умение обучать пользователей и объяснять им работу программы; знание 1С, опыт разработки решений на платформе 1С 8.2/8.3; доработка и адаптация под потребности компании продукта 1С (УТ) поддержка обмена между базами 1С; интеграция 1C с внешними системами; навыки разработки проектной и рабочей документации; самоорганизованность при выборе приоритетов в решениях, самостоятельное ведение всех задач по разработке. Условия: Трудоустройство согласно ТК РФ; график работы: Пн-Пт 9:00-17:00 / Сб. Вс -выходной. офис в шаговой доступности транспорта, по линии метро . отпуск - 28 дней, желательно - 2 недели + 2 недели / год; удобное рабочее место в молодом и дружелюбном коллективе. программист 1С требуется на постоянную основу; частичная занятость и удаленная работа исключены;"," высшее техническое образование в области IT; опыт работы по программированию в среде 1С платформы 8.3 от 3 лет; умение разбираться в чужом коде; умение обучать пользователей и объяснять им работу программы; знание 1С, опыт разработки решений на платформе 1С 8.2/8.3; доработка и адаптация под потребности компании продукта 1С (УТ) поддержка обмена между базами 1С; интеграция 1C с внешними системами; навыки разработки проектной и рабочей документации; самоорганизованность при выборе приоритетов в решениях, самостоятельное ведение всех задач по разработке. "," доработка 1С под потребности компании, программирование и внедрение изменений; программирование на платформе 1С 8.3; написание читаемого, оптимального кода; создание и изменение новых документов ,справочников, обработок, отчетов; разработка и настройка в рабочее состояние механизмов обмена данными между конфигурациями 1С и другими программами; оптимизация расчетов в программе 1С; консультирование пользователей по работе в 1С; поддержка пользователей системы; "," Трудоустройство согласно ТК РФ; график работы: Пн-Пт 9:00-17:00 / Сб. Вс -выходной. офис в шаговой доступности транспорта, по линии метро . отпуск - 28 дней, желательно - 2 недели + 2 недели / год; удобное рабочее место в молодом и дружелюбном коллективе. программист 1С требуется на постоянную основу; частичная занятость и удаленная работа исключены;",1С программирование|1С: Предприятие 8|MS SQL Server|1С: Документооборот|1С: Торговля и склад|1С: Управление Торговлей|Обновление конфигурации 1С
313,313,программист 1с,Краснодар,80000.0,,Марико,2019-10-17T08:43:19+0300,От 1 года до 3 лет,Полный день,Полная занятость,"Федеральная сеть алкогольных магазинов приглашает на работу Программиста 1С. Обязанности: Доработка конфигураций на платформе 1С (8.2 и 8.3) в соответствии с требованиями аналитиков и тд. (на основании ТЗ). Документирование доработок в соответствии с внутренними стандартами компании. Разработка системы дисконта и бонусов. Анализ выявленных ошибок в конфигурациях 1С. Обновление не типовых конфигураций. Анализ чужого кода. Разработка отчетов, в том числе сложных с использованием СКД. Настройка обменов 1С розница, настройка ЕГАИС. Требования: Высшее образование, желательно - Прикладная информатика. Знание типовых конфигураций БП, УТ, Розница (Алкоголь). Работа с нестандартными конфигурациями 1С на платформе 8.2 и 8.3. Наличие сертификатов 1С. Опыт работы с распределенными БД. Публикация 1С Опыт работы с SQL. Знания правил обменов Условия: График работы 5/2 с 8.00 до 17.00. Достойная заработная плата. Оформление по ТК РФ. Место работы: Краснодар, ул.Дмитриевская дамба Просьба реально оценивать свои навыки, прежде чем оставлять отклик на вакансию."," Высшее образование, желательно - Прикладная информатика. Знание типовых конфигураций БП, УТ, Розница (Алкоголь). Работа с нестандартными конфигурациями 1С на платформе 8.2 и 8.3. Наличие сертификатов 1С. Опыт работы с распределенными БД. Публикация 1С Опыт работы с SQL. Знания правил обменов "," Доработка конфигураций на платформе 1С (8.2 и 8.3) в соответствии с требованиями аналитиков и тд. (на основании ТЗ). Документирование доработок в соответствии с внутренними стандартами компании. Разработка системы дисконта и бонусов. Анализ выявленных ошибок в конфигурациях 1С. Обновление не типовых конфигураций. Анализ чужого кода. Разработка отчетов, в том числе сложных с использованием СКД. Настройка обменов 1С розница, настройка ЕГАИС. "," График работы 5/2 с 8.00 до 17.00. Достойная заработная плата. Оформление по ТК РФ. Место работы: Краснодар, ул.Дмитриевская дамба Просьба реально оценивать свои навыки, прежде чем оставлять отклик на вакансию.",SQL|1С: Розница|1С: Управление Торговлей|1С программирование|MS SQL
