,Unnamed: 0,name,area,min_salary,max_salary,employer,published_at,experience,schedule,employment,description,requirements,duties,conditions,key_skills
34,34,программист 1с,Новосибирск,,,"Обувь России, ГК",2019-10-20T08:59:16+0300,От 1 года до 3 лет,Полный день,Полная занятость,"Компания «Обувь России» — одна из крупнейших федеральных сетей обувных магазинов, основанная в 2003 году. На сегодняшний день в городах Сибири, Урала и Центральной части России работают более 500 магазинов компании под брендами «Вестфалика», «Пешеход» и «Emilia Estra». В связи с развитием сети обувных магазинов приглашаем на вакансию: «Программист 1С» Предлагаем: интересную работу в одной из крупнейших федеральных розничных сетей; сплоченный, профессиональный и увлеченный своим делом коллектив; открытые возможности для профессионального и карьерного развития; официальное трудоустройство, социальные гарантии; достойный уровень оплаты труда. Обязанности: сопровождение баз данных 1С 8.2 УПП, Управление торговлей (администрирование, обновление нетиповых конфигураций, устранение ошибок, поддержка пользователей) доработка конфигураций по нуждам сотрудников компании (обработки, отчеты, модули и т.д.) разработка нестандартных решений и оптимизация процессов Требования: высшее образование уверенное программирование на платформе 1С 8.2.",," сопровождение баз данных 1С 8.2 УПП, Управление торговлей (администрирование, обновление нетиповых конфигураций, устранение ошибок, поддержка пользователей) доработка конфигураций по нуждам сотрудников компании (обработки, отчеты, модули и т.д.) разработка нестандартных решений и оптимизация процессов ",,
115,115,программист 1с,Новосибирск,,,Гастромаркет,2019-09-23T07:26:20+0300,От 1 года до 3 лет,Полный день,Полная занятость,"Основные обязанности: Поддержка и сопровождение конфигурации 1С: Управление производственным предприятием; Доработка и обновление программ 1С в соответствии с требованиями учета в Компании и действующего законодательства; Автоматизация бизнес-процессов Компании на основе продуктов 1С; Участие в проектах Компании; Участие в разработке технических заданий; Консультирование пользователей по вопросам использования программных продуктов 1С. Требования: Обязателен опыт разработки клиент-серверных решений на платформе 1С 8.2/8.3; Желательно знание конфигураций 1С:Управление производственным предприятием , 1С:Комплексная автоматизация, 1С:Зарплата и управление персоналом; Понимание предметной области (бух.учёт, упр.учёт, зарплата, управление персоналом, бюджетирование); Опыт сбора и формализации требований, составления технических заданий; Опыт самостоятельного ведения проектов, успешных внедрений продуктов на базе платформы 1С; Опыт совместной разработки, использования и администрирования хранилища; Базовый уровень администрирования MS SQL 2005/2008; Наличие пройденных курсов и/или сертификаты 1С будут преимуществом; Личные качества: аналитический склад ума, ответственность, нацеленность на результат, коммуникабельность, грамотность речи, стрессоустойчивость, обучаемость. НАШИ ПРЕИМУЩЕСТВА: Возможность профессионального и карьерного роста в крупнейшей Компании Сибирского региона; Участие в интересных проектах Дружный коллектив профессионалов, программа адаптации и обучения Обучение и повышение квалификации Бонусная программа для сотрудников в магазинах Компании; Доставка служебным транспортом от метро пл. Карла Маркса (место работы ул. Петухова). Уровень дохода обсуждается с успешным кандидатом индивидуально.",,,,
140,140,программист 1с,Новосибирск,,,"People group, центр подбора и развития персонала",2019-10-14T07:11:31+0300,От 3 до 6 лет,Удаленная работа,Проектная работа,"В Компанию, которая занимается оптимизацией и повышением эффективности работы отделов продаж, внедрением CRM-систем (Битрикс 24, amoCRM, Мегаплан), IT-решениями в сфере автоматизации бизнес процессов, подключением IP -телефонии и настройкой 1С требуется Программист 1С на удаленную проектную работу. Требования - Навыки подключения синхронизации Битрикс24 с 1С конфигурации УНФ 1.6, - Бухгалтерия 3.0 , УТ 10.3 и 11.3 и выше - Навыки доработки конфигураций УНФ, УПП, КА1.3 и КА 2.0, УНФ 1.6, УТ 10.2, 10.3. 11.3 по расширению функционала Условия обсуждаются.",,,,1С программирование|Обновление конфигурации 1С|1C: Бухгалтерия
316,316,программист 1с,Краснодар,,,Сити Ресторантс,2019-10-15T17:02:26+0300,От 3 до 6 лет,Удаленная работа,Проектная работа,"Крупная развивающаяся сеть предприятий быстрого обслуживания (рестораны KFC, Pizza Hut, IL Патио, Планета Суши) приглашает на работу Программиста 1С (удаленная работа на проект). Обязанности: Поддержка и сопровождение действующих информационных систем 1С (ERP, ЗУП, Общепит). Автоматизация бизнес-процессов в соответствии с ТЗ на платформе 1С. Участие в разработке ТЗ на на базе 1С:ERP в составе рабочей группы проекта, определение способов реализации ТЗ. Поддержание и развитие реализованного функционала в учетной системе. Консультация и поддержка пользователей. Требования: Знание конфигураций: ERP ЗУП Базовое понимание бух.учета Опыт работы 3-5 лет в качестве программиста (обязательно), методолга-консультанта (желательно) Опыт интеграции 1С с внешними информационными системами Опыт разработки в среде Конвертация данных 2.0 Условия: Оформление по договору ГПХ сроком на 6 месяцев График работы: удаленный (встречи в офисе или по скайпу 1-2 раза/неделю) Заработная плата обсуждается с успешным кандидатом Офис в центре города (м.Арбатская)"," Знание конфигураций: ERP ЗУП Базовое понимание бух.учета Опыт работы 3-5 лет в качестве программиста (обязательно), методолга-консультанта (желательно) Опыт интеграции 1С с внешними информационными системами Опыт разработки в среде Конвертация данных 2.0 "," Поддержка и сопровождение действующих информационных систем 1С (ERP, ЗУП, Общепит). Автоматизация бизнес-процессов в соответствии с ТЗ на платформе 1С. Участие в разработке ТЗ на на базе 1С:ERP в составе рабочей группы проекта, определение способов реализации ТЗ. Поддержание и развитие реализованного функционала в учетной системе. Консультация и поддержка пользователей. ", Оформление по договору ГПХ сроком на 6 месяцев График работы: удаленный (встречи в офисе или по скайпу 1-2 раза/неделю) Заработная плата обсуждается с успешным кандидатом Офис в центре города (м.Арбатская),1С: Предприятие 8|1С программирование|1С: Зарплата и управление персоналом|ERP|ЕГАИС
337,337,программист 1с,Краснодар,,,Kelly Services,2019-10-21T13:56:33+0300,Нет опыта,Полный день,Полная занятость,"Обязанности: Выполнение программного сопровождения конфигураций «1С:Зарплата и управление персоналом» (редакции 2.5, 3.1); Обновление конфигураций и модификаций функционала системы в соответствии с согласованными с бизнес-экспертами заданиями и в согласованные с бизнес-экспертами сроки; Проведение модификаций и обновление существующего функционала Системы, а также создание новых объектов системы; Обеспечение исправление обнаруженных в Системе ошибок. Требования: Высшее техническое, среднее профессиональное; Не обязательно, но желательно 1С:Специалист, 1С:Профессионал; Не менее 2 лет в области разработки 1С Предприятие 8, не менее 1 года разработки в области «1С:Зарплата и управление персоналом» (редакции 2.5, 3.1); Приветствуется опыт разработки в конфигурацях: 1С:Документооборот, 1С:Управление производственным предприятием (УПП); Хорошее знание механизмов платформы (СКД, запросы, опыт по интеграции и обмену данными), опыт написания сложных запросов, разработка управляемых приложений.",," Выполнение программного сопровождения конфигураций «1С:Зарплата и управление персоналом» (редакции 2.5, 3.1); Обновление конфигураций и модификаций функционала системы в соответствии с согласованными с бизнес-экспертами заданиями и в согласованные с бизнес-экспертами сроки; Проведение модификаций и обновление существующего функционала Системы, а также создание новых объектов системы; Обеспечение исправление обнаруженных в Системе ошибок. ",,1С: Управление Производственным Предприятием|1С: Бухгалтерия|1С: Зарплата и управление персоналом|Обновление конфигурации 1С|1С: Документооборот
505,505,программист 1с,Челябинск,,,"Кременкульская, Фабрика",2019-10-21T12:45:39+0300,От 1 года до 3 лет,Полный день,Полная занятость,"Обязанности: Доработка типовых конфигураций 1С; написание отчетов; перенос данных. Требования: Профильное образование; Приветствуется опыт работы в аналогичной должности на производстве (1С 8.3); Ответственность , исполнительность, внимательность. Условия: Кондитерская фабрика «Кременкульская» высокотехнологичное предприятие, которое успешно работает на рынке кондитерских изделий c 1998 года. . Мы обеспечиваем нашим сотрудникам: Официальное трудоустройство, социальный пакет; Заработная плата договорная; Доставка с северо-запада служебным транспортом."," Профильное образование; Приветствуется опыт работы в аналогичной должности на производстве (1С 8.3); Ответственность , исполнительность, внимательность. ", Доработка типовых конфигураций 1С; написание отчетов; перенос данных. ," Кондитерская фабрика «Кременкульская» высокотехнологичное предприятие, которое успешно работает на рынке кондитерских изделий c 1998 года. . Мы обеспечиваем нашим сотрудникам: Официальное трудоустройство, социальный пакет; Заработная плата договорная; Доставка с северо-запада служебным транспортом.",1С: Предприятие 8|1С: Производство|1C: Бухгалтерия|1С программирование
510,510,программист 1с,Челябинск,,,"Колос,кондитерская фабрика",2019-10-21T07:33:17+0300,От 3 до 6 лет,Гибкий график,Полная занятость,"Программист 1С (Фриланс) Обязанности: Разработка на платформе 1с 8. Сопровождение продукта 1с ЗУП КОРП; Разработка отчетов и обработок по запросу пользователей в программе 1с ЗУП КОРП; Опыт разработки отчетов по запросу пользователей; Настройка обмена данных между 1с ЗУП КОРП и другими платформами; Обновление программного обеспечения 1с ЗУП КОРП с сохранением работоспособности всех отчетов и обработок. Требования: Опыт работы разработки в 1с ОБЯЗАТЕЛЕН; Знание программы 1с ЗУП Корп будет являться для вас существенным преимуществом; Опыт программирования на платформе 1С 8.3 (управляемые формы); Знание языка запросов; Опыт работы с СКД; Условия: График работы свободный; Уровень заработной платы достойный, окончательный уровень определяется по итогам собеседования; Интересные задачи и проекты; Льготное питание - 50 рублей (комплексный обед).", Опыт работы разработки в 1с ОБЯЗАТЕЛЕН; Знание программы 1с ЗУП Корп будет являться для вас существенным преимуществом; Опыт программирования на платформе 1С 8.3 (управляемые формы); Знание языка запросов; Опыт работы с СКД; , Разработка на платформе 1с 8. Сопровождение продукта 1с ЗУП КОРП; Разработка отчетов и обработок по запросу пользователей в программе 1с ЗУП КОРП; Опыт разработки отчетов по запросу пользователей; Настройка обмена данных между 1с ЗУП КОРП и другими платформами; Обновление программного обеспечения 1с ЗУП КОРП с сохранением работоспособности всех отчетов и обработок. ," График работы свободный; Уровень заработной платы достойный, окончательный уровень определяется по итогам собеседования; Интересные задачи и проекты; Льготное питание - 50 рублей (комплексный обед).",1С программирование|1С: Зарплата и управление персоналом|1С: Комплексная автоматизация|Подбор персонала|Управление персоналом
520,520,программист 1с,Челябинск,,,ALP Group,2019-10-11T11:22:50+0300,Более 6 лет,Полный день,Полная занятость,"Наша Компания осуществляет автоматизацию процессов учета, управления и планирования для крупных корпораций нефтяного сектора, химического, энергетического и других компаний (Газпром нефть, Роснефть, Уралкалий и др.). Автоматизацию, которую мы проводим, является крупнейшей в стране, уникальной по своей архитектуре, с использованием передовых ИТ-технологий . Несколько фактов: Мы более 20 лет на рынке; Команда - более 200 человек; Мы работаем с сектором крупного корпоративного бизнеса, поэтому наши проекты масштабные и длительные; Мы поддерживаем наших сотрудников в профессиональном и карьерном развитии; Мы используем современные технологи и &quot;железо&quot;. Если Вам хочется работать в молодой, живой, дружной команде, заниматься нескучными 1С-проектами, иметь реальную возможность развития и роста – мы будем рады видеть Вас в нашей команде. Чем предстоит заниматься: Внедрение, поддержка и доработка конфигураций 1С на основе технического задания; Создание собственных решений и разработок; Первичное тестирование разработанного функционала; Решение проблем‚ возникающих в ходе работы АС; Для нас важно: Опыт реализованных проектов по 1С; Отличные знания конфигураций и архитектуры 1С; Умение и желание работать в команде; Опыт разработки SQL запросов и работы с СКД (желательно); Опыт работы с распределенными базами и обменами данными с внешними системами; Опыт разработки в клиент-серверном варианте; Опыт рефакторинга кода 1С (желательно); Опыт интеграции решений на платформе 1С с другими ПП (желательно). Мы ценим профессионализм, поэтому готовы предложить: Уровень заработной платы, который опирается на уровень Ваших компетенций (не завязан на &quot;часах&quot; и Kpi); Работу в современно-оснащенном офисе, в шаговой доступности от метро (без разъездов); Выстроенную модель развития сотрудников в компании; Оформление согласно ТК РФ, Соц.пакет (ДМС) после прохождения испытательного срока; График работы 5/2 с 8:00-17:00, 9:00-18:00 либо с 10:00-19:00; Реальные возможности для профессионального и карьерного роста, на интересных и крупных проектах; Отличный, профессиональный коллектив; Вкусный кофе, чай, сладости и молоко)).",,,,
