,Unnamed: 0,name,area,min_salary,max_salary,employer,published_at,experience,schedule,employment,description,requirements,duties,conditions,key_skills
659,659,программист 1с,Челябинск,,,UDevelopment ,2019-10-18T15:58:25+0300,От 3 до 6 лет,Полный день,Полная занятость,"Компания Udevelopment ищет в свою команду профессионалов Ведущего программиста 1С. Место работы г. Екатеринбург. Рассматриваем кандидатов, желающих переехать. Обязанности: Непосредственное участие в проекте внедрения 1С ERP + Документооборот: - разработка и изменение стандартного функционала программ - настройка обменов - оптимизация производительности - работа в команде разработчиков 2. Операционная деятельность: - поддержка, сопровождение и консультация пользователей по конфигурациям баз 1С: БП 3.0, ЗУП 3.1, Хеликс Фитнес - доработка конфигураций 1С под нужды заказчика (использование «расширений») - разработка отчетов и обработок - исправление и доработка обменов между БД - оперативный поиск и исправление ошибок пользователей Требования: Высшее образование Опыт программирования на платформе 1С 8 от 3 лет: - Управляемые формы - СКД - Конвертация данных 2-3 - Опыт разработки своих механизмов, подсистем или конфигураций Понимание структуры объектов конфигуратора Знание синтаксиса языка 1С Общее понимание управленческого и бухгалтерского учета Умение формировать рабочее ТЗ по поставленным задачам Работа на результат, коммуникабельность, стрессоустойчивость, любознательность Условия: Официальное трудоустройство, соц. пакет согласно ТК РФ График работы 5/2 с 9:00 до 18:00 Место работы г. Екатеринбург. Рассматриваем кандидатов, желающих переехать. Комфортабельный офис в центре города, в шаговой доступности от метро Площадь 1905 года Стабильная заработная плата, в компании не бывает задержек. Готовы обсудить ожидания достойных кандидатов Возможность развиваться вместе с компанией"," Высшее образование Опыт программирования на платформе 1С 8 от 3 лет: - Управляемые формы - СКД - Конвертация данных 2-3 - Опыт разработки своих механизмов, подсистем или конфигураций Понимание структуры объектов конфигуратора Знание синтаксиса языка 1С Общее понимание управленческого и бухгалтерского учета Умение формировать рабочее ТЗ по поставленным задачам Работа на результат, коммуникабельность, стрессоустойчивость, любознательность "," Непосредственное участие в проекте внедрения 1С ERP + Документооборот: - разработка и изменение стандартного функционала программ - настройка обменов - оптимизация производительности - работа в команде разработчиков 2. Операционная деятельность: - поддержка, сопровождение и консультация пользователей по конфигурациям баз 1С: БП 3.0, ЗУП 3.1, Хеликс Фитнес - доработка конфигураций 1С под нужды заказчика (использование «расширений») - разработка отчетов и обработок - исправление и доработка обменов между БД - оперативный поиск и исправление ошибок пользователей "," Официальное трудоустройство, соц. пакет согласно ТК РФ График работы 5/2 с 9:00 до 18:00 Место работы г. Екатеринбург. Рассматриваем кандидатов, желающих переехать. Комфортабельный офис в центре города, в шаговой доступности от метро Площадь 1905 года Стабильная заработная плата, в компании не бывает задержек. Готовы обсудить ожидания достойных кандидатов Возможность развиваться вместе с компанией",1С программирование|1С: Предприятие 8|1С: Зарплата и управление персоналом|Обновление конфигурации 1С|1C: Бухгалтерия|Пользователь ПК|1С: Документооборот
678,678,программист 1с,Челябинск,,,Мета,2019-10-17T08:54:02+0300,От 1 года до 3 лет,Полный день,Полная занятость,"Всем привет! Меня зовут Антон, я руководитель IT управления ГК «МЕТА». Наша компания создана 15 лет назад и сегодня входит в число крупнейших компаний отрасли, насчитывая более 90 участков в 15 регионах РФ. Мы являемся ломозаготовительным дивизионом Группы ЧТПЗ - пожалуй, самой инновационной компании металлургического комплекса РФ. С помощью технологий мы хотим изменить сначала себя, а потом и ломоперерабатывающую отрасль. Я ищу себе в команду талантливого и амбициозного программиста, которому интересно запустить и довести до конца проект по внедрению отраслевого решения на платформе 1С, а на перспективу пяти лет – внедрять новые сервисы и технологии (CRM, BI, mobile app), включая переход на ERP. Мне нужен человек, который способен одинаково хорошо как управлять задачами и сроками, так и работать «руками». Hard skills: Мы работаем с 1С 8.2/8.3, включая 1С: УПП 1.3, 1С: Зарплата и управление персоналом 3.1, также собственное отраслевое решение.. В работе потребуется умение программировать, дорабатывать документы, отчеты и обработки, а также решать методологические и аналитические вопросы Soft skills (Вы нам подходите, если): ОРИЕНТИРОВАНЫ НА РЕЗУЛЬТАТ мы понимаем, зачем реализовываем те или иные проекты, каждая задача – это инвестиция, если она не дает результат, мы не тратим на нее время, даже если «ну они очень просили сделать кнопку розовой»; ПРИНИМАЕТЕ ОТВЕТСТВЕННОСТЬ за невыполнение своей задачи отвечаете ВЫ, не «плохой разработчик», который обещал, но не сделал; не «плохой заказчик», который забыл рассказать про свои ожидания; не «одноклассник Петя», который дразнил Вас в школе и оставил психологическую травму; ОТКРЫТ К ОБЩЕНИЮ Рад буду пообщаться и познакомиться лично, ответить на вопросы и послушать про Ваш бэкграунд. Со своей стороны, мы готовы предложить условия &quot;выше рынка&quot;: З/п от 92 000, оклад + премия (проектные бонусы, которые обсуждается на собеседовании); Официальное трудоустройство по ТК РФ; Пятидневная рабочая неделя, сб-вс выходные дни; ДМС, после 6 мес. работы.",,,,
703,703,программист 1с,Челябинск,,,Челябинский кузнечно-прессовый завод (ЧКПЗ),2019-10-16T08:15:49+0300,Нет опыта,Полный день,Полная занятость,"Обязанности: Внедрение на Предприятие и запуск проекта 1С ERP (полный цикл с «0»); • Документирование процессов предприятия, планирование работ, составление технических заданий, работа с подрядчиками в части разработки и перехода на 1С ERP с 1С УПП • Последующая поддержка пользователей в части разработанного функционала; • Администрирование пользователей и прав доступа к существующим системам 1С ERP; • Контроль за выполнением обменов, мониторинг ошибок в системах 1С; • Оперативное консультирование пользователей; • Анализ и исправление системных ошибок реализованного функционала; • Программирование (по ФТ, ТЗ); • Установка регламентированной отчетности, тестирование и исправление баз, обмены распределенных баз и их чистка, перепроведение баз 1C, регистрация, обнаружение и исправление технических багов; • Работа с данными (проверка данных, обработка данных, контроль за выполнением обменов, мониторинг ошибок в системах 1С, поиск и исправление ошибок в данных); • Консультации пользователей (устно, по телефону, по почте, нерегулярное, вынужденное обучение сотрудников, просвещение сотрудников других отделов); Требования: Опыт внедрения на Предприятие и запуск проекта 1С ERP; • Знание основных положений бухгалтерского учета, знание по секторам учета (учет основных средств, складской учет, учет взаиморасчетов, учет в производстве, расчет себестоимости и т.д.), налогового учета, знание основных положений, принципов, методик финансового и управленческого учета; • Опыт работы по организации обмена между различными конфигурациями 1С; Условия: Пятидневная рабочая неделя ( 8:00- 16:30) Работа на современном крупном промышленном предприятии; Своевременная и достойная оплата труда; Официальное трудоустройство в соответствии с ТК РФ; Развернутая программа социальных льгот, медицинского страхования и организации отдыха для работников."," Опыт внедрения на Предприятие и запуск проекта 1С ERP; • Знание основных положений бухгалтерского учета, знание по секторам учета (учет основных средств, складской учет, учет взаиморасчетов, учет в производстве, расчет себестоимости и т.д.), налогового учета, знание основных положений, принципов, методик финансового и управленческого учета; • Опыт работы по организации обмена между различными конфигурациями 1С; "," Внедрение на Предприятие и запуск проекта 1С ERP (полный цикл с «0»); • Документирование процессов предприятия, планирование работ, составление технических заданий, работа с подрядчиками в части разработки и перехода на 1С ERP с 1С УПП • Последующая поддержка пользователей в части разработанного функционала; • Администрирование пользователей и прав доступа к существующим системам 1С ERP; • Контроль за выполнением обменов, мониторинг ошибок в системах 1С; • Оперативное консультирование пользователей; • Анализ и исправление системных ошибок реализованного функционала; • Программирование (по ФТ, ТЗ); • Установка регламентированной отчетности, тестирование и исправление баз, обмены распределенных баз и их чистка, перепроведение баз 1C, регистрация, обнаружение и исправление технических багов; • Работа с данными (проверка данных, обработка данных, контроль за выполнением обменов, мониторинг ошибок в системах 1С, поиск и исправление ошибок в данных); • Консультации пользователей (устно, по телефону, по почте, нерегулярное, вынужденное обучение сотрудников, просвещение сотрудников других отделов); "," Пятидневная рабочая неделя ( 8:00- 16:30) Работа на современном крупном промышленном предприятии; Своевременная и достойная оплата труда; Официальное трудоустройство в соответствии с ТК РФ; Развернутая программа социальных льгот, медицинского страхования и организации отдыха для работников.",1С: Предприятие 8|1С программирование|1С: Управление Производственным Предприятием|Бухгалтерский учет|Расчет себестоимости
755,755,программист 1с,Екатеринбург,,,Маслон,2019-10-19T07:26:15+0300,От 1 года до 3 лет,Удаленная работа,Частичная занятость,"Официальному дистрибьютору смазочных материалов марок TOTAL нужен программист на УДАЛЕННУЮ РАБОТУ. Обязанности: Сопровождение баз 1С (1С: Управление торговлей 8.2, 1С: Бухгалтерия 8.2) Решение задач по ТЗ. Доработка конфигурации под специфику компании Написание дополнительных отчетов и обработок Настройка прав доступа Интеграция 1С с CRM Настройка обмена данными между различными конфигурациями Обновление доработанных конфигураций 1С Требования: Опыт работы от 2 лет Знание типовых конфигураций Наличие сертификатов приветствуется Выполнение задач в оговоренные сроки, доступность на связи, прозрачность Условия: Стабильная оплата по договору подряда Оплата труда по договоренности"," Опыт работы от 2 лет Знание типовых конфигураций Наличие сертификатов приветствуется Выполнение задач в оговоренные сроки, доступность на связи, прозрачность "," Сопровождение баз 1С (1С: Управление торговлей 8.2, 1С: Бухгалтерия 8.2) Решение задач по ТЗ. Доработка конфигурации под специфику компании Написание дополнительных отчетов и обработок Настройка прав доступа Интеграция 1С с CRM Настройка обмена данными между различными конфигурациями Обновление доработанных конфигураций 1С ", Стабильная оплата по договору подряда Оплата труда по договоренности,1С: Бухгалтерия|1С: Управление Торговлей
756,756,программист 1с,Екатеринбург,,,Металлинвест,2019-10-07T13:41:51+0300,От 1 года до 3 лет,Полный день,Полная занятость,"КРУПНАЯ ТОРГОВАЯ КОМПАНИЯ, ФЕДЕРАЛЬНЫЙ ПОСТАВЩИК МЕТАЛЛОПРОКАТА ПРИГЛАШАЕТ НА РАБОТУ программиста 1С Обязанности: Разработка программных решений на базе стандартных конфигураций 1С по техническим заданиям служб организации; Разработка и тестирование 1С WMS Разработка инструкций пользователей Требования: Знания программного языка 1С 8, объектов и механизмов платформы 8.2 и 8.3; Хорошие знания и опыт работы с типовыми конфигурациями 1С (ERP, УПП, ЗУП, Бухгалтерия); Опыт разработки объектов конфигураций 1С; Желание работать, обучаться и развиваться в данной сфере; Условия: Официальное трудоустройство График 5/2 с 09:00 - 18:00 Зарплата: оклад + ежемесячные премии + квартальные премии ( обсуждается на собеседовании)"," Знания программного языка 1С 8, объектов и механизмов платформы 8.2 и 8.3; Хорошие знания и опыт работы с типовыми конфигурациями 1С (ERP, УПП, ЗУП, Бухгалтерия); Опыт разработки объектов конфигураций 1С; Желание работать, обучаться и развиваться в данной сфере; ", Разработка программных решений на базе стандартных конфигураций 1С по техническим заданиям служб организации; Разработка и тестирование 1С WMS Разработка инструкций пользователей , Официальное трудоустройство График 5/2 с 09:00 - 18:00 Зарплата: оклад + ежемесячные премии + квартальные премии ( обсуждается на собеседовании),
826,826,программист 1с,Екатеринбург,,,PROFMAX,2019-10-20T15:17:36+0300,От 3 до 6 лет,Полный день,Полная занятость,"Региональная сеть магазинов одежды и обуви &quot;Profmax&quot; приглашает на работу Программиста 1С. Обязанности: Выполнение регламентных работ по ПО 1С; Обработка заявок от пользователей; Создание доработок/отчетов; Решение и ведение инцидентов, взаимодействие со службой поддержки, анализ инцидентов; Обновление конфигураций. Требования: Опыт работы в аналогичной должности от 3-х лет; Высшее образование (профильное); Успешный опыт во внедрении продуктов 1С (особенно УТ); Опыт разработки дополнительных обработок и отчетов; Понимание принципов бухгалтерского, финансового и складского учета; Клиентоориентированность, ориентация на результат и высокое качество, командная работа, ответственность и исполнительность. Условия: Работа в крупной региональной компании; Официальное трудоустройство; График работы 5/2 с 9:00 до 18:00 Сб. и Вс. - выходные; Заработная плата: рассматриваем ожидания кандидатов; Адрес офиса: ул. Лукиных (Уралмаш)."," Опыт работы в аналогичной должности от 3-х лет; Высшее образование (профильное); Успешный опыт во внедрении продуктов 1С (особенно УТ); Опыт разработки дополнительных обработок и отчетов; Понимание принципов бухгалтерского, финансового и складского учета; Клиентоориентированность, ориентация на результат и высокое качество, командная работа, ответственность и исполнительность. "," Выполнение регламентных работ по ПО 1С; Обработка заявок от пользователей; Создание доработок/отчетов; Решение и ведение инцидентов, взаимодействие со службой поддержки, анализ инцидентов; Обновление конфигураций. ", Работа в крупной региональной компании; Официальное трудоустройство; График работы 5/2 с 9:00 до 18:00 Сб. и Вс. - выходные; Заработная плата: рассматриваем ожидания кандидатов; Адрес офиса: ул. Лукиных (Уралмаш).,
