,Unnamed: 0,name,area,min_salary,max_salary,employer,published_at,experience,schedule,employment,description,requirements,duties,conditions,key_skills,days
227,227,python,Новосибирск,100714.28571428572,245000.0,Кадровое агентство Алексея Сухорукова,2019-09-24T14:54:44+0300,От 3 до 6 лет,Полный день,Полная занятость,"Крупная финтех компания, работающая на международном валютном рынке более 10 лет, ищет в свой отдел разработки на Кипре (Лимассол) опытного программиста на Python. Компания является одним из лидеров не только валютного рынка, но и одним из крупнейших форекс-брокеров, производя свои собственные финансовые продукты и сервисы. Клиентами этих сервисов являются представители Европы, Азии, Ближнего Востока, стран СНГ и России, совершая ежемесячно сделки объемом в 250 млрд долларов. Отличительной особенностью компании является абсолютная забота о своих сотрудниках: начиная от обеспечения виз и релокации и заканчивая корпоративным баром с соками, кофе и коктейлями. Вашей задачей будет: Работа в команде разработчиков финансовых инструментов, создание высоконагруженных и отказоустойчивых систем, внутренних продуктов с использованием современных технологий. От вас ожидают: Уверенное знание Python Знание PostgreSQL: сложные join, наследование таблиц, триггеры, оптимизация запросов Знание Linux на уровне разворачивания приложений и сервисов, сетевых протоколов Создание архитектуры баз данных, работа с большими объемами данных Участие в разработке HighLoad приложений, многопоточных приложений Организация и проведение unit-тестирования Проведение декомпозиции работ на задачи, оценка времени и сроков, определение критических точек. Плюсом будет следующий опыт: Опыт разработки с использованием Django Проектная работа в Jira, продвинутое использование Git WEB технологии: HTML, CSS, JavaScript, AJAX, DOM, jQuery, REST Опыт использования NoSQL Применение MapReduce Опыт разработки биллинговых систем, шлюзов для платёжных систем Участие в разработке мобильных клиент/сервер приложений Проведение нагрузочного тестирования Обязательно вам предоставят: Соразмерную опыту заработную плату Рабочую визу для сотрудника и визы для членов семьи Что вас ждет: Команда IT-профессионалов Сразу несколько интересных и сложных проектов Свобода в выстраивании собственного графика задач, главное - результат Понятные карьерные возможности: показатели и критерии профессионального роста Посещение профильных международных конференций И еще сверху много солидных плюшек: Корпоративный фитнес Оплачиваемая парковка 50% скидка на изучение английского и греческого языков Медицинская страховка на сотрудника и членов его семьи Частичное возмещение расходов на стоматологические услуги и услуги офтальмолога Полное покрытие расходов на прививки детям до 2 лет Занятия йогой на крыше офиса с шикарным видом на море Развлечения - корпоративные аквабайки, спортивные и семейные мероприятия, веселые корпоративные праздники и многое другое. Почему стоит обратиться к нам? ✓Прежде всего наши услуги бесплатны для кандидатов! ✓Мы более 10 лет занимаемся подбором IT-специалистов для крупнейших российских и международных компаний. А наш опыт по релокации новоиспеченных сотрудников за границу позволяет решать вопросы любого уровня сложности. ✓Мы сотрудничаем с десятками компаний по всему миру. Мы знаем все о них. Мы знаем все о странах, в которые они ищут своих будущих сотрудников. Мы знаем все тонкости процессов рекрутинга в каждой из них. ✓Мы умеем находить для них самых подходящих и по духу, и по техническим навыкам кандидатов. ✓ Мы можем предложить вам выбор вакансий и работодателей в разных странах. ✓И сможем помочь успешно трудоустроиться в той из них, которая больше всего нравится именно вам и на которую вы лучше всего подходите. ✓Нет, мы не занимаемся тем, что даем шпаргалки и решаем за кандидатов тестовые задания. Но скажем, как лучше подготовиться к прохождению собеседований и решению технических задач. Отправляйте отклик прямо сейчас!",Без требований,Без обязанностей,Без условий,Python|Linux|PostgreSQL|Unit Testing,24
478,478,python,Новосибирск,100714.28571428572,154000.0,БАРС Груп,2019-10-09T08:15:36+0300,От 1 года до 3 лет,Полный день,Полная занятость,"Мы хотим от кандидата: Опыт работы на Python и в Django; Опыт работы с реляционными СУБД: PostgreSQL, Oracle, MySQL; Знание JavaScript (приветствуется опыт в ExtJS) - хотя бы базовые; Базовые знания верстки(HTML/CSS) Желание работать над большими и интересными проектами с тысячами пользователей; Самостоятельность, ответственность, быстрая обучаемость. Мы используем в разработке: Django и ExtJS для реализации Rich Internet Application; Python для широкого круга задач: от скриптинга до реализации паттернов проектирования, DI, IoC и слабосвязных архитектур; Continuous Integration: Jenkins; Source control: git; Task tracking: Jira; Итерационный подход к выпуску релизов; Тестирование: unittest, behave, selenium, etc; ОС и IDE на выбор разработчика. Мы предлагаем: Комфортный офис ; Позитивная атмосфера, молодой коллектив; Широкие возможности профессионального и карьерного роста; Достойная оплата (готовы обсудить ваши пожелания); Надежный соц.пакет; Обучение: тренинги, мастер-классы внутри компании, возможность участия в крупных ИТ-конференциях, корпоративная библиотека. Компенсационный пакет для иногородних.",Без требований,Без обязанностей,Без условий,Python,9
1091,1091,python,Новосибирск,100714.28571428572,154000.0,БАРС Груп,2019-10-09T09:05:31+0300,От 1 года до 3 лет,Полный день,Полная занятость,"Мы хотим от кандидата: Опыт работы на Python и в Django; Опыт работы с реляционными СУБД: PostgreSQL, Oracle, MySQL; Знание JavaScript (приветствуется опыт в ExtJS) - хотя бы базовые; Базовые знания верстки(HTML/CSS) Желание работать над большими и интересными проектами с тысячами пользователей; Самостоятельность, ответственность, быстрая обучаемость. Мы используем в разработке: Django и ExtJS для реализации Rich Internet Application; Python для широкого круга задач: от скриптинга до реализации паттернов проектирования, DI, IoC и слабосвязных архитектур; Continuous Integration: Jenkins; Source control: git; Task tracking: Jira; Итерационный подход к выпуску релизов; Тестирование: unittest, behave, selenium, etc; ОС и IDE на выбор разработчика. Мы предлагаем: Комфортный офис ; Позитивная атмосфера, молодой коллектив; Широкие возможности профессионального и карьерного роста; Достойная оплата (готовы обсудить ваши пожелания); Надежный соц.пакет; Обучение: тренинги, мастер-классы внутри компании, возможность участия в крупных ИТ-конференциях, корпоративная библиотека. Компенсационный пакет для иногородних.",Без требований,Без обязанностей,Без условий,Python,9
893,893,python,Новосибирск,100714.28571428572,154000.0,Azoft,2019-10-14T06:48:21+0300,От 1 года до 3 лет,Гибкий график,Полная занятость,"В Отдел R&amp;D (Research&amp;Development) компании Azoft требуется увлеченный программист-исследователь, готовый к нестандартным и очень интересным задачам! Какими интересными вещами мы занимаемся: Пишем программы распознавания объектов в видеопотоке на смартфоне Тренируем нейронные сети на видеокарте Сервер распознавания текста на изображении Рекомендательная система для покупателей В общем делаем уже сейчас то что будет широко распространено в будущем Мы предлагаем: Возможность заниматься своим любимым делом, не отвлекаясь на сторонние задачи; Пространство для реализации своих профессиональных амбиций; Большую и дружную команду профессионалов; По-настоящему гибкий график работы; Достойный уровень заработной платы; Развитие сотрудников: семинары, конференции, English Забота о здоровье: 2 крутые команды - ИТ-футбол и ИТ-баскетбол, частичная компенсация абонементов в бассейн и фитнес-клубы Хороший отдых: совместные праздники и еженедельные Печенька-Party и сканворды Закрытую парковка: для автомобилей, велосипедов, самокатов, гироскутеров :) Нам нужен разработчик с: Знанием принципов машинного обучения, опытом работы с различными архитектурами нейронных сетей и пониманием принципов их работы Опытом в Python, в частности NumPy, OpenCV, Scikit-learn, Pandas Знанием SVM, PCA, kNN, Decision Trees, Ensembles (Bagging, Boosting, Random Forest) Опытом работы с фреймворками Tensorflow, Keras, Caffe, PyTorch Опытом применения разработанных алгоритмов на мобильных платформах (Android, iOS) Опытом работы с Git English уровня upper-intermediate Опытом разработки на С/С++ Будет плюсом наличие опыта в одном или нескольких пунктах: Опыт решения задач с использованием RL (Reinforcement Learning) Опыт работы с Flask, базовые знания HTML, CSS, JavaScript Опыт решения задач NLP Занятые места в соревнованиях по ML",Без требований,Без обязанностей,Без условий,Без ключевых навыков,4
956,956,python,Новосибирск,100714.28571428572,154000.0,NPM,2019-10-14T07:36:58+0300,От 3 до 6 лет,Полный день,Полная занятость,"NPM — современная российская компания с новейшим производственным комплексом, базирующаяся в городе Новосибирске. Компания специализируется на производстве оборудования для розлива пива, газированных напитков, чистой воды и молока. NPM — это инновационная компания, внедряющая в массовое производство свои собственные интеллектуальные разработки. На сегодня большинство выпускаемых NPM продуктов уникальны как в России, так и в мире. Описание проекта: На новый уникальный проект в сфере Internet of Things (IoT, интернет вещей) по интернетизации оборудования по розливу напитков (до 3 млн. девайсов только в России) компания NPM приглашает в компанию Python разработчика Мы ждем от кандидатов: - Опыт от 3-х лет - Владение Python на высоком уровне - Знание ООП и паттернов проектированияы - Опыт написание и применения автотестов - Опыт работы с БД Задачи: Проектирование и разработка back-end сервиса для IoT платформы (в перспективе высокие нагрузки) Работа и оптимизация данных в БД Обучение, найм и формирование команды Python разработчиков Плюсом будет: Знакомство с JavaScript Преимущества работы у нас: Работа в современной, активно развивающейся Компании мирового уровня в команде профессионалов. Возможность реализации своих знаний и навыков в инновационных проектах. Возможность повышения уровня компетенций за счет обучения в Компании. Удобное расположение офиса — 10 минут от крупных транспортных развязок правого и левого берегов. Официальное трудоустройство согласно ТК РФ. Конкурентный, полностью декларируемый уровень заработной платы. Для участия в конкурсе необходимо откликнуться на вакансию. Резюме рассматривается не более 7 дней. В случае, если Вам не ответили в течение двух недель, был выбран другой кандидат. Но мы всегда открыты для новых интересных идей и людей, поэтому каждый кандидат попадает в нашу базу и рассматривается в случае появления аналогичной вакансии.",Без требований,Без обязанностей,Без условий,Python|JavaScript|ООП,4
1080,1080,python,Новосибирск,100714.28571428572,154000.0,БАРС Груп,2019-10-08T13:43:07+0300,От 1 года до 3 лет,Полный день,Полная занятость,"Приглашаем на вакансию Python разработчика! Мы ищем Ответственного человека, профессионала способного создавать качественное программное обеспечение и делиться своим опытом и знаниями с коллегами, заинтересованного в совершенствовании собственных профессиональных навыков, общительного и нацеленного на командную работу. Мы предлагаем Работу в крупной компании; Более 1200 сотрудников в офисах Новосибирска, Казани, Иннополиса, Москвы и Санкт-Петербурга. Интересные задачи; Разработка, пожалуй, лучших продуктов в социально значимой сфере образования, таких как: -Электронный детский сад -Электронная школа -Электронный колледж -Электронное дополнительное образование -Одаренные дети Более 70 инсталляций в разных регионах России, развернутых более чем на 200 серверах. Комфортный офис в самом центре города с удобной транспортной развязкой в бизнес-центре класса &quot;А&quot; на ул. Вокзальная магистраль; В офисе есть кухня с холодильниками, микроволновками, столами и стульями, зерновая кофе машина; Кроме этого в шаговой доступности от офиса большое количество кафе с демократичными ценами и вкусными горячими обедами; Официальная зарплата, греющая тело и душу (2 раза в месяц вы будете получать аванс и расчет); Мы предоставляем на выбор зарплатные проекты самых передовых банков: Альфа-банка, ВТБ, Сбербанка. Это не только удобный интернет-банк, но и возможность использования привлекательных предложений банка для зарплатных клиентов; Широкие возможности профессионального роста (возможность расти и добиваться новых карьерных высот благодаря системе полугодовых аттестаций); Программа адаптации, постановка личных целей на испытательный срок и в последующем на каждые полгода, периодическое подведение итогов и корректировка целей; Комфортные условия для переезда (мы предоставим для проживания корпоративную квартиру на первый месяц работы, поможем с выбором жилья и знакомством с городом); Яркую корпоративную жизнь; ДМС. Без преувеличения. РАССМАТРИВАЕМ КАНДИДАТОВ РАЗНЫХ УРОВНЕЙ. Мы ожидаем от Вас: Опыт коммерческой разработки на Python; Навыки оптимальной работы с реляционными СУБД; Знание JavaScript (приветствуется опыт в ExtJS); Знания типовых архитектурных решений и принципов ООП/ООД; Навыки в рефакторинге и оптимизации кода, проектирования БД, декомпозирования задач. Мы используем в разработке: Django и ExtJS для реализации Rich Internet Application; Python для широкого круга задач; Continuous Integration: Jenkins; Source control: git; Task tracking: Jira; Итерационный подход к выпуску релизов; Тестирование: unittest, behave, selenium, etc; ОС и IDE на выбор разработчика. «БАРС Груп» – крупный российский разработчик и интегратор облачных систем управления. Компания специализируется в реализации комплексных IT-проектов для государственных и корпоративных заказчиков по всей России. В арсенале «БАРС Груп» – более 70 информационно-аналитических решений для образования, здравоохранения, сельского хозяйства, ЖКХ, энергетики, социальной защиты, управления государством, регионами, муниципалитетами, финансами, имуществом и т.д. Также в числе направлений деятельности – производство мобильных приложений и порталов.",Без требований,Без обязанностей,Без условий,Python|Django Framework|JavaScript|PostgreSQL,10
