,Unnamed: 0,name,area,min_salary,max_salary,employer,published_at,experience,schedule,employment,description,requirements,duties,conditions,key_skills,days
467,467,python,Новосибирск,100714.28571428572,154000.0,Яндекс,2019-10-14T15:42:59+0300,Нет опыта,Гибкий график,Стажировка,"Яндекс ищет стажера для разработки проекта &quot;Кабинет разработчика&quot;. Этот сервис отвечает за авторизацию и аутентификацию клиентов, контроль лимитов и тарификацию различных API Яндекса. Текущая нагрузка - 5000 RPS. Вам предстоит: принимать участие в проектировании и доработке высоконагруженной распределенной системы; расширять функционал под новые требования; повышать надежность и пропускную способность сервиса. Требования: знание и понимание алгоритмов и структур данных; владение языком программирования Python; опыт работы с MongoDB, Oracle (будет преимуществом); хорошие аналитические способности, аккуратность и внимание к деталям. ​​ Условия: стажировку длительностью 3-4 месяца; гибкий график работы (от 30 до 40 часов в неделю); достойный уровень заработной платы; работу в просторном и современном офисе; компенсацию питания в ближайших к офису кафе и ресторанах."," знание и понимание алгоритмов и структур данных; владение языком программирования Python; опыт работы с MongoDB, Oracle (будет преимуществом); хорошие аналитические способности, аккуратность и внимание к деталям. ​​ ",Без обязанностей, стажировку длительностью 3-4 месяца; гибкий график работы (от 30 до 40 часов в неделю); достойный уровень заработной платы; работу в просторном и современном офисе; компенсацию питания в ближайших к офису кафе и ресторанах.,Python|MongoDB,4
818,818,python,Новосибирск,100714.28571428572,154000.0,Центр финансовых технологий,2019-10-10T06:03:43+0300,От 1 года до 3 лет,Полный день,Полная занятость,"В нашей компании активно развивается направление Machine Learning, и в Новосибирске уже работает сильная команда. Ребята делают следующие проекты для различных продуктовых линий компании: прогнозирование спроса; идентификация пользователей; выявление аномалий; распознавание голоса, изображений; рекомендации; чат-бот. В отделе есть три направления работ: Data Science, инженерия данных, разработка. Разработка , кроме выкатки ML-моделей, занимается созданием и поддержкой своих сервисов/систем: система валидации данных клиента; система учета клиентских данных; сервисы с бизнес логикой; сервисы, реализующие логику с А/Б тестированием. Наш стек: разрабатываем микросервисы на asyncio python3.6+, собираем сервисы в докер контейнеры с помощью Gitlab CI и деплоим в kubernetes. В командах налажен процесс code review, написания unit/integration тестов. Код пишем по GitFlow, валидируя линтером. Задачи, которые предстоит решать программисту python : разработка сервисов и систем; выкатка МЛ моделей в production. Мы ожидаем от будущего коллеги: опыт в python backend разработке от 2-х лет; опыт в разработке и проектировании асинхронных распределенных систем; production опыт с sql и nosql базами данных на уровне построения схем и оптимизации запросов; опыт работы в команде (gitflow, code review); опыт работы с CI/CD + K8S или желание изучить Gitlab CI. Мы предлагаем: официальное трудоустройство, полный социальный пакет; современный офис с отличной столовой, уютной кофейней, с велопарковкой и даже магазинчиком интересных корпоративных вещей; заботу о здоровье: программы ДМС и собственный медицинский кабинет; возможность профессионального развития: обучение в ведущих учебных центрах страны, участие в различных конкурсах, митапах и завтраках ODS вместе с командой, участие в конференции Data Fest, возможность посещать конференции заграницей; возможность реализовать себя в любой области машинного обучения; вдохновляющую корпоративную культуру: весёлые праздники, творческую атмосферу, живое общение во внутренней социальной сети; скидки, бонусы на различные услуги и многое другое. доставку корпоративным транспортом (правый/левый берег г. Новосибирска, г. Бердск, р.п. Кольцово) в наш офис в Академгородке; возможность работать в городском офисе, ул. Нижегородская (станция метро «Октябрьская»).",Без требований,Без обязанностей,Без условий,Python|Git|Gitlab|CI/CD|K8S|Docker,8
139,139,python,Новосибирск,110000.0,154000.0,Jar Soft,2019-10-13T07:15:43+0300,От 1 года до 3 лет,Гибкий график,Полная занятость,Несколько лет мы работаем над системой показа рекламы для крупного иностранного заказчика. Система позволяет обрабатывать до 1 млн запросов в секунду. Очень важной частью системы является предсказание поведение пользователя на основе моделей машинного обучения. Здесь активно используется Python. Наши задачи: 1. Построение pipeline обработки данных 2. Интеграция готовых моделей машинного обучение в продакшн. 3. Разработка инструментов разработчика для оптимизации моделей машинного обучение. 4. Разработка сервиса мониторинга работы моделей Мы ожидаем от кандидата: Уверенное знание языка Python Опыт развертки и поддержки Python приложений Опыт работы с SQL/NOSQL БД. Знание алгоритмов и структур данных Большим плюсом будет являться: Опыт с AWS Знание основ машинного обучения. Опыт работы с инструментами BigData Мы предлагаем: Работа в комфортном и современном офисе в технопарке Академгородка; Мощное железо; Помощь иногородним при переезде.,Без требований,Без обязанностей,Без условий,Python|ML|SQL,5
993,993,python,Новосибирск,120000.0,150000.0,Группа компаний Фарадей,2019-10-01T10:50:20+0300,От 3 до 6 лет,Полный день,Полная занятость,"Обязанности: Разработка высоконагруженного телеграм бота, программист python. Требования: Опыт разработки на Python не менее 3 лет; Опыт работы с Django от 2-х лет Хорошее знание Django ORM; Хорошее знание Git, PostgreSQL; Опыт работы с asyncio/aiohttp; Условия: Работа 5/2, с возможностю брать дни на удаленку Карьерный рост Бонусы"," Опыт разработки на Python не менее 3 лет; Опыт работы с Django от 2-х лет Хорошее знание Django ORM; Хорошее знание Git, PostgreSQL; Опыт работы с asyncio/aiohttp; "," Разработка высоконагруженного телеграм бота, программист python. "," Работа 5/2, с возможностю брать дни на удаленку Карьерный рост Бонусы",Git|PostgreSQL|Django Framework|Redis|Python3.7|AIOgram,17
282,282,python,Новосибирск,160000.0,243000.0,Тензор,2019-09-23T09:56:12+0300,От 3 до 6 лет,Гибкий график,Полная занятость,"Тензор – крупная российская IT-компания. Наш основной продукт – СБИС – сеть деловых коммуникаций. СБИС объединяет людей и компании, системы управления и учета, бизнес-процессы и документы в одной системе. Систему СБИС придумали, создали и постоянно совершенствуют более 1000 разработчиков в 11 филиалах по стране. У нас есть фанаты дата-майнинга, эксперты в разработке кроссплатформенных приложений и высоконагруженных систем, разработчики мобильных, настольных и веб-приложений, специалисты по обработке, анализу и хранению больших массивов данных. На позиции ведущего программиста вы будете заниматься не просто кодированием, а управлением кодом, проектированием архитектуры систем. Причем не только и не столько своими руками, сколько руками команды. Вы сможете попробовать применить на практике любые методики управления, но от вас всегда будет требоваться результат. Чтобы руководить разработкой вы должны быть сами отличным разработчиком. И всегда стремится изучать новое. Вам предстоит: разрабатывать распределенные высоконагруженные информационные системы; разрабатывать объекты бизнес-логики и эффективные методы для доступа к данным; оптимизировать скорость обращения к данным. Мы ждем от Вас: владение Python на высоком уровне; знание ООП; знание паттернов проектирования и умение их применять; опыт работы с базами данных; Плюсом будет: знакомство с HTML, CSS, JavaScript. Мы предлагаем: заработную плату в зависимости от квалификации и уровня ответственности; премии от 5 до 20% по итогам работы за месяц; корпоративное обучение; перспективы карьерного и профессионального роста; ДМС после года работы в компании ; курсы английского языка; корпоративные праздники и различные совместные мероприятия, спортивные программы.",Без требований,Без обязанностей,Без условий,Без ключевых навыков,25
