,Unnamed: 0,name,area,min_salary,max_salary,employer,published_at,experience,schedule,employment,description,requirements,duties,conditions,key_skills
224,224,frontend разработчик,Новосибирск,,,Брокеркредитсервис,2019-10-08T07:32:51+0300,От 1 года до 3 лет,Гибкий график,Полная занятость,"Нам нужен человек для усиления команды front-end разработки. Основные задачи - это верстка новых страниц и сайтов по БЭМ, доработка текущих сайтов и компонентов. Верстки много, как новой, так и текущих проектов. Кроме сайтов верстаем также письма на MJML, сами настраиваем сборщики Gulp и WebPack. Задачи очень разные: от поддержки legacy-кода до внедрения новых технологий. Ждем от тебя: Отличное владение HTML/CSS; Опыт работы с препроцессорами Stylus и LESS; Опыт верстки email-рассылок будет плюсом; Глубокие знания чистого JavaScript и отличия в стандартах; Знание React.js или желание быстро освоить; Опыт настройки сборщиков Gulp или WebPack; Приветствуется опыт работы с Node.js. Что от нас: Оформление согласно ТК РФ; Конкурентная заработная плата; Расположение офиса - м. Площадь Ленина; Гибкое начало дня, есть возможность сдвинуть рабочие часы, чтобы трудиться эффективнее; ДМС (по льготным условиям); Льготное приобретение фитнеса в компаниях World Class, фитнес-клуб Европа, X-FIT; Отсутствие дресс-кода; Вечерние занятия в танцевальной студии; Спортивные команды по футболу, волейболу, баскетболу.",,,,JavaScript|Less|CSS|HTML|Node.js
473,473,frontend разработчик,Новосибирск,,,Тувэтрейд Технолоджи,2019-10-10T14:24:05+0300,От 1 года до 3 лет,Полный день,Полная занятость,"2WTRADE — компания-революционер в сфере е-Commerce. Мы берем на себя управление доставками по миру — предоставляем услуги по доставке и управлению всем процессом: от заказа в интернет-магазине до получения товара клиентом. Команда 2WTRADE, это более 1500 единомышленников в более чем 20 странах по всему миру. Благодаря нашим пользователям компания стала самой большой и самой успешной компанией е-Commerce в Латинской Америке, Африке и Юго-Восточной Азии. В связи с активным расширением бизнеса и ростом пула задач мы приглашаем Вас присоединиться к нашей команде в Новосибирске. Требования к кандидату: отличные знания html, css, js; опыт работы с Vue, nuxt; понимание работы Http; плюсом будет опыт back-end разработки, nodejs. Обязанности: продуктовая разработка проработка задач с первых этапов, декомпозиция, кодинг, отслеживание результатов; разработка и поддержка проектов на vue.js. Условия: возможность получить опыт/реализовать себя в международной digital компании с интернациональной командой в проектах от Америки до Китая; корпоративные занятия английским языком и возможность использовать язык в работе (наши коллеги в других странах говорят на английском); возможность посещать профильные внешние конференции по всему миру; комфортные условия работы в одном из наших офисов г. Новосибирска, по улице Коммунистическая улица, м. Площадь Ленина; гибкий график: возможность расстаться с утренними пробками; официальное трудоустройство с первого дня по ТК РФ.",,," возможность получить опыт/реализовать себя в международной digital компании с интернациональной командой в проектах от Америки до Китая; корпоративные занятия английским языком и возможность использовать язык в работе (наши коллеги в других странах говорят на английском); возможность посещать профильные внешние конференции по всему миру; комфортные условия работы в одном из наших офисов г. Новосибирска, по улице Коммунистическая улица, м. Площадь Ленина; гибкий график: возможность расстаться с утренними пробками; официальное трудоустройство с первого дня по ТК РФ.",JavaScript|CSS|HTML|HTTP
550,550,frontend разработчик,Новосибирск,,,БрэндМэйкер.ру,2019-10-04T11:40:35+0300,От 3 до 6 лет,Гибкий график,Полная занятость,"&quot;БрэндМэйкер.ру&quot; — Новосибирский филиал международной компании BrandMaker GmbH (Германия), производящей и продвигающей на рынок одноименный программный продукт - BrandMaker. Офисы компании расположены в Германии, России, Болгарии, США, Польше, Великобритании, отделы разработки находятся в трех странах — Германии, России и Болгарии. Что такое BrandMaker? BrandMaker - это продукт класса MRM (Marketing Resource Management) систем, предназначенный для управления маркетинговой деятельностью в крупных, территориально распределенных компаниях. BrandMaker - модульное решение, которое оптимизирует всю цепочку процессов в маркетинге, автоматизирует рутинные операционные задачи с целью увеличения маркетинговой продуктивности мероприятий и организации в целом. Продается на рынке с 2004 года. Какие мы ставим перед собой задачи? Эффективное решение задач во всех областях — от повышения производительности на всех уровнях до обеспечения максимальной безопасности приложения. Технологическое и функциональное усовершенствование существующего кода Кого мы ищем? Frontend-разработчика готового расти вместе с нами, который готов каждый день решать новые задачи, и не забывать про legacy. Технические требования к кандидату: Знание современных версий: html, css, js. Не менее 3-х лет работы с применением современных js фреймворков. Умение работать с системой контроля версий Git. Умение проектировать современные UI. Уверенные навыки кроссбраузерной и адаптивной верстки. Умение оценивать трудоемкость и сроки выполнения задач. Обязателен опыт работы в команде от 3-х лет. Мы приветствуем стремление наших сотрудников к развитию и предоставляем возможность профессионального и карьерного (в том числе за рубежом) роста. Новые идеи и их реализация это то, что ждут от нас заказчики и руководство компании. Мы предлагаем: Обширное поле для профессионального развития и изучения широкого стека технологий, возможность применять и внедрять новые технологии. &quot;Белая&quot; зарплата по итогам собеседования. Гибкий график работы. Командировки в Германию и Болгарию, участие в международных конференциях. Дружный коллектив. Офис в центральном районе Новосибирска с отдельной парковкой. Бесплатные курсы английского и немецкого с частным преподавателем. Компенсация спортивных занятий. Кофе, печенье, фрукты и бутерброды в течении дня ;) Если Вам интересно работать в команде профессионалов и развиваться в международной компании, высылайте резюме - будем рады встретиться с Вами!",,,,
660,660,frontend разработчик,Новосибирск,,,ANCOR FinTech,2019-10-14T07:14:04+0300,От 1 года до 3 лет,Полный день,Полная занятость,"Российская транснациональная компания, владеющая одноимённой системой поиска в Сети, интернет-порталами и службами в нескольких странах объявляет конкурс на позицию Frontend-разработчика в городе Екатеринбург. !!! Для кандидатов, готовых к переезду из других городов есть релокационный пакет. Чем предстоит заниматься? разрабатывать интерфейсные компоненты (инфраструктура и веб-интерфейсы); разработкой клиентской логики на JavaScript; визуализацией данных, дизайном, версткой; поддержкой существующих сервисов (react, redux, backbone); работой на прототипами и интерфейсами для внутренних аналитических инструментов. Вы подходите, если обладаете: опытом в промышленной разработке на JS; знаете Node.js и ES6; хорошим знанием HTML/CSS; умением работать с Git. Компания предлагает: полное соответствие ТК РФ, &quot;белый&quot; заработок; расширенный социальный пакет (ДМС со стоматологией с первого рабочего дня и др.) релокация для иногородних; регулярный пересмотр уровня дохода; постоянное обучение, развитие скиллов; дотации на питание; активная и интересная корпоративная жизнь; комфортный современный офис в центре Екатеринбурга.",,,,JavaScript|Node.js|CSS|Git|HTML
839,839,frontend разработчик,Новосибирск,,,AT Consulting,2019-10-09T06:34:14+0300,От 1 года до 3 лет,Полный день,Полная занятость,"AT Consulting - крупнейший поставщик услуг в сфере информационных технологий. Компания основана в 2001 году и сегодня занимает лидирующие позиции на рынке ИТ-услуг в России и СНГ. Наш профиль: внедрение и сервисная поддержка сложных информационных систем, управленческий и операционный бизнес-консалтинг, разработка ПО на заказ и ИТ-аутсорсинг. Основная деятельность нашего новосибирского подразделения - разработка и внедрение программной платформы SMART CITY CLOUD. Платформа осуществляет сбор, анализ и накопление данных для управления городом. Использование данных и аналитика позволяют создавать новые сервисы для повышения безопасности граждан и улучшения качества жизни. Мы охватываем такие направления как : Скорая медицинская помощь; МЧС; Сервис по обнаружению лесных пожаров; Система прогнозирования чрезвычайных случаев; Сервис по отслеживанию транспорта; Автоматизация call-центров; Командные центры администраций регионов и многое другое. У тебя будет реальная возможность участвовать в спасении жизней людей! Наша команда разработчиков ждет тебя, если: Разработка веб-приложений на JS - твоя стихия; Ты готов взять на себя ответственность за бизнес-направление; Воплощаешь в жизнь грамотные технические решения; Знаешь как использовать последний Angular и Material; Способен сверстать на html и css по макету вменяемый интерфейс; Привык гордиться полученным результатом. Для твоего комфорта: Команда профессионалов, где каждый увлечен своим делом и готов поделиться экспертизой, а также возможность нести новые знания и технологии; Работа в гибкой методологии разработки; Безграничная прокачка скиллов; Разделение труда: аналитики, ДевОпс&#39;ы, тестировщики, разработчики, проект-менеджеры; ДМС (стационар, стоматология, услуги поликлиник), 50% мультикарта в любой фитнес-клуб города и компенсация мобильной связи. Конечно же официальное трудоустройство и белая зп; Просторный и уютный офис в центре города с кухней и комнатой отдыха; Поездки на конференции и тренинги, внутренние семинары, внутренние митапы, мы очень любим учиться новому; Корпоративная культура с своими ценностями и традициями, в которой каждый чувствует себя частью корабля! Работа в крупной и стабильной IT-компании (18 лет в России и 8 лет в Новосибирске); Процедура оценки персонала дважды в год, результатом которой является программа индивидуального развития каждого сотрудника и получение обратной связи (с возможностью карьерного и зарплатного роста).",,,,
