,Unnamed: 0,name,area,min_salary,max_salary,employer,published_at,experience,schedule,employment,description,requirements,duties,conditions,key_skills
719,719,php developer,Новосибирск,60000.0,100000.0,Meta CPA,2019-09-18T12:31:40+0300,От 3 до 6 лет,Полный день,Полная занятость,"Компания Meta CPA ищет в свою команду веб-разработчика на PHP. Основной продукт, над которым предстоит работать - CRM система собственной разработки на Yii framework с модулями на Go+Redis и PHP+Click House. Рассмотрим кандидатов разного уровня, от middle до senior Обязанности: разработка проектов для внутреннего использования создание и поддержка API автоматизация всего, что можно автоматизировать Требования: уверенное знание PHP MySQL, проектирование баз данных, оптимизация запросов, индексация опыт работы с фреймворками Yii или Yii2 понимание принципов ООП желание создавать эффективный софт Будет плюсом: знакомство с Golang, Redis и/или ClickHouse администрирование linux опыт работы по Agile Условия: гибкий график работы трудоустройство по ТК РФ чай, кофе, печеньки множество интересных задач пинг-понг и настольные игры в офисе"," уверенное знание PHP MySQL, проектирование баз данных, оптимизация запросов, индексация опыт работы с фреймворками Yii или Yii2 понимание принципов ООП желание создавать эффективный софт Будет плюсом: знакомство с Golang, Redis и/или ClickHouse администрирование linux опыт работы по Agile "," разработка проектов для внутреннего использования создание и поддержка API автоматизация всего, что можно автоматизировать "," гибкий график работы трудоустройство по ТК РФ чай, кофе, печеньки множество интересных задач пинг-понг и настольные игры в офисе",PHP|Git|MySQL|Nginx|Yii|Redis|Linux
961,961,php developer,Новосибирск,80000.0,200000.0,Геймгард,2019-10-12T19:54:43+0300,От 1 года до 3 лет,Полный день,Полная занятость,"Legionfarm - это крупнейшая платформа для найма профессионалов в виртуальных мирах. Тысячи пользователей из 48 стран ежедневно пользуются нашим сервисом для обучения и совместной игры с экспертами в онлайн играх на ПК и консолях, а также в VR. У нас сильная команда, состоящая из 70+ человек. И сейчас мы объявляем конкурс на позицию PHP разработчика. Чем предстоит заниматься? Будем ходить в API игр, анализировать игровые профили наших клиентов, строить рекомендательные системы. Автоматическая отправка сообщений через API в мессенджеры: discord, telegram, fb, будем сводить общение наших клиентов через мессенджеры в единую систему intercom.com. Автоматизация процессов в нашей команде (полуавтоматизированные инструменты для работы с сайтом). Инфраструктурные задачи (переделать текущую структуру хранения данных, добавлять новые структуры, настраивать взаимодействие между моделями в ORM). Что ты должен знать/уметь? Знание PHP на хорошем уровне. Знание Linux. Понимание работы протоколов передачи данных, ООП. Умение работать в системах контроля версий. Знание mysql, redis. Опыт работы с различными API. Что будет твоим преимуществом перед другими кандидатами? Сильный математический бэкграунд. Базовое знание html, CSS, JavaScript. Опыт работы с фронтенд фреймворками. Что мы предлагаем? В зависимости от твоих текущих навыков по результатам собеседования ты можешь рассчитывать на зарплату от 80 000 до 200 000. Возможность работать как из офиса, так и удаленно. Работу в уютном и современном лофт-офисе недалеко от центра - м. Парк Культуры. Вся инфраструктура - рукой подать. Корпоративный английский язык, тренинги, мероприятия с коллегами и прокачку своих скиллов. Мы следим за модными тенденциями, поэтому чай, кофе, сахар и даже сахарозаменитель - ждут тебя на кухне за барной стойкой Почему мы? У нас крутая команда. Мы отлично работаем, но и толк в отдыхе знаем. Твои коллеги будут твоими друзьями! Мы создаём профессию будущего - геймер. Мы хотим, чтобы сотни миллионов игроков по всему миру получили возможность официально зарабатывать деньги в играх.",,,,PHP|Linux|Протоколирование|Базы данных|ABC-анализ|ABC analysis|MS SQL|Redis|API|HTML|CSS|JavaScript|MySQL|frontend|SQL|jQuery|Facebook API|Автоматизация процессов|Автоматизация продаж|Аналитические исследования|Маркетинговые исследования
180,180,php developer,Новосибирск,,,Plesk,2019-10-09T08:30:42+0300,От 3 до 6 лет,Полный день,Полная занятость,"Plesk – контрольная панель для автоматизации администрирования сервера. Plesk широко применяется для администрирования web хостинга, поскольку позволяет свести операции по настройки веб-сервера к простым операциям в контрольной панели. Plesk может быть установлен на Linux и Windows сервера. Plesk состоит из почти 1M строк кода, и развитие такого большого продукта просто невозможно без автоматического регрессивного тестирования. В настоящий момент мы активно перестраиваем наше автоматическое тестирование, чтобы обеспечить максимально быстрый цикл тестирования билдов. Это требует постоянного развития существующих тестовых фреймворков и тестовых сервисов, а так же создание новых. Задачи: Развитие инфраструктуры CI/CD (Jenkins, Docker). Разработка и поддержка тестовых фреймворков. Разработка, внедрение и поддержка внутренних сервисов связанных с тестированием (test-executor, test-data, selenium, etc.) Требования: Опыт работы от 3-х лет Обязательно: Уверенное знание языка программирования PHP Знание принципов ООП Понимание принципов Twelve-Factor App Умение писать юнит-тесты и функциональные тесты Опыт командной работы (Git, code review, issue tracker) Умение работать с legacy кодом Опыт работы с Docker Знание английского на уровне чтения и написания технической документации Желательно: Опыт работы с Jenkins Опыт работы с Ansible Опыт работы с Prometheus, Grafana Опыт разработки тестовых фреймворков Знание языка программирования Go Пара слов о том, как мы работаем: Используем современный стек технологий Отправляем разработчиков прокачивать свои навыки на профессиональных конференциях в столицы и за рубеж Даем возможность разрабатывать и внедрять собственные фичи в узаконенный Research Day и делиться полученными знаниями с коллегами на регулярных Tech Talks Помогаем совершенствовать разговорный английский с лучшими преподавателями - бесплатно, на территории офиса. Поддерживаем в релокации: выплачиваем безвозмездный бонус за переезд в размере одного оклада в первые 2 недели работы",,,,PHP|Unit Testing|Docker
569,569,php developer,Новосибирск,,,SIBERS,2019-10-13T07:22:39+0300,От 1 года до 3 лет,Гибкий график,Полная занятость,"Ждём знакомства с PHP–разработчиками в нашу команду. Вам предстоит работать над очень разнообразными web‐проектами в сплочённой и сильной команде. Мы ждём от Вас интереса к работе и желание развиваться, обещая со своей стороны прозрачные перспективы профессионального роста, комфортные условия работы и весёлую команду. Требования: График работы: полный рабочий день; Опыт работы: от 1 года; Работа в центре Новосибирска и Новосибирского Академгородка . Необходимые навыки: Знание PHP, опыт работы с PHP 5+, PHP 7; Знание SQL (ANSI SQL, MySQL диалект), опыт работы с MySQL 5+; Практическое применение ООП; Знакомство с паттернами проектирования (концепция MVC, наиболее распространённые паттерны); Опыт работы с фреймворками, например, с Zend Framework, Symfony2+; Владение jQuery; Пользовательский опыт в среде *nix; Знание английского языка на уровне чтения технической документации и написания комментариев к коду. Желательные: Знакомство с какими‐либо распространенными CMS — системами управления контентом (Drupal, Joomla!, WordPress); Опыт работы со смежными технологиями: XML технологии (SOAP, XML-RPC), работа с объектной моделью документа AJAX – JSON, JSONP Опыт вёрстки: HTML (XHTML), CSS; Опыт использования систем контроля версий (GIT); Опыт работы в команде. Всем нашим сотрудникам мы предоставляем: Участие в интересных и разнообразных проектах для иностранных заказчиков; Семинары, сертификации и карьерный рост; Стабильную заработную плату и ежемесячные бонусы; Бесплатные курсы английского языка; Множество корпоративных мероприятий; Организованные спортивные тренировки: баскетбол, футбол, волейбол, настольный теннис, сноуборд и горные лыжи; Льготные обеды; Молодой дружный и приветливый коллектив!",,,,
746,746,php developer,Новосибирск,,,АйТи Мегастар,2019-10-14T16:19:03+0300,От 1 года до 3 лет,Гибкий график,Полная занятость,"Megastar — команда из более чем 50 специалистов, которая знает как делать IT/digital - продукты, предназначенные как для широкой, так и узкоспециализированной аудитории. Лидеры внутренних команд компании — истинные профессионалы, контролирующие выполнение задач и отвечающие за здравый смысл в разработке. К каждой задаче мы относимся как к продукту, думая не только о её прямом выполнении, но и стараемся заложить собственную экспертизу, в том числе и в её постановку. Мы делаем всё от нас зависящее, чтобы определить реальные цели наших партнеров и достичь их оптимальным способом.Наши ключевые ценности- компетентность, ответственность, гибкость и клиенториентированность. В связи с расширением, приглашаем в нашу команду PHP developer. Мы предлагаем: оформление по ТК РФ; гибкий график; команды профессионалов, искренне заинтересованных в развитии проектов, с продуктовым подходом; интересные проекты различной сложности; возможность профессионального и карьерного роста до Team/Tech Lead; достойный уровень заработной платы (обсуждается на собеседовании); безлимит чай, кофе, печеньки,корпоративы; удобная парковка с большим количеством парковочных мест; комфортные, стильные офисы в Новосибирске и Академгородке. Необходимые навыки: опыт разработки backend от 3 лет; уверенное знание PHP; опыт использования REST API; опыт работы с любой из реляционных баз данных (Postgresql, MySql) и key-value хранилищами (Redis, MemCached); опыт интеграции с внешними сервисами; знание основных паттернов и алгоритмов; умение работать с GIT; уверенное использование командной строки linux; английский на уровне чтения технической документации (intermediate); умение работы в команде. Будет плюсом: знания систем виртуализации и контейнеризации; Чем предстоит заниматься: разработка backend части приложений с нуля и доработка существующих; архетиктура баз данных; деплой приложений на тестовый и боевой сервер; настройка систем логирования. Даже если Вы не нашли какой -то пункт у себя в резюме, мы все равно будем рады познакомиться и рассмотреть Вашу кандидатуру, поэтому смело откликайтесь, даем обратную связь! В случае, если мы не ответили Вам в течение 14 календарных дней, значит мы пока не можем предложить Вам дальнейшее взаимодействие и сотрудничество. Но! Мы сохраняем отклик на перспективу, на будущие проекты. «Отправляя резюме на данную вакансию, Вы тем самым подтверждаете свое согласие на сбор, систематизацию, накопление, хранение, уточнение, использование, передачу, обезличивание, блокирование, уничтожение своих персональных данных в соответствии с п.3 ч.1 ст.3 Федерального закона от 27.07.2006г № 152-ФЗ «О персональных данных»",,,,PHP|Laravel|Yii|PostgreSQL|MySQL|Linux|Git
