,Unnamed: 0,name,area,min_salary,max_salary,employer,published_at,experience,schedule,employment,description,requirements,duties,conditions,key_skills,days
955,955,c++,Новосибирск,97600.0,147000.0,Форвард,2019-10-15T14:28:28+0300,От 1 года до 3 лет,Полный день,Полная занятость,"Группа компаний Форвард – лидер в области разработки программных и аппаратных симуляторов автомобилей и различной спецтехники, а также программного обеспечения для теоретического обучения вождению, безопасности дорожного движения и т.д. Мы – увлеченная команда профессионалов, разрабатываем и применяем игровые технологии для создания высококачественных и реалистичных продуктов, которые помогают обучать специалистов и пользователей по всему миру. Наша продукция поставляется как по всей России, так и за рубеж – в США, различные страны Европы и т.д. Приглашаем стать частью нашей команды! Вас ждет: Разработка программных симуляторов для тренажеров управления техникой, а также для домашнего использования; Решение широкого спектра нестандартных задач в сфере симуляции виртуальной среды, максимально приближенной к реальности; Решение задач в области виртуальной реальности – Oculus Rift, SteamVR и т.д.; Повышение реализма и технических возможностей графической системы, создание новых эффектов; Развитие и выведение на новый уровень системы искусственного интеллекта для управления потоками автомобилей и пешеходов в городской обстановке; Развитие интеграции автосимулятора для домашнего использования со Steam; Создание физических моделей сложной техники и ее взаимодействия с окружающим миром на основе движка Havok Physics; Разработка уникального внутреннего инструментария, позволяющего создавать программное обеспечение, не имеющее аналогов в своей области. Нам интересно Ваше: Уверенное знание C++, STL; Принципы и методы ООП; Линейная алгебра и аналитическая геометрия; Технический английский (чтение документации). Будет плюсом: Опыт профилирования и оптимизации алгоритмов; Опыт программирования 3D графики (DirectX, OpenGL), работы с графическими «движками», а также с игровыми «движками» - Unreal Engine, Unity и т.д.; Опыт работы с инструментами: Microsoft Visual Studio, SVN/Git или другая CVS, Redmine или другая bugtracking-система; Опыт разработки сетевых приложений; Знание методов искусственного интеллекта; Опыт разработки архитектуры промышленных проектов; Опыт работы с библиотекой Boost, со скриптовыми языками Lua, Python; Опыт работы с .NET и C#, с SQL и БД; Интерес к автомобильной тематике. Мы предлагаем: Молодой, профессиональный, дружелюбный коллектив; Комфортный офис в центре города, 5 минут от метро «Гагаринская»; Опытные коллеги и наставники; Удобное и современное рабочее место; Официальное трудоустройство, белая зарплата; Возможность совмещения работы с учебой; Профессиональный и карьерный рост; Доступ к современному VR-оборудованию, игровым рулям и т.д.; Возможность участия в семинарах и тренингах; Кухня с кофемашинами, разными «вкусняшками» для всегда позитивного настроения; Компенсация занятий спортом. Уровень заработной платы определяется по результатам собеседования.",Без требований,Без обязанностей,Без условий,C++|STL|ООП|MS Visual Studio|Линейная алгебра и аналитическая геометрия,3
1031,1031,c++,Новосибирск,97600.0,180000.0,Кадровое агентство Алексея Сухорукова,2019-10-14T09:09:49+0300,От 1 года до 3 лет,Полный день,Полная занятость,"Исследовательское подразделение крупной американской компании, основанной около 30 лет назад и являющейся технологическим лидером в области тестирования устройств постоянного хранения данных, расширяет штат своего представительства в Новосибирске. Штаб-квартира расположена в самом сердце Кремниевой долины. R&amp;D подразделение в Новосибирске существует с 2007 года. Предметная область компании: Производство измерительных программно-аппаратных комплексов, предназначенных для верификации информационных параметров в системах хранения данных: устройства механического позиционирования с субнанометровой точностью, высокоскоростные устройства считывания сигналов (40 GHz), высокоскоростные устройства цифровой обработки сигналов (13 GS/sec). Программно-аппаратные комплексы производимые компанией используются для компьютерных систем и систем связи, в авионике, физических исследованиях и др. (в частности, ими пользуются такие компании как Seagate, Western Digital, HGST, TDK, Samsung и др.) Проектная деятельность компании предусматривает разработку ПО в трех основных командах: аппаратного уровня FPGA (Verilog), обработки сигналов и верхнего (прикладного) уровня (MS Windows: C++, VB6). Сейчас идет набор во все три команды. Основные требования: Опыт программирования на C и/или C++ от 1 года Высокий уровень математических знаний (анализ, алгебра, дискретная математика), теоретические и технологические аспекты программной инженерии, владение методами решения нестандартных задач Высшее образование Знание английского языка для общения с американскими коллегами Дополнительным плюсом будет : Опыт в программировании встроенного кода на Verilog с использованием FPGA Опыт разработки низкоуровневого и встроенного ПО, разработки и применения алгоритмов цифровой обработки сигналов Опыт работы в академических институтах, участие в создания сложных программно-аппаратных комплексов, участие в проектах создания научного ПО Кандидатская или докторская степень в своей области исследований, или обучение в аспирантуре, высокий академический балл Компания предлагает: 1-3 месячные командировки в США, Возможность релокации для успешнах сотрудников для работы в головном подразделении рядом с Сан-Франциско Уникальные инженерные задачи Достойный уровень заработной платы согласно ТК РФ, премии Работа в компании - технологическом лидере, использующей новейших технологий, в активно развивающейся области IT Уютный офис в Академгородке Демократичная корпоративная культура, позитивная атмосфера Почему стоит обратиться именно к нам? ✓Прежде всего наши услуги бесплатны для кандидатов! ✓Мы более 10 лет занимаемся подбором IT-специалистов для крупнейших российских и международных компаний. А наш опыт по подбору сотрудников позволяет решать вопросы любого уровня сложности. ✓Мы умеем находить для компаний самых подходящих и по духу, и по техническим навыкам кандидатов. ✓ Мы можем предложить вам выбор вакансий и работодателей не только в Новосибирске, но и в разных странах. ✓И сможем помочь успешно трудоустроиться в той из них, которая больше всего нравится именно вам и на которую вы лучше всего подходите. ✓Нет, мы не занимаемся тем, что даем шпаргалки и решаем за кандидатов тестовые задания. Но скажем, как лучше подготовиться к прохождению собеседований и решению технических задач. Если Вас заинтересовала данная вакансия – отправьте нам свое резюме, и мы свяжемся с Вами в ближайшее время!",Без требований,Без обязанностей,Без условий,c|C++|FPGA|алгоритмы|дискретная математика|алгебра|Verilog HDL,4
474,474,c++,Новосибирск,97600.0,147000.0,Бриксис Текноледжис Раша,2019-10-14T00:01:08+0300,Нет опыта,Полный день,Полная занятость,"Ищем разработчиков, готовых применить на практике знания математики при разработке инновационного ПО для инженеров и архитекторов. Познакомим с предметной областью, гарантируем интересные творческие задачи. Опыт промышленного программирования не обязателен - мы рассматриваем и студенческие резюме с примерами оригинального кода на С++. Обязанности: участие в коллективной разработке BricsCAD, популярной системы автоматизации проектных работ (САПР) в архитектурно-строительной и машиностроительной областях разработка конечно-пользовательских инструментов параметрического и прямого моделирования трёхмерных тел и поверхностей, генерации чертёжных видов по трёхмерным моделям реализация эффективных алгоритмов, создание и тестирование нового кода сопровождение существующего кода Требования: уверенные базовые знания С++ , см. например B. Stroustrup: The C++ Programming Language (4th Edition) хорошая математическая подготовка: аналитическая геометрия, дискретная математика технический английский (устно и письменно) Будет плюсом: опыт промышленного программирования в составе команды разработчиков, знание процессов коллективной разработки ПО, владение средствами разработки, системами контроля версий опыт самостоятельного проектирования программных архитектур и организации межмодульного взаимодействия в рамках программного приложения опыт работы с библиотеками STL (контейнеры, алгоритмы, multithreading), boost, wxWidgets, знание шаблонов проектирования (Gang of Four) опыт разработки коммерческого ПО, обрабатывающего большие объёмы данных в реальном времени (САПР, ГИС, СУБД) опыт разработки вычислительных библиотек и приложений машинной графики опыт разработки параллельных алгоритмов и многопоточных приложений желание и умение разбираться с существующим кодом Условия: официальное трудоустройство (бессрочный трудовой договор, ведение трудовых книжек) конкурентная зарплата, выплачиваемая на 100% в белую со всеми положенными страховыми отчислениями ежегодная индексация зарплаты по итогам переаттестации возможности карьерного роста в рамках интенсивно развивающейся международной компании просторный современный офис в башне Технопарка Новосибирского Академгородка охраняемая парковка, напитки и закуски за счёт компании пять недель оплачиваемого отпуска в год"," уверенные базовые знания С++ , см. например B. Stroustrup: The C++ Programming Language (4th Edition) хорошая математическая подготовка: аналитическая геометрия, дискретная математика технический английский (устно и письменно) Будет плюсом: опыт промышленного программирования в составе команды разработчиков, знание процессов коллективной разработки ПО, владение средствами разработки, системами контроля версий опыт самостоятельного проектирования программных архитектур и организации межмодульного взаимодействия в рамках программного приложения опыт работы с библиотеками STL (контейнеры, алгоритмы, multithreading), boost, wxWidgets, знание шаблонов проектирования (Gang of Four) опыт разработки коммерческого ПО, обрабатывающего большие объёмы данных в реальном времени (САПР, ГИС, СУБД) опыт разработки вычислительных библиотек и приложений машинной графики опыт разработки параллельных алгоритмов и многопоточных приложений желание и умение разбираться с существующим кодом "," участие в коллективной разработке BricsCAD, популярной системы автоматизации проектных работ (САПР) в архитектурно-строительной и машиностроительной областях разработка конечно-пользовательских инструментов параметрического и прямого моделирования трёхмерных тел и поверхностей, генерации чертёжных видов по трёхмерным моделям реализация эффективных алгоритмов, создание и тестирование нового кода сопровождение существующего кода "," официальное трудоустройство (бессрочный трудовой договор, ведение трудовых книжек) конкурентная зарплата, выплачиваемая на 100% в белую со всеми положенными страховыми отчислениями ежегодная индексация зарплаты по итогам переаттестации возможности карьерного роста в рамках интенсивно развивающейся международной компании просторный современный офис в башне Технопарка Новосибирского Академгородка охраняемая парковка, напитки и закуски за счёт компании пять недель оплачиваемого отпуска в год",ООП|C++|MS Visual Studio|SVN,4
158,158,c++,Новосибирск,97600.0,147000.0,ВСМ Груп,2019-09-20T14:29:35+0300,От 1 года до 3 лет,Полный день,Полная занятость,"Основная задача программиста С++: осуществлять поддержку и разработку ПО для музыкантов (нотный редактор) Muse Score Что вам точно пригодится: Знание C++ на уровне &quot;могу написать Тамагочи за 4 часа&quot; (включая UI на Qt ); Реальный опыт построения архитектуры приложений (знание паттернов проектирования, способность систематизировать бессвязный код); Опыт работы в коммерческих компаниях минимум 3 лет; Понимание, чем lean отличается от swift, scrum от lambda и в целом интересуется, что происходит в мире IT в последнее время; Иметь горящие глаза и быть музыкальным фанатом. Большим плюсом будет: Знание библиотеки QT, шаблонов проектирования, JAVA, Objective C. Опыт в разработке мобильных приложений под IOS и Android. Приветствуется владение нотной грамотой. Мы предлагаем: Вакансия открыта в головном офисе - в г. Калининграде - маленькая Европа в России Отличные финансовые условия: мы готовы договариваться если понравимся друг другу. Работа с командой сильных специалистов, которые выступают с экспертизой на международных конференциях; Личное влияние на многомиллионные музыкальные ресурсы; Атмосферу стартапа с высоким уровнем свободы и доверия; Возможность кратного профессионального роста за короткие сроки; Крутой офис, в котором есть сцена и много гитаристов; Настоящий Рок-н-Ролльный подход к управлению, работе и проектам; Рабочий день с 9.00 до 15.00, пн/сб; Официальное оформление по ТК, отпуск, больничные; Секретный ингредиент хорошего настроения сотрудников.",Без требований,Без обязанностей,Без условий,Qt|C++,28
755,755,c++,Новосибирск,97600.0,147000.0,Zodiac Interactive,2019-10-09T15:25:31+0300,От 3 до 6 лет,Полный день,Полная занятость,"Zodiac, one of the leading developers of software for interactive TV in the USA, is currently seeking to hire a Senior C/C++ Developer. What you&#39;ll do Design and development system level components and services for interactive TV (C++14/17); Embedded software development – including work with requirements specifications, developing new code as well as maintenance/modifications of the legacy code, remote debugging; Integration of 3rd party software components; Unit tests (google test (gtest/gmock)) development, execution of them; Work as a member of software project team. Required skills : Strong knowledge of C/C++, experience in commercial software development; Working knowledge of development under Linux OS; Working knowledge of VCS (git); Technical English. Skills we consider as a bonus : Experience in embedded software development; Experience in IP video streaming (DASH/HLS) and popular libraries used for media processing; Working knowledge of build automation systems (gn, Gradle, CMake, Meson, SCons, Make); Knowledge of script languages (python, bash, sh); Understanding the basic principles of interprocess communication; Basic knowledge of network programming (POSIX); Experience with tools for writing software reference documentation (Doxygen, JavaDoc); Knowledge of systems for code review (Gerrit, Bitbucket, GitHub, GitLab). In Zodiac employees : Work on challenging tasks involving cutting-edge technologies (unconventional approaches are appreciated), Develop software products that are used by millions of clients in all over the world, in particular in the North and South Americas (USA, Canada, Caribbean countries), Are not only members of a open-minded team, but also participate in its creation – to ensure we have the team of strong professionals. What you&#39;ll get: Flexible working hours; Medical insurance; No dress code; Delicious tea, coffee, sweets.",Без требований,Без обязанностей,Без условий,Без ключевых навыков,9
