,Unnamed: 0,name,area,min_salary,max_salary,employer,published_at,experience,schedule,employment,description,requirements,duties,conditions,key_skills,days
506,506,c++,Новосибирск,97600.0,147000.0,СКБ Контур,2019-10-07T12:18:17+0300,От 1 года до 3 лет,Гибкий график,Полная занятость,"Кто мы и чем занимаемся Контур разрабатывает продукты для бизнеса. Много. И они все разные, потому что у нас почти 2 000 000 клиентов и продуктовая, а не заказная разработка. Мы все время экспериментируем, развиваем наши сервисы и постоянно запускаем новые. Это у нас отлично получается :) Сейчас мы ищем C++-разработчика в команду инфраструктурной разработки. Эта команда создает инструменты для разработчиков и решает межфункциональные системные задачи. Проект и задачи Контур.Плагин — это расширение для браузеров, выполняющее криптографические операции в сервисах СКБ Контур. У него больше 1 млн установок, и каждый день им пользуется порядка 250 000 человек. Все они работают под Windows . Сейчас к выходу готовится кроссплатформенная версия Плагина, и перед командой стоят задачи по добавлению функциональности автообновления на macOS и Linux и возможности сбора телеметрических данных. На первом этапе предстоит участвовать в решении именно этих задач. В дальнейшем в основные обязанности будет входить: Поддержка и развитие Плагина, упрощение работы с ним Помощь с задачами Кабинету Удостоверяющего центра Стек На C++ написана основная часть Плагина и клиент для автообновлений под Windows . Другая часть и тесты разработаны на JavaScipt . Также используем Node.js для написания билд-скриптов и вспомогательных утилит, Python — для инструмента по автоматизации тестирования на множестве ОС, а C# — для backend’a сервиса автообновлений. Для нас важно: Опыт работы в команде промышленной разработки не менее года Знание C++ и желание писать большую часть кода на нем Знакомство или желание познакомиться с большей частью технологий из нашего стека Будет преимуществом: Представление о криптографии с открытым ключом Понимание принципов многопоточной и асинхронной работы Опыт кроссплатформенной разработки (Unix/Linux) Мы предлагаем: Разработку под разные платформы — Windows, Linux, macOS и возможность узнать, как устроены альтернативные ОС, познакомиться со своим «железом» ближе Свободу выбора технологий и подходов и возможность использовать современные стандарты (С++11/14/17) Поездки на IT-конференции, митапы, учебные курсы за счет компании, в том числе спикером Внутренние профессиональные сообщества и обмен опытом между командами Просторный и уютный офис с зонами отдыха, панорамным видом на город, душем Корпоративные мероприятия, командные выезды и движухи Гибкий график работы",Без требований,Без обязанностей,Без условий,Python|Linux|C++|Bash|Средства криптографической защиты информации,11
907,907,c++,Новосибирск,97600.0,147000.0,ARQA Technologies,2019-10-14T12:39:30+0300,От 3 до 6 лет,Гибкий график,Полная занятость,"ARQA Technologies - разработчик сложных программных решений для финансового сектора (банков, инвестиционных и управляющих компаний). Наши продукты QUIK и QORT используются более 300 клиентами в России и западных странах. Головной офис компании находится в тихом центре Новосибирска, в шаговой доступности от транспортной развязки. Города присутствия – Москва, Лондон. На данный момент, в компании работает более 200 человек. В зависимости от Ваших навыков и опыта мы будем рады предложить участие в решении разнообразных задач – от системного программирования, разработки бизнес-логики до реализации многофункционального пользовательского интерфейса. Мы ожидаем: Законченное высшее образование. Качественное знание и понимание базовых алгоритмов computer science. Опыт и хорошие знания C++, MS VS, WinApi. Навыки отладки и оптимизации ПО. Умение разбираться и работать с чужим кодом. Навыки командной работы. Будет плюсом: Знание MS SQL или другой СУБД. Мы предлагаем: Официальное трудоустройство и соблюдение законодательства о труде. Ежегодные отпуска 31 календарный день, больничные и т.д. ДМС, частичную компенсацию занятий спортом. Уютный офис в тихом центре. Насыщенную корпоративную жизнь в коллективе единомышленников. Гибкий график работы. Для сотрудников со стажем - возможность получить ссуду на первоначальный взнос при покупке жилья.",Без требований,Без обязанностей,Без условий,C/C++|MS Visual Studio|MS SQL Server,4
435,435,c++,Новосибирск,97600.0,161000.0,Кадровое агентство Алексея Сухорукова,2019-09-24T17:36:07+0300,От 3 до 6 лет,Полный день,Полная занятость,"C/C++ Developer со знанием Java (Чехия, Пльзень) Международная компания, разрабатывающая интеллектуальные решения для подключения к автомобилю, мобильного управления и дистанционной диагностики, которые используются в автобусах, грузовиках и легковых автомобилях, ищет в свою команду опытного C/C++ Developer со знанием Java. Офис компании располагается в часе езды от Праги — городе Пльзень. Компания находится в поиске Senior разработчиков, готовых создавать программные решения с помощью современных технологий в дружеской атмосфере. Эти программные решения используются во всем мире - от Германии до Гонконга и от Австралии до Швеции. Ваши задачи: Разработка прошивки для телематических устройств на C/C++ или Java Реализация новых возможностей фреймворка в C/C++ и bash-скриптах Поддержка телематических устройств на борту третьего уровня Конфигурация цепочки сборки Linux (новая версия используемых библиотек, ядра Linux, backport) Участие в тестировании, сопровождении технической документации и баг-трекере (Jira, Confluence) Настройка и отладка low-level ПО на основе заданного дизайна HW От вас ожидают: Программирование на уровне Senior на C/C++ (включая boost, stl) Программирование на Java на уровне Middle Коммерческий опыт написания приложений на C/C++ Знаком с инструментами разработчика (gcc, cmake, gnu make, git) Практический опыт работы с ОС Linux (знание архитектуры, SW Development) Опыт работы в области подключения (сети, сотовые сети, Wi-Fi, Bluetooth/BLE, GPS) Опыт разработки встраиваемых систем Хороший письменный и разговорный английский язык Будет плюсом: Знание технологий Azure IoT Hub, GIT, Maven, Jenkins, ARM Опыт работы с инструментами сборки Linux (Pengutronix PTXdist или YOCTO) Опыт программирования микрочипов Знание цифровых сетей, используемых в автомобильной промышленности (CAN, K-Line, RS232, RS485 и т.д.) Компания предлагает: Помощь и содействие при переезде в Чехию в полном объеме. Подробнее о Чехии вы можете прочитать в нашей статье “Чехия: 8 фактов, которые нужно знать каждому” Помощь в поиске и оплате жилья Профессиональный и карьерный рост Дружественную команду профессионалов Глобальные международные проекты, которые используются по всему миру",Без требований,Без обязанностей,Без условий,Java|C/C++|Linux,24
150,150,c++,Новосибирск,97600.0,147000.0,Бизнес Финанс Групп,2019-10-12T10:08:30+0300,От 1 года до 3 лет,Гибкий график,Частичная занятость,"Задачи: Разработка новой функциональности по техническому заданию и проектной документации Развитие и поддержка существующей функциональности, рефакторинг кода Работа в команде с самостоятельным решением задач в своей зоне ответственности. Требования: Высшее (техническое в сфере ИТ) образование; ЖЕЛАТЕЛЬНО наличие знаний и навыков в следующих областях: знание С/C++; СУБД (опыт работы с одной из): Oracle, PostgreSQL, MySQL, альтернативные решения; умение писать SQL-запросы; владение ПК на уровне администратора (установка и настройка ОС семейства Windows не должна вызывать проблем), опыт работы с виртуальными машинами Умение грамотно формулировать свои мысли устно и письменно, конструктивно вести разговор, работать в команде. Умение работать с технической документацией. Условия: Надежная стабильная компания - лидер рынка банковской автоматизации График работы: полный или неполный рабочий день, гибкое время начала рабочего дня (с 8 до 11) Оформление в соответствии с ТК РФ Заработная плата официальная: оклад и достойные премии по результатам работы Добровольное медицинское страхование Корпоративное обучение Рассматриваем в тч студентов последних курсов обучения технических вузов и начинающих специалистов с небольшим опытом работы."," Высшее (техническое в сфере ИТ) образование; ЖЕЛАТЕЛЬНО наличие знаний и навыков в следующих областях: знание С/C++; СУБД (опыт работы с одной из): Oracle, PostgreSQL, MySQL, альтернативные решения; умение писать SQL-запросы; владение ПК на уровне администратора (установка и настройка ОС семейства Windows не должна вызывать проблем), опыт работы с виртуальными машинами Умение грамотно формулировать свои мысли устно и письменно, конструктивно вести разговор, работать в команде. Умение работать с технической документацией. ",Без обязанностей," Надежная стабильная компания - лидер рынка банковской автоматизации График работы: полный или неполный рабочий день, гибкое время начала рабочего дня (с 8 до 11) Оформление в соответствии с ТК РФ Заработная плата официальная: оклад и достойные премии по результатам работы Добровольное медицинское страхование Корпоративное обучение Рассматриваем в тч студентов последних курсов обучения технических вузов и начинающих специалистов с небольшим опытом работы.",Без ключевых навыков,6
1072,1072,c++,Новосибирск,97600.0,150000.0,Кадровое агентство Алексея Сухорукова,2019-10-14T09:09:46+0300,От 1 года до 3 лет,Полный день,Полная занятость,"Одна из уникальных компаний международного рынка, располагающаяся в Новосибирске, создающая софт для программистов, среды разработки и даже собственные языки программирования, ищет в свою команду талантливого инженера-программиста. Основные заказчики компании – Cisco, Spirent, British Telecom, и то, что они делают для них, работает на серверах Apple, BMW, Verizon и у многих других. Это возможность поработать в R&amp;D-проекте, исследовать и внедрять новаторские технологические подходы, &quot;проектировать будущее&quot; в одном из самых динамичных и перспективных направлений. Если ты обладаешь внутренней гибкостью и базовым пониманием парадигмы ООП, готов пробовать новые технологии и языки программирования, жаждешь учиться и развиваться в команде высококлассных разработчиков, то эта вакансия для тебя. Если ты: Имеешь опыт разработки на С++ Хорошо знаешь Linux, роутеры и сетевые технологии Знаешь принципы ООП и ООД Работал с базами данных: SQL, NoSQL Свободно говоришь на английском Знаешь классические алгоритмы структуры данных, умеешь оценивать сложность алгоритмов и можешь писать производительный код Интересуешься современными средствами и методиками разработки Проявляешь интерес к новым технологиям и готов отойти от основного языка при необходимости Компания предлагает: Сложные и интересные задачи, как алгоритмические, так и архитектурные Долговременную и стабильную работу над высококачественными проектам в течение нескольких лет. Компания прилагает значительные усилия к тому, чтобы с тем, что они делают было приятно и удобно работать. Тщательно оформленные тесты и документацию Прозрачный карьерный рост И открытую систему оплаты Бонусом будет: Свободный график работы Частичная компенсация курсов и поездок на конференции Минимум бюрократии: в штате нет менеджеров, команды целиком состоят из инженеров Помощь в изучении других языков программирования и инструментов разработки Отличный комфортный офис в Академгородке Почему стоит обратиться именно к нам? ✓Прежде всего наши услуги бесплатны для кандидатов! ✓Мы более 10 лет занимаемся подбором IT-специалистов для крупнейших российских и международных компаний. А наш опыт по подбору сотрудников позволяет решать вопросы любого уровня сложности. ✓Мы умеем находить для компаний самых подходящих и по духу, и по техническим навыкам кандидатов. ✓ Мы можем предложить вам выбор вакансий и работодателей не только в Новосибирске, но и в разных странах. ✓И сможем помочь успешно трудоустроиться в той из них, которая больше всего нравится именно вам и на которую вы лучше всего подходите. ✓Нет, мы не занимаемся тем, что даем шпаргалки и решаем за кандидатов тестовые задания. Но скажем, как лучше подготовиться к прохождению собеседований и решению технических задач. Интересно узнать подробности? Отправляй свое резюме, и в ближайшее время мы с тобой свяжемся!",Без требований,Без обязанностей,Без условий,C|C++|Linux|Hypersonic Sql|NoSQL,4
