,Unnamed: 0,name,area,min_salary,max_salary,employer,published_at,experience,schedule,employment,description,requirements,duties,conditions,key_skills,days
733,733,c++,Новосибирск,97600.0,147000.0,Дата Ист,2019-10-13T05:08:19+0300,От 1 года до 3 лет,Полный день,Полная занятость,"Мы реализуем высокотехнологичные проекты в сфере геоинформационных систем - от мобильных картографических приложений до систем управления геоданными на корпоративном уровне. Программные продукты, информационные системы и решения нашей компании применяются в управлении территориями и природными ресурсами, геологии и геофизике, добыче нефти и газа, управлении городским хозяйством, земельном кадастре, транспортной логистике, в сельском и лесном хозяйстве и многих других сферах деятельности. Business Analyst Pro - расширение для платформы ArcGIS Pro американской компании Esri – основоположника и мирового лидера рынка геоинформационных систем. Business Analyst Pro служит для проведения сложных геомаркетинговых исследований, расчета пути следования, поиска оптимального расположения новых магазинов и складов. Продукты семейства Business Analyst используют в работе такие крупные компании, как Nike, Walmart, Kaiser и Dyson. Требования к кандидатам знание C++ ; знание и понимание ООП; английский язык на уровне чтения технической документации (intermediate); умение работать в команде, умение работать с чужим кодом. Дополнительно приветствуется знание C#, WPF; умение работать с системой контроля версий (Git); свободное владение английским языком. Чем надо будет заниматься разрабатывать расширение для ArcGIS Pro на C++, писать автоматические тесты Мы предлагаем оформление в соответствии с ТК, полностью официальная заработная плата, отпуск 4 недели в год в удобное время; бесплатная медицинская страховка, которая включает ведущие клиники Новосибирска: ЦНМТ, Академмедикал, Медицинский центр им. Е.Н. Мешалкина, НИИТО, Дентал Сервис; компенсация стоимости занятий в бассейне; 8-часовой рабочий день с гибким началом рабочего дня (до 10:00), испытательный срок 1 месяц; мощное железо: Intel Core i7, SSD, 16GB RAM; современный софт: в работе используем Visual Studio 2015, GIT для хранения исходного кода, YouTrack для баг-трекинга и билд-сервер с TeamCity для автоматической сборки исходного кода, ОС и office пакеты последней линейки; уютный и просторный офис, ароматный кофе и многое-многое другое. Как мы разрабатываем Business Analyst Pro Над проектом работает распределённая команда разработчиков и инженеров, часть которой находится в Новосибирске, а часть в городе Редландс, США. Поэтому важную роль играет тесное командное взаимодействие. Для ежедневного общения с зарубежными коллегами мы используем e-mail и Slack, а для детального обсуждения сложных задач дважды в неделю проводим митинги по Skype/Lync. Мы разрабатываем и тестируем инструменты геообработки для ArcGIS Pro, пользовательский интерфейс для визуализации данных и интерактивного анализа. Так как мы разрабатываем расширение для ArcGIS Pro, важно учитывать особенности дизайна и работы основного приложения. Для управления проектом мы используем Scrum, а сам проект размещён на платформе GitHub. Бизнес-логика реализована на С++, а удобный функциональный интерфейс - на C#. В продукте применяются технологии WPF, COM, ArcObjects, ArcGIS Pro SDK и ArcGIS REST API.",Без требований,Без обязанностей,Без условий,C++|ООП|Git|Английский язык,5
46,46,c++,Новосибирск,97600.0,147000.0,Movavi,2019-10-08T09:40:43+0300,От 1 года до 3 лет,Гибкий график,Полная занятость,"Новосибирская IT-компания Movavi создает и продает программы для любительской обработки мультимедиа. Movavi Video Editor, Photo Editor, Video Converter, Screen Capture - одни из самых популярных продуктов в мире, ими пользуются в 200 странах. Наши программы помогают миллионам людей легко обрабатывать фото и видео, не требуя специальных знаний и навыков. Мы счастливы представлять Новосибирск на мировой IT-карте! Приглашаем тебя присоединиться к нашей команде и вместе с нами создавать самый популярный софт для мультимедиа! Чем предстоит заниматься: разработка в команде кросс-платформенных приложений под Windows и Mac; помощь в решении технических проблем другим членам команды Для успешного выполнения задач тебе потребуется: успешный опыт разработки приложений на C++ от 3-х лет; уверенные знания C/C++, STL, Qt, boost, OpenGL/DirectX; опыт работы с WinAPI. Будет круто, если: есть опыт разработки кросс-платформенных приложений с графическим интерфейсом; опыт gamedev. Работа в Movavi - это: команда профессионалов, готовых делиться знаниями и опытом; индивидуальный подход к профессиональному росту и развитию внутри компании; официальное трудоустройство с первого рабочего дня; белая заработная плата + компенсация питания и спорта; удобный график работы как для &quot;жаворонков&quot;, так и для &quot;сов&quot;; занятия йогой и английским языком, не выходя из офиса; здоровье с ДМС; приятная рабочая атмосфера, общение на &quot;ты&quot;; бодрящие корпоративы: горы и ели, море и пальмы, и никакого алкоголя. Если ты не получил ответ на отклик в течение 3-х рабочих дней : 1. Проверь папку &quot;Спам&quot; в электронной почте. Возможно, письмо с ответом оказалось там. 2. Позвони или напиши нам. Можешь кого-то порекомендовать? Отлично! Расскажи о нашей вакансии своему другу или знакомому. Отправь его резюме на почту (см. контактную информацию) с пометкой &quot;Внешняя рекомендация на вакансию С++ разработчик&quot; . Получи денежный бонус: - за рекомендацию специалиста уровня Middle - 50 000 рублей; - за рекомендацию специалиста уровня Senior - 70 000 рублей. Бонус будет доступен после прохождения твоим другом испытательного срока.",Без требований,Без обязанностей,Без условий,C++|Qt|STL|QML|Boost|OpenGL,10
992,992,c++,Новосибирск,97600.0,147000.0,ANCOR FinTech,2019-09-25T15:24:57+0300,От 1 года до 3 лет,Полный день,Полная занятость,"Обязанности: Разработка в команде кросс-платформенных приложений под Windows и Mac; Помощь в решении технических проблем другим членам команды Требования: Успешный опыт разработки приложений на C++; Знания C/C++, STL, Qt, boost, OpenGL/DirectX; Опыт работы с WinAPI. Условия: Дружная команда; Официальное трудоустройство с первого рабочего дня; Белая заработная плата; Удобный график работы; ДМС; Активная корпоративная жизнь."," Успешный опыт разработки приложений на C++; Знания C/C++, STL, Qt, boost, OpenGL/DirectX; Опыт работы с WinAPI. ", Разработка в команде кросс-платформенных приложений под Windows и Mac; Помощь в решении технических проблем другим членам команды , Дружная команда; Официальное трудоустройство с первого рабочего дня; Белая заработная плата; Удобный график работы; ДМС; Активная корпоративная жизнь.,Qt|C++|STL|QML,23
1008,1008,c++,Новосибирск,97600.0,147000.0,Прософт-Системы,2019-10-01T08:20:17+0300,От 1 года до 3 лет,Полный день,Полная занятость,"Сегодня «Прософт-Системы» – это ведущий российский разработчик оборудования и программного обеспечения для автоматизации технологических процессов в энергетике и нефтегазовой отрасли. Центральный офис и производство компании располагаются в Екатеринбурге, команда насчитывает 750 человек и продолжает активно расти и совершенствоваться. В настоящий момент мы ищем Инженера-программиста С++ (Qt) в отдел релейной защиты и автоматики. Направление деятельности: Разработка ПО для конфигурирования устройств релейной защиты и противоаварийной автоматики (МКПА, РЭС-3, ТПА, ИСС). Это оборудование и системы защиты позволяют управлять объектами электроэнергетики в режиме реального времени. Что предстоит делать: В составе команды разрабатывать новое и дорабатывать существующее ПО на языке C++ (с использованием библиотеки Qt), в том числе участвовать в разработке архитектуры; Разрабатывать анализатор осциллограмм аналоговых и дискретных сигналов; Разрабатывать интерфейс пользователя во взаимодействии с дизайнером; Проводить первичное тестирование разрабатываемого ПО (перед передачей группе тестирования). Что требуется: Высшее образование (возможно последний курс университета); Опыт разработки графических приложений на С++; Опыт программирования под Linux; Опыт использования библиотеки Qt; Применение объектно-ориентированного подхода при разработке; Опыт работы с сетью (TCP/UDP); Системный подход к разработке ПО. Что мы предлагаем: Офис в Екатеринбурге (гибкие условия релокации, обсуждаем индивидуально) Конкурентоспособный и прозрачный доход: размер заработной платы обсуждается по итогам собеседования + премии по итогам квартала Среду для непрерывного профессионального развития: возможность посещать профильные конференции за счет компании, доступ к корпоративным библиотекам. У нас дружелюбная атмосфера и команда профессионалов, которые готовы поддерживать на всех уровнях и делиться знаниями Заботу о здоровье наших людей: программа ДМС, компенсация стоимости абонемента в фитнес-клуб Насыщенную корпоративную жизнь, для тех, кто захочет разнообразить досуг. До встречи!",Без требований,Без обязанностей,Без условий,C++,17
673,673,c++,Новосибирск,97600.0,147000.0,ARQA Technologies,2019-10-14T12:39:30+0300,От 1 года до 3 лет,Гибкий график,Полная занятость,"ARQA Technologies - разработчик сложных программных решений для финансового сектора (банков, инвестиционных и управляющих компаний). Наши продукты QUIK и QORT используются более 300 клиентами в России и западных странах. Головной офис компании находится в тихом центре Новосибирска, в шаговой доступности от транспортной развязки. Города присутствия – Москва, Лондон. На данный момент, в компании работает более 200 человек. В зависимости от Ваших навыков и опыта мы будем рады предложить участие в решении разнообразных задач – от системного программирования, разработки бизнес-логики до реализации многофункционального пользовательского интерфейса. Мы ожидаем: Законченное высшее образование. Качественное знание и понимание базовых алгоритмов computer science. Опыт и хорошие знания C++, MS VS, WinApi. Навыки отладки и оптимизации ПО. Умение разбираться и работать с чужим кодом. Навыки командной работы. Будет плюсом: Знание MS SQL или другой СУБД. Мы предлагаем: Официальное трудоустройство и соблюдение законодательства о труде. Ежегодные отпуска 31 календарный день, больничные и т.д. ДМС, частичную компенсацию занятий спортом. Уютный офис в тихом центре. Насыщенную корпоративную жизнь в коллективе единомышленников. Гибкий график работы. Для сотрудников со стажем - возможность получить ссуду на первоначальный взнос при покупке жилья.",Без требований,Без обязанностей,Без условий,C++|MS Visual Studio,4
