,Unnamed: 0,name,area,min_salary,max_salary,employer,published_at,experience,schedule,employment,description,requirements,duties,conditions,key_skills,days
666,666,devops,Новосибирск,40000.0,80000.0,Диалоговые системы,2019-10-03T13:36:07+0300,От 1 года до 3 лет,Гибкий график,Полная занятость,"От Вас требуется: Знание основных сетевых протоколов, статическая/динамическая маршрутизация Опыт администрирование Linux (Ubuntu, Debian) от 1 года Bash, Python Английский язык на уровне чтения технической документации Желание постоянно развиваться, изучать новые технологии и применять их на практике Самоорганизацию и хорошие коммуникативные навыки Будет плюсом опыт работы: Docker, Swarm, Kubernetes KVM Git, Helm Ansible, Saltstack S3 Облачными провайдерами Системами мониторинга (Zabbix, Prometheus) RabbitMQ, Redis, Nginx, PostgreSQL, ELK DevOps-практики Знание принципов CI/CD Знание принципов работы микросервисов и клиент-серверных архитектур Условия: официальное трудоустройство; стать частью веселого и дружного коллектива; работу в новом офисе Технопарка Академгородка или в городе, на ваш выбор. проникнуться духом стартапа, который получает инвестиции возможность развиваться, посещать конференции и митапы. обсуждаемый график работы интересные и сложные проекты",Без требований,Без обязанностей," официальное трудоустройство; стать частью веселого и дружного коллектива; работу в новом офисе Технопарка Академгородка или в городе, на ваш выбор. проникнуться духом стартапа, который получает инвестиции возможность развиваться, посещать конференции и митапы. обсуждаемый график работы интересные и сложные проекты",Linux|Bash|Nginx|администрирование Linux|Docker|KVM|Системы мониторинга|RabbitMQ,15
1047,1047,devops,Новосибирск,55000.0,70000.0,ЭМА,2019-10-14T06:53:22+0300,От 1 года до 3 лет,Полный день,Полная занятость,"Обязанности: Взаимодействие с командой разработчиков. Автоматизация процессов развертывания инфраструктуры, разработки, тестирования (сборка пакетов, скрипты установки). Исследование новых инфраструктурных компонент (СУБД и пр.) для улучшения существующего ПО. Требования: Высшее техническое образование в области информационных технологий. Знание жизненного цикла разработки ПО. Опыт работы с ОС Linux и ОС Windows. Понимание работы сети. Работа с виртуальными средами. Английский, достаточный для чтения профессиональной литературы. Вашим профессиональным преимуществом будет: Владение языком программирования высокого уровня. Владение языком SQL. Знание инструментария программиста под *nix системы. Условия: Официальное трудоустройство по ТК РФ. Современный офис по линии метро. Работа над интересными проектами. Профессиональный и личностный рост в дружной компании."," Высшее техническое образование в области информационных технологий. Знание жизненного цикла разработки ПО. Опыт работы с ОС Linux и ОС Windows. Понимание работы сети. Работа с виртуальными средами. Английский, достаточный для чтения профессиональной литературы. Вашим профессиональным преимуществом будет: Владение языком программирования высокого уровня. Владение языком SQL. Знание инструментария программиста под *nix системы. "," Взаимодействие с командой разработчиков. Автоматизация процессов развертывания инфраструктуры, разработки, тестирования (сборка пакетов, скрипты установки). Исследование новых инфраструктурных компонент (СУБД и пр.) для улучшения существующего ПО. ", Официальное трудоустройство по ТК РФ. Современный офис по линии метро. Работа над интересными проектами. Профессиональный и личностный рост в дружной компании.,Без ключевых навыков,4
266,266,devops,Новосибирск,90000.0,180000.0,Plesk,2019-10-14T09:15:51+0300,От 3 до 6 лет,Полный день,Полная занятость,"Plesk – контрольная панель для автоматизации администрирования сервера. Plesk широко применяется для администрирования web хостинга, поскольку позволяет свести операции по настройки веб-сервера к простым операциям в контрольной панели. Plesk может быть установлен на Linux и Windows сервера. В настоящий момент усилия команды направлены на предоставление услуг в виде публичных сервисов. Обеспечение надёжной работы внешних и внутренних сервисов, гарантия их производительности, гибкое масштабирование разрабатываемых систем - основные фокусы современного продукта Plesk О процессах разработки : https://goo-gl.ru/5a7Y Обязанности: обеспечивать необходимый уровень надежности сервисов предоставление рекомендаций к архитектуре сервисов обеспечение масштабируемости и высокодоступности сервисов мониторинг и автоматизация всех процессов жизнедеятельности сервиса. прогнозирование и предотвращение сбоев в работе сервиса реакция на инциденты и проведение последующего анализа Мы ожидаем, что Вы: имеете опыт обслуживания сервиса с реальной нагрузкой - от 6 месяцев. имеете опыт работы с UNIX-системами более трех лет; уже занимались ранее построением и администрированием высоконагруженных отказоустойчивых систем; понимаете как обеспечить работу сервиса 24/7; способны настроить мониторинг для сервиса и понимаете полученные графики, можете делать выводы на их основе; умеете программировать (python, bash, go); умеете работать с Ansible; уровень английского языка - от Intermediate Будет плюсом: опыт работы с Docker опыт работы с Kubernetes опыт работы с Amazon Web Services опыт работы с Zabbix, Prometheus, Grafana, ELK. опыт работы с Jenkins или GitLab CI Важные для нас soft skills: Коммуникабельность. Работа предполагает активное взаимодействие с различными командами разработки. Обучаемость. Идеально, если вы считаете себя T-shape сотрудником - &quot;вы эксперт в одной области и имеете широкий кругозор и опыт в смежных областях&quot;. Аналитический склад ума. Также очень важно, если вы способны объяснять сложные вещи простыми словами. Ответственность. Работа предполагает запуск, эксплуатацию нагруженных сервисов с большим количеством посетителей. Пара слов о том, как мы работаем: Используем современный стек технологий Отправляем разработчиков прокачивать свои навыки на профессиональных конференциях в столицы и за рубеж Даем возможность разрабатывать и внедрять собственные фичи в узаконенный Research Day и делиться полученными знаниями с коллегами на регулярных Tech Talks Помогаем совершенствовать разговорный английский с лучшими преподавателями - бесплатно, на территории офиса. Поддерживаем в релокации: выплачиваем безвозмездный бонус за переезд в размере одного оклада в первые 2 недели работы",Без требований,Без обязанностей,Без условий,Unix|Ansible|Английский язык|Python|Docker|Kubernetes|Amazon,4
366,366,devops,Новосибирск,165428.57142857142,210333.3333333333,Студия Разработки,2019-10-11T14:24:13+0300,От 3 до 6 лет,Полный день,Полная занятость,"Федеральная компания (направление FinTech). У нас более 30 разных проектов, по которым постоянно разрабатывается новый функционал и производится интеграция с разными сервисами. Один из проектов – это система управления бизнес-процессами на базе микросервисной архитектуры. Интересные задачи: · Установка среды публикации на существующих и новых проектах компании. · Разработка процесса публикации проектов для разработчиков. · Контроль публикации изменений проектов. · Разработка среды тестирования проектов. · Консультирование разработчиков и администраторов системы. Что ждём от кандидата: · Общий опыт разработки - 3+ лет · Настройка репозитория GIT, знания GIT-flow · Разворачивание и настройка любой среды CI/CD (плюсом знание TeamCity) · Умение работать как на новых так и на уже существующих проектах · Docker · OS Windows. Unix · Bash &amp; shell script · Желательно (будут дополнительным плюсом): · MS Build &amp; Deploy, знание архитектуры C# проектов и .NET архитектуры · Опыт работы с MS SQL 2016 · Виртуализация HyperV / VMWare · Опыт администрирования Unix Windows систем, Exchange, Zabbix, HAproxy, RabbitMQ Предлагаем: · Возможность профессионального и карьерного развития в компании. · Официальное трудоустройство согласно ТК РФ с первого дня. · Заработная плата по договоренности · Место работы: г. Новосибирск, 5 минут от ст.м. Октябрьская. · График работы: пятидневная рабочая неделя с 9-00 до 18-00.",Без требований,Без обязанностей,Без условий,Без ключевых навыков,7
197,197,devops,Новосибирск,165428.57142857142,210333.3333333333,Skyeng,2019-09-30T12:18:27+0300,От 1 года до 3 лет,Удаленная работа,Полная занятость,"Мы в Skyeng меняем традиционное образование с помощью технологий. Сейчас в нашей IT-команде более 250 сотрудников, включая 70+ разработчиков. Наша разработка — это 14 независимых и быстрых продуктовых команд с опытными тимлидами и продактами. Наши продукты — это онлайн-платформа Vimbox, Android и IOS-приложения, словари, браузерные расширения, внутренние CRM и финансовые системы. В 2018 году Skyeng войдет в топ 10 IT-компаний России. Важнейшая составляющая нашей разработки — это инфраструктура . Благодаря ей мы умеем деплоить каждый день десятки раз, максимально быстро предотвращать и реагировать на инциденты. Наша инфраструктура — это более 100 железных серверов и виртуальные машины в AWS. Мониторинг у нас построен на основе Zabbix, New Relic, Sentry, Kibana. А деплой с помощью Jenkins &amp; Capistrano. Инфраструктура разработки - классический LNPP стек (для полнотекстового поиска: linux, nginx, postgresql, php) Для общения и документации у нас современные инструменты: slack, hangouts, JIRA, confluence, github. Мы не любим бюрократии : мы не боимся ошибаться, а если так происходит, то проводим post mortem, разбираем ошибки и работаем дальше. Наш идеальный кандидат: Имеет лидерские навыки, опыт и желание вертикального роста Готов работать удаленно; Имеет желание развиваться в сфере DevOps (знание linux); Имеет понимание и стремление следовать принципу Infrastructure as Code; Опыт работы с Docker в продакшн Опыт работы с Jenkins будет плюсом (речь именно о написании groovy кода); Имеет стремление автоматизировать рутинные задачи; Имеет желание обучаться новому и обучать окружающих. Чем придётся заниматься: Улучшать существующий процесс разработки; Внедрять докер в процесс разработки и эксплуатации; Автоматизировать процессы управления серверами (ansible); Построением отказоустойчивой архитектуры PHP приложений; Быть готовым решать критические проблемы безотлагательно; Ежедневно повышать уровень DevOps компетенций в своей команде. Что мы даем взамен: Возможность удаленно работать Интереснейшая работа в компании в условиях роста 3х в год - прямо школа по масштабированию приложений; Участие в переходе компании из old-style infrastructure в container-based infrastructure; Влияние на процессы разработки во всей компании (самой крупной онлайн-школе английского в Восточной Европе); Мы предлагаем вам расти вместе со школой. Skyeng растет в 3 раза каждый год, сотрудники растут быстрее. Возможности для развития и роста безграничны; Оплачиваемые отпуск и больничные; Скидка 50% на уроки английского вам и вашему другу; Зарплата 2 раза в месяц (к сожалению, каждый раз только по половинке зарплаты).",Без требований,Без обязанностей,Без условий,Linux,18
161,161,devops,Новосибирск,165428.57142857142,210333.3333333333,ARTOX,2019-10-04T16:44:17+0300,От 1 года до 3 лет,Полный день,Полная занятость,"Команда разработки Минского офиса в поисках DevOps engineer (с возможностью релокации из других стран). У нас есть классные бенефиты, ведь мы: постоянно развиваем своих сотрудников и организовываем бесплатные курсы по английскому языку планируем профессиональное и карьерное развитие (“карьерный лифт”) при релокации сотрудника из другой страны первое время оплачиваем ему жилье предоставляем возможность приобретения техники в личное пользование с полной или частичной компенсацией расходов организовываем тимбилдинги и яркие корпоративные праздники обустроили зоны отдыха, где можно сжечь на тренажерах калории или покататься на качелях — в общем, устроить самый настоящий chill out! открыли собственное корпоративное кафе в офисе дарим подарки на Дни Рождения и годовщины работы в компании а еще у нас есть программа лояльности для сотрудников (ты можешь ходить по скидкам в разные заведения наших клиентов). Обязанности: работа в тесном контакте с командой разработки для поддержки и оптимизации разрабатываемых систем и серверов; проектирование и настройка логики работы системы; управление, производительность, настройка баз данных и серверов приложений, настройка на их основе кластеров и HA-систем, периодическое обновление ПО; сохранение и укрепление стабильности и безопасности развития инфраструктуры проектов ,и, главное - решение возникающих при этом всем проблем; оптимизация веб-приложений и баз данных; предоставление отчетов 24/7 о статусе работы продукта. Требования: опыт администрирования Windows/Linux систем; опыт работы с ESXi и AWS; опыт администрирования Web и Application серверов (nginx, apache, etc); опыт администрирования и оптимизации Баз Данных (MySQL, Postgre, etc); использование при этом инструментов для автоматизации провижининга и доставки изменений (опыт работы и настройки Ansible/Chef/Puppet); знание скриптовых языков программирования (bash, perl, python или ruby); знакомство с ITIL методологией. Что предлагаем мы: работу в команде, создающей проекты международного уровня - каждый день вы будете ощущать пользу от своей работы для ваших друзей и знакомых; современный стильный офис (2 мин. от ст. м. «Парк Челюскинцев») с собственным кафе, спорт. зоной и релакс-зоной; тимбилдинги и запоминающиеся корпоративные мероприятия; высокую оплату труда и полный соц. пакет. ARTOX Lab - резидент ПВТ; мы научим передвигаться по офису на скейте и самокате! ДАВАЙТЕ СКОРЕЕ К НАМ!",Без требований," работа в тесном контакте с командой разработки для поддержки и оптимизации разрабатываемых систем и серверов; проектирование и настройка логики работы системы; управление, производительность, настройка баз данных и серверов приложений, настройка на их основе кластеров и HA-систем, периодическое обновление ПО; сохранение и укрепление стабильности и безопасности развития инфраструктуры проектов ,и, главное - решение возникающих при этом всем проблем; оптимизация веб-приложений и баз данных; предоставление отчетов 24/7 о статусе работы продукта. ",Без условий,Oracle Application Server|Настройка серверов Apache|Администрирование серверов Linux|MySQL|Linux|PostgreSQL|ITIL|Bash|Perl|Python,14
