,Unnamed: 0,name,area,min_salary,max_salary,employer,published_at,experience,schedule,employment,description,requirements,duties,conditions,key_skills,days
175,175,devops,Новосибирск,165428.57142857142,210333.3333333333,КардПэй,2019-10-10T07:57:59+0300,От 3 до 6 лет,Полный день,Полная занятость,"CardPay - международная финансовая компания, предоставляющая своим клиентам высококачественный сервис обслуживания карточных онлайн-платежей. Являясь авторизованным партнером Visa и MasterCard, CardPay, предоставляет высококачественный сервис обслуживания карточных онлайн-платежей своим клиентам. Сегодня мы расширяем RnD офис в Новосибирске. От вас: опыт администрирования Linux от 3х лет; опыт работы с Ngnix, Docker, Kubernetes,Terraform, Jenkins, GitLab CI; знание CI/CD процессов и методологий разработки, понимание того, как эти процессы автоматизируются; понимание принципов работы Git, Gitflow; опыт работы с облачными сервисами; понимание систем виртуализации и оркестрации; знание систем управления конфигурацией; поиск и устранение проблем производительности; опыт развертывания стеков систем сбора и обработки логов (Splunk), мониторинга (InfluxDB). Чем необходимо будет заниматься: автоматизация развёртки и настройка окружений; поддержка и развитие системы мониторинга; своевременная реакция на инциденты; диагностика и устранение узких мест в системе; автоматизация рутинных задач; участие в развитии ИТ-инфраструктуры для продуктов компании. Мы будем рады предложить: Достойную компенсацию , которая позволит сосредоточиться на развитии проекта и своем профессиональном росте. Сильную команду , увлеченную своим делом, в которой есть у кого поучиться. Сложные и интересные задачи - реальная практика в построении масштабных сервисов, оптимизация, тонкости работы с нагрузками, распределением задач и т.п. Рост и развитие - обучение на боевых задачах, сертификация, курсы английского, участие в мероприятия IT индустрии. Комфортные условия работы - офис со всеми условиями и удобствами (включая кухню-столовую в офисе, охраняемую парковку, современную технику). Заботу о здоровье - занятия фитнесом. Стоимость занятий компенсируется за счет компании. Благодарим Вас за интерес, проявленный к нашей компании!",Без требований,Без обязанностей,Без условий,Linux|Docker|CI/CD|Git|Nginx,8
1034,1034,devops,Новосибирск,165428.57142857142,210333.3333333333,МТС,2019-10-09T13:00:04+0300,От 1 года до 3 лет,Полный день,Полная занятость,"Задачи: Поддерживать процессы разработки на виртуальной серверной инфраструктуре: продуктив, стейжинг, тестовые сервера. Участвовать в развитии и масштабировании инфраструктуры, контролировать её оптимальность. Участвовать в построении процессов быстрой качественной разработки, следить за повышением уровня стабильности продукта. Поддерживать системы контроля версий, процессы непрерывной интеграции и непрерывной поставки (CI/CD). Необходимо иметь: Опыт работы на позиции Devops. Экспертные знания linux, опыт работы с Ubuntu, RHEL. Опыт настройки и поддержки систем хранения версий: git, gitlab. Опыт настройки и поддержки систем управления конфигурациями: ansible, chef, puppet, salt. Опыт настройки и поддержки систем автоматизации разработки: jenkins, teamcity. Опыт администрирования СУБД: MySQL, Postgress, Oracle. Опыт настройки и поддержки систем мониторинга: zabbix, nagios, cacti. Опыт настройки apache, nginx. Опыт разработки на php5.6/7+. Опыт работы с jboss, tomcat, maven, ant. Владение скриптовыми языками для автоматизации (python, bash, golang, php). Будет плюсом: Опыт работы (настройка, установка): selenium webdrive, selenium grid, redis, memcache, rabbitmq, docker, docker-compose, kubernetes/docker-swarm, elasticsearch, logstash, kibana, grafana. Мы предлагаем: Стабильная белая заработная плата, премии. Скучно не будет - множество интересных и сложных проектов; Саморазвитие - мы сделали обучение доступным. Вы можете проходить тренинги очно, дистанционно, в Корпоративном университете, у провайдеров, у наставников. Развитие в компании - Вы сами выбираете: стать экспертом или руководителем. Здоровье своих сотрудников - ДМС со стоматологией, страхование жизни, страхование при поездках за рубеж; Спорт - корпоративные соревнования по футболу, баскетболу и волейболу, различные спорт-программы или компенсация вашего фитнес-абонемента; Хороший отдых- отпуск 28 календарных дней + 3 календарных дня дополнительно ежегодно а также различные скидки на путешествия от наших партнеров; Возможности раскрыть талант - мы поддерживаем хобби сотрудников, у нас есть корпоративный театр и кукольный театр; Социальную ответственность - мы помогаем детям из детских домов, обучаем пенсионеров безопасному поведению в сети, сдаем кровь, очищаем парки от мусора на волонтерских субботниках и многое другое. Офис находится по адресу: город Новосибирск, станция метро Площадь Гарина - Михайловского, улица Красноярская 136.",Без требований,Без обязанностей,Без условий,Без ключевых навыков,9
147,147,devops,Новосибирск,165428.57142857142,210333.3333333333,Сбербанк,2019-09-20T12:05:21+0300,Нет опыта,Полный день,Полная занятость,"DevOps инженер Наша команда обеспечивает сервис по поддержке тестовых стендов автоматизированных систем банка. Мы реализуем решения по автоматизации производственного процесса на этапе continuous deployment (CDl) и сервисы самообслуживания по тестовым стендам. Нашими целями являются повышение надежности и доступности тестовых стендов и полигонов тестирования, сокращение time to market, повышение качества ПО. ЗАДАЧИ: Эксплуатационное сопровождение тестовых сред АС Экспертиза внедрения практик DevOps на этапах CDL, CDP в командах Проведение анализа влияния изменений на эксплуатационные характеристики АС Определение технологических ограничений для проведения внедрения Организация и проведение установки дистрибутивного комплекта релиза АС на стенды для проведения тестирования, ПСИ Проведение оценки необходимости проведения нагрузочного тестирования (НТ), определение цели НТ, принятие результатов НТ Выполнение Запросов на обслуживание, Задач, Регламентных работ Решение инцидентов АС Анализ изменений АС на предмет необходимости изменения элементов мониторинга Осуществление обработки событий мониторинга Проведение разработки и актуализации планов управления мощностями Выявление рисков/проблем в работе АС и организация мероприятий по их устранению/минимизации/принятию Подготовка, настройка и эксплуатационное сопровождение сред и полигонов тестирования и ПСИ Постановка АС на мониторинг Формирование эксплуатационных требований ОЖИДАНИЯ: Эксплуатационное сопровождение тестовых сред АС Экспертиза внедрения практик DevOps на этапах CDL, CDP в командах Проведение анализа влияния изменений на эксплуатационные характеристики АС Определение технологических ограничений для проведения внедрения Организация и проведение установки дистрибутивного комплекта релиза АС на стенды для проведения тестирования, ПСИ Проведение оценки необходимости проведения нагрузочного тестирования (НТ), определение цели НТ, принятие результатов НТ Выполнение Запросов на обслуживание, Задач, Регламентных работ Решение инцидентов АС Анализ изменений АС на предмет необходимости изменения элементов мониторинга Осуществление обработки событий мониторинга Проведение разработки и актуализации планов управления мощностями Выявление рисков/проблем в работе АС и организация мероприятий по их устранению/минимизации/принятию Мы предлагаем: - масштабные и высоконагруженные проекты с использованием новых технологий; - команду профессионалов, готовых поддержать ваши инициативы; - использование Agile-методологии; - возможность обучения и сертификации за счёт компании; -возможность изучения английского языка, не выходя из офиса; - гибкий график; - трудоустройство согласно трудовому кодексу; - оклад плюс премии по результатам работы; - корпоративное обучение; - медицинскую страховку; - материальная поддержка в особых случаях; - скидки на продукты Сбербанка. Размещение офиса: Адрес офиса ул. Советская , БЦ Кронус Про Сбербанк Сбербанк — это современная техническая платформа, создающая новые способы потребления финансовых (и не только) услуг. Мы собираем лучшие технологии и управленческие методы из мировой практики, чтобы превратить «главный» банк России в передовую сервисную экосистему. Если тебе нравится эта идея, присоединяйся к нашей команде. За что сотрудники любят Сбербанк: прогрессивность: да, мы — банк со столетней историей, но одновременно и финтех-стартап с идеями о том, как изменить мир масштаб: внутри одной компании можно развиваться в любом направлении и строить карьеру с любым уровнем амбиций эффект: ты стараешься — и это видят десятки миллионов людей.",Без требований,Без обязанностей,Без условий,Agile Project Management|Оценка рисков|Linux|Английский язык|Управление рисками,28
918,918,devops,Новосибирск,165428.57142857142,210333.3333333333,ARQA Technologies,2019-10-14T12:39:30+0300,От 1 года до 3 лет,Полный день,Полная занятость,"ARQA Technologies - разработчик сложных программных решений для финансового сектора (банков, инвестиционных и управляющих компаний). Наши продукты QUIK и QORT используются более 300 клиентами в России и западных странах. Головной офис компании находится в тихом центре Новосибирска, в шаговой доступности от транспортной развязки. Города присутствия – Москва, Лондон. На данный момент, в компании работает более 200 человек. Ваши задачи: Обеспечение процессов непрерывной интеграции и доставки (Jenkins), поддержки и автоматизации работы тестовых окружений. Автоматизация внутренних процессов разработки и тестирования ПО (MS VisualStudio, TFS, SonarQube, PVS). Поддержка и сопровождение систем: Reports Service (MS), Sharepoint 2013, Jira, веб-сервисы. Мы ожидаем: Опыт администрирования систем и сетей. Умение работать с контейнеризацией (Docker) и виртуализацией. Навыки с системами контроля версий TFS, GIT. Знание баз данных (MSSQL) администрирование, поддержка и сервисы. Работа с языками vba, python, powershell, perl, java. Мы предлагаем: Официальное трудоустройство и соблюдение законодательства о труде. Ежегодные отпуска 31 календарный день, больничные и т.д. ДМС, частичную компенсацию занятий спортом. Уютный офис в тихом центре. Насыщенную корпоративную жизнь в коллективе единомышленников. Гибкий график работы. Для сотрудников со стажем - возможность получить ссуду на первоначальный взнос при покупке жилья.",Без требований,Без обязанностей,Без условий,Автоматизация,4
779,779,devops,Новосибирск,165428.57142857142,210333.3333333333,JetBrains,2019-10-07T11:01:32+0300,От 3 до 6 лет,Полный день,Полная занятость,"В IT департаменте компании JetBrains сейчас открыта вакансия DevOps Engineer (TeamCity). Основные обязанности: Участие в создании и поддержка системы управления имиджами для облачных и обычных агентов TeamCity. Поддержание фермы агентов (&gt;300 шт) TeamCity в работоспособном состоянии, обновление агентов и их имиджей. Автоматизация развертывания и обновления инфраструктуры для сервера TeamCity используемого внутри JetBrains. Cоздание инфраструктуры и организация повторяемого процесса для легкого расширения вышеупомянутых процедур автоматизации. Составление документации. Разработка вспомогательных IT сервисов. Сопровождение текущей инфраструктуры проектов. Решение задач по успешному развертыванию приложений, начиная с тестов, заканчивая продакшеном. Постоянное взаимодействие с командами проектов для обеспечения работоспособности высоконагруженных сервисов 24х7. Неотложное решение проблем, связанных с работой сервисов. Разработка новых сценариев развертывания сервисов. Требования : Опыт работы в аналогичной сфере от 2х лет. Отличное знание ОС Linux и Windows. Опыт работы с серверами приложений (Tomcat, Jetty и т.п.). Знания систем управления конфигурацией инфраструктуры (Ansible, Puppet, Chef). Опыт работы с cloud-провайдерами (Amazon, Azure). Знание систем контроля версий (Git). Работа с системами мониторинга и нотификаций. Умение писать на скриптовых языках (Python, Shell). Опыт работы с веб-серверами (Nginx, HAProxy). Существенными плюсами будут: Опыт работы с Java приложениями со стороны администратора. Понимание принципов отказоустойчивости и масштабирования приложений.",Без требований,Без обязанностей,Без условий,Без ключевых навыков,11
803,803,devops,Новосибирск,165428.57142857142,210333.3333333333,МодульБанк,2019-09-23T08:14:04+0300,От 3 до 6 лет,Полный день,Полная занятость,"Привет! Мы - Modulbank, любимый онлайн банк предпринимателей и стремительно развивающаяся финтех компания . Мы ежедневно меняем представление о банковских услугах и помогаем процветать малому и среднему бизнесу. Мы предлагаем только самые выгодные и точные решения, позволяющие начинающим предпринимателям избежать бумажной волокиты и сконцентрироваться на важном. Помимо крутых услуг и продуктов мы предоставляем клиентам по-настоящему искренний сервис и позиционируем себя как банк с человеческим лицом Ключевые задачи : Администрирование и обеспечение работоспособности программного обеспечения банка: серверные системы Linux (Debian); системы контейнеризации и системы оркестрации Docker, kubernetes; автоматизация процессов связанных с обслуживанием и разработкой ПО. ansible, bash; среды и приложения на dotnet core, dotnet framework; Будет плюсом: Серверные системы Windows Server (2016-2019); Написание скриптов PowerShell; Знание Redis, RabbitMQ, СУБД posgreSQL; Мы подойдем друг другу, если: Релевантный опыт работы от 3 лет; Глубокое знание Linux; Знание docker и kubernetes; Автоматизация регулярно повторяющихся задач (ansible, bash); Настройка высокодоступных систем PostgreSQL, Nginx, NodeJS, IIS; Сопровождение текущей инфраструктуры high-load проектов; Написанием и ведением технической документации; Знание принципов работы сетевых протоколов и принципов построения компьютерных сетей; Взаимодействием с внешними организациями в рамках решаемых задач; Умение выявлять и диагностировать проблемы сетевого и инфраструктурного уровня; Знание принципов DevOPS; Есть опыт поддержки сервисов, работающих 24/7; Мы предлагаем: Работа в крупной стабильной IT-Компании; Уютный офис в шаговой доступности от метро и дружный коллектив; Чай и кофе бесплатно; Возможность карьерного и личностного роста; Оформление по ТК РФ; Конкурентная белая заработная плата; Испытательный срок 3 месяца; Программа ДМС после прохождения испытательного срока, включая стоматологию; Корпоративная библиотека «Манн, Иванов и Фербер» - за наш счет.",Без требований,Без обязанностей,Без условий,Без ключевых навыков,25
