,Unnamed: 0,name,area,min_salary,max_salary,employer,published_at,experience,schedule,employment,description,requirements,duties,conditions,key_skills,days
925,925,devops,Новосибирск,165428.57142857142,210333.3333333333,Тинькофф,2019-09-17T20:33:05+0300,От 1 года до 3 лет,Полный день,Полная занятость,"Команда Тинькофф ищет продвинутого DevOps инженера в новосибирский центр разработки. Мы переводим свою инфраструктуру на контейнерную архитектуру и внедряем Kubernetes. Ищем человека с системным мышлением, который хочет работать на новом стеке технологий, делать исследования и выбирать оптимальные решение под поставленную задачу. Наша цель создать инфраструктуру, которая удобна в поддержке админам и позволяет командам разработки максимально быстро доставлять изменения нашим пользователям. А это значит удобное логирование и мониторинг микросервисных приложений, высокий уровень автоматизации и отказоустойчивости. Тебе предстоит: Работать с высоконагруженными системами Внедрять Kubernetes в боевых ДЦ Компании Помогать командам разработки мигрировать на новую инфраструктуру Разрабатывать инфраструктурный софт Автоматизировать рутинные операции администрирования Мы ждем от тебя: Опыт системного администрирования ОС Linux Обязательно знание одного из языков Python, Go Понимание принципов контейнеризации (Docker) Понимание принципов непрерывной интеграции От нас: Комфортные условия труда, хорошо оборудованное рабочее место с возможностью выбора любого ПК или ноутбука; Добровольное медицинское страхование (ДМС); Офис в центре города в 10 мин. от м. пл. Ленина в БЦ “Кронос” или Академгородок, ул.Николаева; Компенсация на выбор: обедов, такси, парковочного места; Компенсация 50% на спорт; Скидка 30% на КАСКО в СК Тинькофф; Софинансирование обучения (оплата конференций, курсов)",Без требований,Без обязанностей,Без условий,NoSQL|Big Data|hadoop|Aerospike|MongoDB,30
396,396,devops,Новосибирск,165428.57142857142,210333.3333333333,Positive Technologies,2019-10-01T14:59:29+0300,От 1 года до 3 лет,Полный день,Полная занятость,"О компании Positive Technologies – разработчик ПО в сфере информационной безопасности международного уровня. О продукте Мы создаем систему сбора и анализа данных об объектах мира киберугроз: зловредах, ботнетах, хакерских группировках, фишинговых доменах и т.д.. В её задачи входит: Автоматический сбор информации из открытых и коммерческих источников; Регулярное обновление данных об имеющихся сущностях; Анализ, классификация и связывание полученной информации (в перспективе - средствами машинного обучения); Предоставление удобного API другим продуктам для внесения и получения данных; Систему распространения баз данных индикаторов угроз; Предоставление удобного интерфейса сотрудникам отделов реагирования и исследования угроз; Стек основных технологий: Debian, Go, Ansible, Docker, PostgreSQL. Чем предстоит заниматься: Автоматизация деплоя для разных окружений. Мы используем Terraform и Ansible; Разработкой CI/CD pipeline для выпуска продукта; Развитие мониторинга инфраструктурных и бизнес метрик на Prometheus/Grafana/ELK; Разработкой инсталлятора для коробочной версии продукта; Администрирование инфраструктуры: решение возникающих проблем, масштабирование и обеспечение отказоустойчивости, балансировка нагрузки и резервное копирование; Обмен опытом и решениями с инфраструктурными командами соседних проектов с аналогичным стеком технологий; В обозримой перспективе использование облачных площадок для развертывания. Чем НЕ придется заниматься: - Поддержкой общих ресурсов внутри компании (Gitlab, Jira, Confluence, ...) - для этого есть отдельная команда; - Перескакивать с проекта на проект для тушения пожаров - мы ищем кандидата под конкретный продукт. Что необходимо кандидату: Понимать жизненный цикл разработки ПО и принципы CI/CD; Опыт системного администрирования Linux обязателен; Разделять подход “infrastructure as a code”; Опыт работы с системами configuration management Умение писать на bash и, желательно, python; Опыт работы с системами виртуализации; Навык работы с docker, умение упаковывать любой софт в контейнер; Опыт организации мониторинга инфраструктуры. Что взамен: Уютный офис недалеко от м. Площадь Гарина-Михайловского или в Академгородке, возможность удалённой работы обсуждаема; Официальное трудоустройство и белая зарплата; ДМС со стоматологией; Шесть недель оплачиваемого отпуска; Можно самому выбрать, во сколько начинается твой рабочий день.",Без требований,Без обязанностей,Без условий,Без ключевых навыков,17
889,889,devops,Новосибирск,165428.57142857142,210333.3333333333,Студия Разработки,2019-10-11T14:24:13+0300,От 3 до 6 лет,Удаленная работа,Полная занятость,"У нас более 30 разных проектов, по которым постоянно разрабатывается новый функционал и производится интеграция с разными сервисами. Один из проектов – это система управления бизнес-процессами на базе микросервисной архитектуры. Интересные задачи: · Установка среды публикации на существующих и новых проектах компании. · Разработка процесса публикации проектов для разработчиков. · Контроль публикации изменений проектов. · Разработка среды тестирования проектов. · Консультирование разработчиков и администраторов системы. Что ждём от кандидата: · Общий опыт разработки - 3+ лет · Настройка репозитория GIT, знания GIT-flow · Разворачивание и настройка любой среды CI/CD (плюсом знание TeamCity) · Умение работать как на новых так и на уже существующих проектах · Docker · OS Windows. Unix · Bash &amp; shell script · Желательно (будут дополнительным плюсом): · MS Build &amp; Deploy, знание архитектуры C# проектов и .NET архитектуры · Опыт работы с MS SQL 2016 · Виртуализация HyperV / VMWare · Опыт администрирования Unix Windows систем, Exchange, Zabbix, HAproxy, RabbitMQ Предлагаем: · Возможность профессионального и карьерного развития в компании. · Официальное трудоустройство согласно ТК РФ с первого дня. · Заработная плата по договоренности · Удаленная работа",Без требований,Без обязанностей,Без условий,Без ключевых навыков,7
496,496,devops,Новосибирск,165428.57142857142,210333.3333333333,ARQA Technologies,2019-10-14T12:39:30+0300,От 1 года до 3 лет,Полный день,Полная занятость,"ARQA Technologies - разработчик сложных программных решений для финансового сектора (банков, инвестиционных и управляющих компаний). Наши продукты QUIK и QORT используются более 300 клиентами в России и западных странах. Головной офис компании находится в тихом центре Новосибирска, в шаговой доступности от транспортной развязки. Города присутствия – Москва, Лондон. На данный момент, в компании работает более 200 человек. Ваши задачи: Обеспечение процессов непрерывной интеграции и доставки (Jenkins), поддержки и автоматизации работы тестовых окружений. Автоматизация внутренних процессов разработки и тестирования ПО (MS VisualStudio, TFS). Поддержка и сопровождение систем:, таких как Sharepoint 2013. Мы ожидаем: Опыт администрирования систем и сетей. Навыки с системами контроля версий TFS, GIT. Знание баз данных (MSSQL) администрирование, поддержка и сервисы. Работа с языками vba, С# (в т.ч. LINQ). Опыт работы html, css. Базовое понимание протокола IMAP. Мы предлагаем: Официальное трудоустройство и соблюдение законодательства о труде. Ежегодные отпуска 31 календарный день, больничные и т.д. ДМС, частичную компенсацию занятий спортом. Уютный офис в тихом центре. Насыщенную корпоративную жизнь в коллективе единомышленников. Гибкий график работы. Для сотрудников со стажем - возможность получить ссуду на первоначальный взнос при покупке жилья.",Без требований,Без обязанностей,Без условий,DevOps,4
181,181,devops,Новосибирск,165428.57142857142,120000.0,Брокеркредитсервис,2019-09-25T13:16:57+0300,От 1 года до 3 лет,Полный день,Полная занятость,"Мы занимаемся развитием цифрового брокерского бизнеса, в международной финансовой компании, для наших многочисленных front приложений, мы разрабатываем собственный высоконагруженный backend на микросервисной архитектуре используя один из топовых стеков Java. Предлагаем инициативному профессионалу присоединиться к команде одного из самых крупных проектов для решения задач DevOps инженера. Для нас DevOps инженер в первую очередь участник команды, поэтому мы ожидаем ежедневное участие в daily meetings, обсуждение текущих и будущих задач проекта, предложений по улучшению инфраструктуры и процессов. Ждем от тебя: Отличное знание Linux-подобных систем; Знание сетевых технологий(TCP/IP, HTTP(S), TLS… ); Технологии виртуализации серверов; Docker на продвинутом уровне; Kubernetes\Openshift минимально на базовом уровне; PostgreSQL, MongoDB; GitLab; Скриптовые языки; CI\CD pipeline на GitLab, Jenkins или Bamboo. Будет плюсом: Опыт поддержки Java-приложений; Понимание принципов отказоустойчивости и масштабируемости приложений; Опыт автоматизации задач администрирования внутренних процессов разработки и тестирования; Инструменты управления конфигурацией; Helm charts; RabbitMQ, Kafka; ELK, Grafana, Prometheus. Преимущества работы у нас: Дружная команда профессионалов (разработчики, QA инженеры, аналитики, product owner); Видимый результат работы (фронт приложения проекта публикуются в web, play market, app store); Современное, новое, рабочее место по выбору сотрудника, mac os или ubuntu, с выбором периферии; Обучение, участие в конференциях; Офис в центре города со свежим ремонтом и кухней; Белая заработная плата без задержек.",Без требований,Без обязанностей,Без условий,Linux|Kubernetes|Docker|GitLab,23
1061,1061,devops,Новосибирск,175000.0,210333.3333333333,Creative Mobile,2019-10-14T20:43:06+0300,От 1 года до 3 лет,Полный день,Полная занятость,"Мы - Creative Mobile являемся независимым разработчиком игр. Основанная в 2010 году и базирующаяся в Таллинне, наша компания определила новый жанр мобильных игр и превратилась в студию, признанную во всём мире. Игры, опубликованные Creative Mobile, открыли для себя более чем 400 миллионов игроков по всему миру. Наша миссия — быть прекрасным домом для талантов мирового класса и создавать отличные игры. Мы полны идей, активно развиваемся и сейчас ищем в свою команду профессионального и амбициозного инженера, готово быть у истоков направления DevOps. Если Вы: хотите жить в стране ТОП-5 с самым чистым воздухом в мире; готовы присоединиться к компании ТОП-ЗО лучших работодателей Эстонии 2019 года; и самое главное - не мыслите свою жизнь без DevOps, Вам точно стоит откликнуться на вакансию :) Нашему будущему коллеге мы готовы предложить: поддержку и развитие инфраструктуры серверных приложений; обеспечение непрерывной работоспособности системы; мониторинг и выявление узких мест в работе системы; выбор и тестирование новых технологий; активное взаимодействие с командами разработки. Мы ожидаем от тебя: 3+ успешного опыта работы в качестве инженера DevOps; отличное знание OS Linux; понимание устройства серверной инфраструктуры, опыт ее настройки и поддержки; хорошее знание Bash и любого скриптового языка; опыт работы с AWS, Docker; хороший письменный и устный английский язык (на уровне чтения профессиональной документации и литературы). Мы придём в восторг, если у тебя есть: высшее образование в области IT, физики, математики или эквивалентный опыт (например, 3000+ MMR в DotA или Clash Royale); опыт работы с ELK, Kafka, Clickhouse, Redis, Prometeus, Graphite, Jenkins. Чтобы работа спорилась, тебе понадобятся: умение работать как самостоятельно, так и в команде; способность и желание разбираться с новыми технологиями и, возможно, с неизвестными проблемами; стрессоустойчивость, аккуратность и ответственность. Мы хотим предложить тебе: официальное трудоустройство; интересную работу, полную вызовов — возможность вносить свой вклад в продукты, которыми наслаждаются миллионы игроков по всему миру; профессиональное сообщество внутри компании, чтобы делиться самым интересным с коллегами по цеху; возможность 20% своего рабочего времени уделять другим интересным проектам внутри компании; возможность учиться и личную программу развития; работу в успешной студии с огромным послужным списком, который включает в себя несколько записей в глобальном рейтинге TOP50; работу в международной команде мирового класса, которая поможет улучшить свой набор навыков и сеть контактов; культуру открытости, прозрачности и здравого смысла; приятные и полезные бонусы: обучение, свежие фрукты, вкусный кофе и прочие приятности; разумеется, переезд в г. Таллинн и подготовку всех необходимых документов мы берем на себя:) Почему Эстония? в Эстонии безопасно жить и работать, поддерживая отличный баланс между работой и личной жизнью; около 70% населения владеет русским языком, как родным или вторым языком; практически все государственные услуги страны предоставляются в электронном виде, всё делается быстро и комфортно; Эстония — первая страна в мире, представившая доступ к своим электронным услугам иностранцам; по данным ВОЗ, Эстония — страна с самым чистым воздухом в мире (а также, Эстония входит в десятку самых зеленых стран).",Без требований,Без обязанностей,Без условий,Без ключевых навыков,3
